doi,year,in_PURE,is_open_data_oddpub,open_data_manual_check,open_data_category,open_data_category_manual,is_open_code_oddpub,open_code_manual_check,open_code_category_manual,open_data_statements,open_code_statements
10.1111/eci.13162,2019,TRUE,TRUE,TRUE,general-purpose repository,general-purpose repository,TRUE,TRUE,other repository/website,the survey instrument (available here: https​://osf.io/zkwgf/​) consisted of 10 multiple choice questions presented on a single webpage.;     the survey invitation e‐mail (available here: https​:// osf.io/b9sdv/​) was dispatched from the e‐mail address of the first author (teh) using the survey software sosci survey  hardwicke and ioannidis  bullet points • petitions have a long history of being used for political social ethical and injustice issues; however it is unclear how/whether they should be implemented in scientific argumentation.;     the original version and revised version are available at https​://doi.org/10.31222/​osf.io/73xm5​.;     data availabilit y statement the study protocol was pre‐registered on 4 april 2019 and is available at https​://osf.io/hbkj3/​.;     data materials and analysis scripts related to this study are publicly available at https​ ://osf.io/8aenp/​ .,data materials and analysis scripts related to this study are publicly available at https​ ://osf.io/8aenp/​ .;     to facilitate reproducibility the analysis script is available in a code ocean container (https​ ://doi.org/10.24433/​ co.39125​ 58.v1) which re‐creates the software environment in which the original analyses were performed.
10.1111/epi.16330,2019,TRUE,TRUE,FALSE,supplement,n/a,TRUE,FALSE,,following a recovery period of 2 weeks se was induced as described by di liberto et al17; see data s1 for a more detailed description of both the implantations and the induction of se.,available at: https​ ://github.com/taiyu​ n/ corrplot 24.
10.1111/jcmm.14137,2019,TRUE,TRUE,FALSE,supplement,n/a,FALSE,,,refer to data s1 for qpcr primers.  topathy.14 consequently these results suggest that there may be previously unrecognized mechanisms by which mfs disease progression is regulated and potential etiologies of mfs need further examination.;     refer to data s1 for antibody details.,
10.1111/jsr.12895,2019,TRUE,TRUE,FALSE,supplement,n/a,FALSE,,,in controls transitions between n1 and n2 were less salient  transitions regarding age bmi and gender are presented in the sup‐ plement (data s1).;     a complete comparison between the development cohort and the validation cohort is presented in the supplement (data s2).,
10.1111/jth.14589,2019,TRUE,TRUE,FALSE,supplement,n/a,FALSE,,,subsequently the pemb‐qol was validated in different  definitions used for risk stratification and laboratory measurements  cohorts and languages.1618-21 however limitations of these studies  are provided in the data s1.;     2829 the detailed statistical approach is provided in the data s1.,
10.1111/psyp.13322,2019,TRUE,TRUE,TRUE,general-purpose repository,general-purpose repository,TRUE,TRUE,github,|  2.9  code and data availability  the code of our analysis computed in the r statistical environment (v3.4.3) with rstudio version 1.0.136 (rstudio team 2016) is available on github (https://github.com/ skunzendorf/0303_incasi).;     the data that support the findings of this study are also available on github.,|  2.9  code and data availability  the code of our analysis computed in the r statistical environment (v3.4.3) with rstudio version 1.0.136 (rstudio team 2016) is available on github (https://github.com/ skunzendorf/0303_incasi).;     the data that support the findings of this study are also available on github.
10.1126/sciadv.aaw4304,2019,TRUE,TRUE,TRUE,field-specific repository,field-specific repository,FALSE,,,the ms data have been deposited to the proteomexchange consortium (http://proteomecentral.proteomexchange.org) via the pride partner repository with the dataset identifier pxd011359.,
10.1126/science.aau0236,2019,TRUE,TRUE,TRUE,field-specific repository,field-specific repository,FALSE,,,the raw read data for transcriptome assemblies have been deposited at the ncbi sequencing read archive under accession number prjna394865.,
10.1126/science.aau8475,2019,TRUE,TRUE,TRUE,field-specific repository,field-specific repository,FALSE,,,data and materials availability: the rnaseq data are available in the gene expression omnibus (geo) database (www.ncbi.nlm.nih.gov/geo) under accession number gse124827.,
10.1126/science.aaw1629,2019,TRUE,TRUE,TRUE,field-specific repository,field-specific repository,FALSE,,,data are deposited in geo under accession number gse121101.,
10.1126/sciimmunol.aaw1941,2019,TRUE,TRUE,TRUE,supplement,supplement,FALSE,,,table s1. excel file with raw data,
10.1126/scisignal.aao5820,2019,TRUE,TRUE,TRUE,field-specific repository,field-specific repository,FALSE,,,the sequencing data were deposited in the arrayexpress database (www.ebi.ac.uk/arrayexpress) under the following accession numbers: e-mtab-6064 (bulk rna-seq) and e-mtab-6075 (single-cell rna-seq).,
10.1126/scisignal.aav4203,2019,TRUE,TRUE,TRUE,"field-specific repository, supplement",field-specific repository,FALSE,,,data and materials availability: the atomic coordinates and structure factors have been deposited in the pdb under accession code 6gyh.     table 1 summarizes the statistics for crystallographic data,
10.1126/scitranslmed.aaw8513,2019,TRUE,TRUE,TRUE,"field-specific repository, general-purpose repository","field-specific repository, general-purpose repository",FALSE,,,idat files of the samples analyzed in this paper have been deposited in geo (gse124052). the code and the data necessary to reproduce the main analyses from this paper are available at http://doi.org/10.6084/m9. figshare.8182376.,
10.1128/JCM.00352-19,2019,TRUE,TRUE,TRUE,"field-specific repository, supplement, data availability statement",field-specific repository,FALSE,,,the its sequences of newly sequenced strains were deposited in genbank under accession numbers mk806589 to mk806666. jcm.asm.org 6   trichophyton rubrum complex  journal of clinical microbiology  downloaded from http://jcm.asm.org/ on june 11 2020 at charite-universitaetsmedizin berlin medical library  fig 1 medium-joining haplotype network of the t. rubrum complex generated from the its sequences of 175 strains.     file 1 pdf ﬁle 0.1 mb. supplemental file 2 xlsx data availability. the its sequences of newly sequenced strains were deposited in genbank under accession numbers mk806589,
10.1128/JCM.00466-19,2019,TRUE,TRUE,TRUE,"field-specific repository, data availability statement",field-specific repository,FALSE,,,in addition to human and bacterial reads simulated sequences of four viruses torque teno virus (ttv; ncbi accession number nc_015783.1) human herpesvirus 1 (also called herpes simplex virus 1 [hsv-1]; ncbi accession number nc_001806.2) measles virus (mev; ncbi accession number nc_001498.1) and a novel avian bornavirus (nabv; ncbi accession number jn014950.1) were included in different numbers and with different levels of similarity to known viruses present in databases (table 2).;     the data set used in this study has been uploaded to the european nucleotide archive with the study accession number prjeb32470.;     participants 5 and 12 used viral sequences from august 2019 volume 57 issue 8 e00466-19  jcm.asm.org 6   compare in silico virus proﬁciency test  journal of clinical microbiology  ncbi genbank only while participant 7 also included a database for human-pathogenic viruses (vipr) (https://www.viprbrc.org/brc/home.spg?      availability of data. the data set used in this study has been uploaded to the european nucleotide archive with the study accession number prjeb32470,
10.1128/JVI.02238-18,2019,TRUE,TRUE,TRUE,field-specific repository,field-specific repository,TRUE,TRUE,github,all unpublished german subtype a sequences used in this study were uploaded to genbank with jvi.asm.org 14   hiv-1 subtype a in germany  journal of virology  accession numbers mf124612 to mf124794.;     subtype c sequences used as outgroup for ml analyses were also uploaded to genbank with accession numbers mk250696 to mk250705.,all changes are implemented and freely available in the version published at https://github.com/ kavehyousef/code.
10.1136/bmj.l5101,2019,TRUE,TRUE,TRUE,"general-purpose repository, data availability statement",general-purpose repository,FALSE,,,data sharing: the statistical analysis plan is available at https:// doi.org/10.6084/m9.figshare.5375026.v1.     data sharing: the statistical analysis plan is available at https:// doi,
10.1136/bmjopen-2018-027563,2019,TRUE,TRUE,FALSE,data availability statement,n/a,FALSE,,,data availability statement data are available on reasonable request. landgraf p et al. bmj open 2019;9:e027563. doi,
10.1136/rmdopen-2019-001017,2019,TRUE,TRUE,FALSE,data availability statement,n/a,FALSE,,,data sharing criteria eligible studies and process for requesting access can be found at: https://www.​clin​ical​stud​ydat​arequest.​com. burmester gr et al. rmd open 2019;5:e001017. doi,
10.1152/ajprenal.00232.2019,2019,TRUE,TRUE,FALSE,general-purpose repository,n/a,FALSE,,,for an overview of all primary antibodies used in this study and information on antibody validation see supplemental table s1 (all supplemental data are provided online at https://doi.org/10.6084/ m9.figshare.8104793.v1).;     s1 available online at https://doi.org/10.6084/m9.figshare.9897836.v1).;     dct profiles are indicated by dashed red lines.  10 µm spak  10 µm ps-spak/osr1  ns/lk 24 h 10 µm wnk4  10 µm spak  10 µm ps-spak/osr1  ns/lk 48 h 10 µm wnk4  10 µm spak  10 µm ps-spak/osr1  ns/lk 72 h 10 µm  b  wnk4  10 µm spak  10 µm ps-spak/osr1  ns/hk 48 h after ns/lk 48 h 10 µm  (hdac6; supplemental movie s1 available online at https:// doi.org/10.6084/m9.figshare.8104790.v2) and p62/sequestosome 1 (supplemental movie s2 available online at https:// doi.org/10.6084/m9.figshare.8104796.v1) or the intermediate filament vimentin (supplemental movie s3 available online at https://doi.org/10.6084/m9.figshare.8104787.v1) which is enriched around aggresomes.;     s2 available online at http://doi.org/10.6084/m9.figshare.9897842).;     s3 available online at https://doi.org/ 10.6084/m9.figshare.9897851.v1).,
10.1155/2019/3784172,2019,TRUE,TRUE,FALSE,field-specific repository,n/a,FALSE,,,in addition fndc expression data from publicly available gene expression omnibus (geo) data sets (gds4296 gds4515 and gds5232) were analyzed.,
10.1155/2019/5640685,2019,TRUE,TRUE,FALSE,general-purpose repository,n/a,TRUE,FALSE,,data availability the integrated data repository toolkit which has been analyzed during the current study is available in the repository of the university of goettingen and on github https:// community.i2b2.org/wiki/display/idrt/310.,data availability the integrated data repository toolkit which has been analyzed during the current study is available in the repository of the university of goettingen and on github https:// community.i2b2.org/wiki/display/idrt/310.
10.1158/0008-5472.CAN-18-3438,2019,TRUE,TRUE,TRUE,field-specific repository,field-specific repository,FALSE,,,microarray data are available at arrayexpress under the accession number e-mtab-7134.,
10.1158/1535-7163.MCT-19-0045,2019,TRUE,TRUE,FALSE,supplement,supplement,FALSE,,,for each drug we ﬁtted 248 single mutation models and on average 13000 mutation pair models with and without mutation–mutation interaction (supplementary data s1).,Supplementary Data S1 - R script for the identification of mutation-mutation interactions with respect to drug response. 
10.1158/1940-6207.CAPR-19-0192,2019,TRUE,TRUE,FALSE,supplement,n/a,FALSE,,,the analysis of all samples with the cobas hpv test revealed no statistical difference in invalid hpv testing result rates between the two groups (supplementary data s1).,
10.1158/2326-6066.CIR-19-0567,2019,TRUE,TRUE,TRUE,field-specific repository,field-specific repository,FALSE,,,sequences were deposited into the sra under bioproject number prjna590799.,
10.1161/CIRCULATIONAHA.118.037777,2019,TRUE,TRUE,FALSE,data availability statement,n/a,TRUE,FALSE,,data availability reusability and analytic reproducibility: evaluating the impact of a mandatory open data policy at the journal cognition. r soc open sci. 2018;5:180448. doi,(2015)1  spss code  https://www.ctspedia.org/wiki/pub/ctspedia/ templatetesting/dotplot_spss.pdf23  r code  blog post by jamie ashander25 blog post by ben marwick26  web-based tool (for independent or clustered/grouped data; shiny app)*  https://lancs.shinyapps.io/toxbox28  web-based tool (for independent data; shiny app)  http://boxplot.tyerslab.com/15  r code  blog post by jamie ashander25  violin plots  web-based tool (for independent data; shiny app)  https://interactive-graphics.shinyapps.io/violin/24  paired data: spaghetti plots and dot plots of change scores  excel templates graphpad prism instructions  supplemental files of weissgerber et al.
10.1161/CIRCULATIONAHA.119.039596,2019,TRUE,TRUE,TRUE,field-specific repository,field-specific repository,FALSE,,,methods data and software availability the raw data are available on the gene expression omnibus (geo submission: gse131112 gse123018 gse131111).,
10.1161/JAHA.118.010647,2019,TRUE,TRUE,TRUE,general-purpose repository,general-purpose repository,FALSE,,,methods deidentiﬁed data were deposited on the open science framework website.16  participants a convenience sample of pregnant women in the third trimester were recruited through the mayo clinic department of obstetrics and gynecology during prenatal appointments or following admission to the family birth center.;     available at: https://osf.io/wfcv9/.,
10.1161/JAHA.119.012665,2019,TRUE,TRUE,FALSE,supplement,n/a,FALSE,,,accompanying data s1 tables s1 through s8 and figures s1 through s9 are available at https://www.ahajournals.org/doi/suppl/10.1161/jaha.119.012665 correspondence to: ludwig schlemm klinik und hochschulambulanz f€ur neurologie charit_x005F_x0002_e—universit€atsmedizin berlin charit_x005F_x0002_eplatz 1 10117 berlin germany.;     a detailed description of the model in mathematical terms is available in data s1 with table s3.  cutoff of 20 minutes12 in the base case analysis and performed additional univariate analyses to explore the impact of different time limits.;     transport times between 2 points in the abstract scenarios were ﬁrst calculated using a euclidean metric and then transformed to roadbased transport times according to 2 nonlinear relationships estimated from the speciﬁc real-world geographic scenarios (data s1 figure s5).;     journal of the american heart association  4   triage strategy paradigms for suspected stroke  schlemm et al  downloaded from http://ahajournals.org by on june 11 2020  for analysis a total of 10 000 positions were sampled from each geographic scenario (data s1).;     data s1 – supplemental methods and results ...............................................................................;     data s1 – supplemental methods and results 1.1 mathematical description of the model an outline of the probabilistic model used in our study is presented in figure 1 and the methods section in the main text.,
10.1172/jci.insight.127130,2019,TRUE,TRUE,TRUE,"field-specific repository, general-purpose repository, data availability statement",general-purpose repository,FALSE,,,whole-genome sequencing data of neuroblastoma tumors are deposited at the european genome-phenome archive (https://ega-archive.org/) under accession number egas00001308 (21). analyzed data are openly available at the zenodo digital repository (doi:10.5281/zenodo.2567654).     availability of data and materials. analyzed data are openly available at the zenodo,
10.1172/jci.insight.128435,2019,TRUE,TRUE,TRUE,"field-specific repository, data availability statement",field-specific repository,FALSE,,,the rna-seq data reported in this study are available from the national center for biotechnology information’s gene expression omnibus with accession code gse132148.      data deposition. the rna-seq data reported in this study are available from the national center for biotechnology information’s gene expression omnibus with accession code gse132148,
10.1172/jci.insight.131092,2019,TRUE,TRUE,TRUE,field-specific repository,field-specific repository,FALSE,,,the full raw and processed data were submitted to the arrayexpress database of the european bioinformatics institute and may be found through accession number e-mtab-7869.,
10.1172/JCI125372,2019,TRUE,TRUE,TRUE,field-specific repository,field-specific repository,FALSE,,,the normalized microarray data that support the finding of this study have been deposited in arrayexpress with the accession code e-mtab-7741.,
10.1172/JCI98929,2019,TRUE,TRUE,TRUE,field-specific repository,field-specific repository,FALSE,,,the rna-seq microarray data were deposited in the ncbi’s gene expression omnibus database (geo gse124286) and are available at https://www.ncbi.nlm.nih.gov/geo/query/acc.cgi?,
10.1177/0271678X19827944,2019,TRUE,TRUE,TRUE,general-purpose repository,general-purpose repository,TRUE,TRUE,github,the data and analysis code are available at https://github.com/ahmedaak/qsm_oef.,the data and analysis code are available at https://github.com/ahmedaak/qsm_oef.
10.1182/blood-2018-08-871293,2019,TRUE,TRUE,TRUE,field-specific repository,general-purpose repository,FALSE,,,the data have been deposited in  1490  blood® 28 march 2019 | volume 133 number 13  arrayexpress 9 at european molecular biology laboratory– european bioinformatics institute under accession number e-mtab-6896.  von hoff et al  downloaded from https://ashpublications.org/blood/article-pdf/133/13/1489/1556983/blood871293.pdf by charite campus charite mitte user on 12 june 2020  p105  l428 km-h2 hdlm-2 l540 u-ho1 sup-hd1  l1236 eta  c  sup:  nab +  ut  sup  igg +  emsa  ut  fc  b  72 extracellular proteins including lta  mass spectrometry   ltag3_4  ltag3_3  ltag2_2  ltag2_1  l1236 v2  b l1236 wt  a  lta p105  l1236 v2 kda 25  il6  p100  il13  ccl2  100 55  p50  l1236 ltag2_1 csf2  ccl5  ccl17  lta  100 55  p52  c  70  1.2  relative normalized expression  p65  70  crel jak2  130  p-stat6  100 40  emsa  ldh-a  nf-b  1.0 0.8 0.6 0.4 0.2 0.0  cd40  cd80  cd44  ccr4 v2  d  icam1 g2_1  vcam1  g2_2  g3_3  il13ra1  il4r  cd274 pdcd1lg2  g3_4  e count  15k 10k  spearman correlation  500  1 0.5  0 1  2  3  4  10 10 10 10 10  5  pd-l1  0 l1236 v2  −0.5  ltag2_1  −1  ltag3_4  lineage  15k  myeloid  10k  lta log2 ko / wt  count  lymphoid  0  500  −2 −4  0  −6  101 102 103 104 105  −8  pd-l2  f average gene expression in cells expressing the gene  cell_type lta  tnfrsf1a  tnfrsf1b  cd14+ monocytes  tnfrsf14  nk cells fhit+lef1+ccr7+ldhb+  1.5  cd8 t cells cd4 t cells  1.3  cd79a+ighd+tcl1a+ ms4a1+ighm+igkc+  1.1  b cells gnly+ccl4+prf1+fgfbp2+  0.00  0.25  0.50  0.75  0.00  0.25  0.50  0.75  0.00  0.25  percentage of cells expressing the gene  0.50  0.75  0.00  0.25  0.50  0.75  fcgr3a+ monocytes megakaryocytes  figure 2.;     data have been deposited in the arrayexpress at european molecular biology laboratory–european bioinformatics institute (accession number e-mtab-6896).,
10.1182/blood-2018-12-889725,2019,TRUE,TRUE,TRUE,field-specific repository,general-purpose repository,FALSE,,,the rnaseq data reported in this article have been deposited in the gene expression omnibus database (accession number gse123071).,
10.1182/bloodadvances.2019000449,2019,TRUE,TRUE,FALSE,data availability statement,n/a,FALSE,,,data sharing contact the corresponding authors. 12 november 2019 x volume 3 number 21  3393  downloaded from https://ashpublications.org/bloodadvances/article-pdf/3/21/3393/1506192,
10.1186/s11556-019-0221-6,2019,TRUE,TRUE,FALSE,data availability statement,n/a,FALSE,,,availability of data and materials on request (corresponding author). ethics approval and consent to participate ethical guidelines were followed and clearance from the ethics committee of the german psychological society (jz062009,
10.1186/s12859-019-2688-6,2019,TRUE,TRUE,FALSE,general-purpose repository,n/a,TRUE,TRUE,github,availability of data and materials the decomptumor2sig package is freely available at the project website http://rmpiro.net/decomptumor2sig/ or at github (https://github.com/ rmpiro/decomptumor2sig) and has been accepted for inclusion in bioconductor.,availability of data and materials the decomptumor2sig package is freely available at the project website http://rmpiro.net/decomptumor2sig/ or at github (https://github.com/ rmpiro/decomptumor2sig) and has been accepted for inclusion in bioconductor.
10.1186/s12859-019-2792-7,2019,TRUE,TRUE,FALSE,general-purpose repository,general-purpose repository,TRUE,TRUE,github,page 10 of 11  availability of data and materials the simulated data generated and analysed during the current study are available in the github repository https://github.com/allizwell2018/ heritability_github.,page 10 of 11  availability of data and materials the simulated data generated and analysed during the current study are available in the github repository https://github.com/allizwell2018/ heritability_github.
10.1186/s12859-019-3043-7,2019,TRUE,TRUE,TRUE,general-purpose repository,supplement,TRUE,TRUE,github,availability of data and materials the software package has been submitted to bioconductor ([25]) and is available from github (https://github.com/bihealth/sigspack).,availability of data and materials the software package has been submitted to bioconductor ([25]) and is available from github (https://github.com/bihealth/sigspack).
10.1186/s12864-018-5376-4,2019,TRUE,TRUE,FALSE,general-purpose repository,n/a,TRUE,TRUE,github,availability of data and materials source code and executable can be downloaded from the gopher github page at https://github.com/thejacksonlaboratory/gopher.,source code and a precompiled executable can be downloaded from the gopher github page at https://github.com/ thejacksonlaboratory/gopher.;     source code precompiled executables and detailed documentation are available on the gopher github page at https://github.com/ thejacksonlaboratory/gopher.;     the source code of gopher can be downloaded from the gopher github page: https://github.com/thejacksonlaboratory /gopher from here users can also download a precompiled application.;     availability of data and materials source code and executable can be downloaded from the gopher github page at https://github.com/thejacksonlaboratory/gopher. the score is then calculated as the area under the curve of the probability density function within  • project name: gopher: generator of probes for capture hi-c experiments at high resolution • project home page: https://github.com/ thejacksonlaboratory/gopher • operating system: platform independent • programming language: java • other requirements: java 1.8 • license: jax • any restrictions to use by non-academics: license needed  additional file additional file 1: supplementary figures for the distribution of mapped hi-c interaction read pairs within digests an exploration of alignability thresholds heterogeneous definitions of viewpoints and explanation of gopher’s alltracks.bed file.
10.1186/s12872-019-1187-z,2019,TRUE,TRUE,TRUE,supplement,supplement,TRUE,FALSE,,additional file 1: supplemental tables. (xlsx,statistical analyses  individual participant-level and summary-level data  participating studies (additional file 1: table s2) provided analyses of individual participant-level data (ipd) based on a common analysis script (available from afs) submitting summary estimates to the ucl analysis centre.
10.1186/s12885-019-5537-0,2019,TRUE,TRUE,FALSE,supplement,n/a,FALSE,,,xlsx 1673 kb) additional file 3,
10.1186/s12885-019-5946-0,2019,TRUE,TRUE,FALSE,supplement,n/a,FALSE,,,xlsx 20 kb) additional file 2,
10.1186/s12885-019-6270-4,2019,TRUE,TRUE,TRUE,supplement,supplement,FALSE,,,additional file 2: supplementary tables. description of data: tables with raw data,
10.1186/s12888-019-2026-6,2019,TRUE,TRUE,FALSE,supplement,n/a,FALSE,,,additional file 2: table s2. predictive variables of depression outcome. (xlsx,
10.1186/s12903-019-0795-4,2019,TRUE,TRUE,TRUE,supplement,supplement,FALSE,,,all data were calculated from the primary data reported in additional file 1,
10.1186/s12909-019-1600-4,2019,TRUE,TRUE,FALSE,supplement,n/a,FALSE,,,additional file 1: supversisor version (xlsx,
10.1186/s12913-019-4585-0,2019,TRUE,TRUE,FALSE,data availability statement,n/a,FALSE,,,availability of data and materials not applicable ethics approval and consent to participate this project was approved by the ethics committees at charité – universitätsmedizin berlin (ea2/192/17) and the medical association of north rhine (2017429,
10.1186/s12920-018-0471-6,2019,TRUE,TRUE,FALSE,field-specific repository,n/a,FALSE,,,for further analysis all variants that have been reported in a homozygous state in more than three individuals in the cohorts of the 1kgp project exac gnomad or variants that have been classified as benign in clinvar were removed.,
10.1186/s12938-019-0657-y,2019,TRUE,TRUE,TRUE,"general-purpose repository, data availability statement",general-purpose repository,FALSE,,,availability of data and materials the dataset supporting the conclusions of this article (i.e. all aneurysm dome geometries) is available in the figshare repository https​://doi.org/10.6084/m9.figsh​are.74850​35 (https​://figsh​are.com/s/a98c5​87dc3​5b79c​27384​).     availability of data and materials the dataset supporting the conclusions of this article (i.e. all aneurysm dome geometries) is available in the figshare,
