doi,year,is_open_data_oddpub,open_data_manual_check,open_data_category,open_data_category_manual,is_open_code_oddpub,open_code_manual_check,open_code_category_manual,open_data_statements,open_code_statements
10.7554/eLife.56954,2020,TRUE,TRUE,"general-purpose repository, supplement",general-purpose repository,TRUE,TRUE,github,3d-skeletonization and analysis of connectome and rna-seq data was carried out with custom software written in matlab (mathworks) which is available at http://github.com/aclinlab.   file 2. details of statistical analysis.  . transparent reporting form  data availability all data,3d-skeletonization and analysis of connectome and rna-seq data was carried out with custom software written in matlab (mathworks) which is available at http://github.com/aclinlab.;     custom software is available at https:// github.com/aclinlab/amin-et-al-2020 and https://github.com/aclinlab/calcium-imaging.
10.1016/j.chom.2017.04.004,2017,TRUE,TRUE,"field-specific repository, data availability statement",field-specific repository,FALSE,NA,NA,pasteur 1173p2 expressing gfp (gfp-bcg)  laboratory of douglas young  n/a  chemicals peptides and recombinant proteins recombinant mouse interferon-gamma  r&d systems  cat# 485-mi-100  geneticin (g418)  life technologies  cat# 10131027  puromycin  sigma-aldrich  cat# p8833  bmv109  verdoes et al. 2013  n/a  lysotracker-dnd99  life technologies  cat# l7528  fm4-64x  life technologies  cat# f34653  middlebrook’s 7h9 broth medium  sigma-aldrich  cat# m0178  middlebrook’s 7h11 agar medium  sigma-aldrich  cat# m0428  middlebrook oadc  bd biosciences  cat# 212351  middlebrook adc  bd biosciences  cat# 212352  atcc  cat# tib-71  mouse: c57bl/6j (wild-type)  bred in house  n/a  mouse: c57bl/6jtm1a (eucomm)hmgu mice (rab20 ko)  this paper  c57bl/6jtm1a (eucomm)hmgu  primer set1 for mouse genotyping: rab20-50 -arm: agctccttgcgctcctcctcatgg exon2: cagatgtgcttcgagaccagtgcc  this paper  n/a  primer set2 for mouse genotyping: rab20-50 arm: agctccttgcgctcctcctcatgg insert: caacgggttcttctgttagtcc  this paper  n/a  primer set3 for mouse genotyping: exon2: cagatgtgcttcgagaccagtgcc rab20-30 -arm: gcagactctgaggaaatgagatgg  this paper  n/a  experimental models: cell lines mouse macrophage cell line raw264.7 experimental models: organisms/strains  oligonucleotides  recombinant dna plasmid: pegfp-c1  clontech  plasmid: pegfp-rab20  pei et al. 2014  n/a  plasmid:p egfp-rab20t19n  pei et al. 2014  n/a (continued on next page)  cell host & microbe 21 619–628.e1–e5 may 10 2017 e1   continued reagent or resource  source  identifier  plasmid: pegfp-rab5a  pei et al. 2014  n/a  plasmid: pegfp-2xfyve  pei et al. 2014  n/a  plasmid: pegfp-rab7  pei et al. 2014  n/a  plasmid: pegfp-rilp  (terebiznik et al. 2006)  n/a  plasmid: mission plko.1-puro-control  pei et al. 2014  n/a  plasmid: mission plko.1-puro-shrna2643  pei et al. 2014  n/a  plasmid: mission plko.1-puro-shrna2644  pei et al. 2014  n/a  mycobacterial plasmid: pml1335 (egfp)  lerner et al. 2016  n/a  mycobacterial plasmid: pml2570 (rfp)  lerner et al. 2016  n/a  prism  graphpad software  https://www.graphpad.com/scientificsoftware/prism/  imagej/fiji  nih bethesda/us  https://fiji.sc/  european nucleotide archive  http://www.ebi.ac.uk/ena  software and algorithms  deposited data sequencing data (prjeb10919)  contact for reagent and resource sharing further information and requests for resources and reagents should be directed to and will be fulfilled by the lead contact maximiliano g.;     sequencing data are accessible from the european nucleotide archive with accession number prjeb10919.;     sequencing data are accessible from the european nucleotide archive with accession number prjeb10919.      deposited data sequencing data (prjeb10919,NA
10.1021/acs.jcim.7b00072,2017,TRUE,FALSE,supplement,NA,FALSE,NA,NA,table s1: list of the 614 chemicals (xlsx,NA
10.1038/s41598-017-11812-x,2017,TRUE,TRUE,"field-specific repository, data availability statement",field-specific repository,FALSE,NA,NA,data sets obtained in this study have been uploaded to geo under accession id gse89392 (link for the reviewers: https://www.ncbi.nlm.nih.gov/geo/query/acc.cgi?;     the datasets generated during and/or analyzed during the current study are available in the gene expression omnibus repository under accession id gse89392 (link for the reviewers: https://www.ncbi.nlm.nih.gov/geo/query/acc.cgi?      data availability statement. the datasets generated during and/or analyzed during the current study are available in the gene expression omnibus repository under accession id gse89392,NA
10.1038/srep44329,2017,FALSE,NA,NA,NA,TRUE,FALSE,NA,NA,4d) were produced using a custom-made python code (see supplementary information for detailed information on statistical analysis).
10.1038/srep44628,2017,TRUE,TRUE,"field-specific repository, supplement",field-specific repository,FALSE,NA,NA,additional information  accession codes: coordinates and structure factors have been submitted to the protein data bank under accession codes 5u5q (rna polymerase ii) 5mnd (cpgv) and 5trx (hpcd).     table 1). a full dataset,NA
10.1039/c7dt01834g,2017,TRUE,TRUE,supplement,supplement,FALSE,NA,NA,crystallographic data in cif,NA
10.1093/toxsci/kfx081,2017,TRUE,FALSE,supplement,NA,FALSE,NA,NA,raw data (see supplementary table 2,NA
10.1111/jdv.13995,2017,TRUE,FALSE,supplement,NA,FALSE,NA,NA,supporting information additional supporting information may be found in the online version of this article: data s1.;     data s2.,NA
10.1186/s12859-017-1674-0,2017,TRUE,FALSE,"field-specific repository, supplement",NA,TRUE,TRUE,github,additionally data sets of clear cell renal cell carcinoma (ccrcc) previously used in [33] were downloaded from gene expression omnibus [34] (ids: gse6344 gse15641 gse14994 gse11024) and included into the analysis.;     bmc bioinformatics (2017) 18:256  page 4 of 12  table 1 general information about used microarray data sets target kegg id  disease/kegg pathway name  tissue  sample size (control+case)  gse1145  geo  hsa:05414  dilated cardiomyopathy  left ventricle  26 (11+15)  gse14924_cd4  hsa:05221  acute myeloid leukemia  cd4 t cells  20 (10+10)  gse14924_cd8  hsa:05221  acute myeloid leukemia  cd8 t cells  21 (11+10)  gse16759  hsa:05010  alzheimer’s disease  parietal lobe  8 (4+4)  gse24739_g0  hsa:05220  chronic myeloid leukemia  peripheral blood  12 (4+8)  gse24739_g1  hsa:05220  chronic myeloid leukemia  peripheral blood  12 (4+8)  gse32676  hsa:05212  pancreatic cancer  pancreas  32 (7+25)  gse4183  hsa:05210  colorectal cancer  colon  23 (8+15)  gse1297  hsa:05010  alzheimer’s disease  hipopocampal ca1  16 (9+7)  gse14762  hsa:05211  renal cancer  kidney  21 (12+9)  gse19188  hsa:05223  non-small cell lung cancer  lung  153 (62+91)  gse19728  hsa:05214  glioma  brain  21 (4+17)  gse20153  hsa:05012  parkinson’s disease  lymphoblasts  16 (8+8)  gse20291  hsa:05012  parkinson’s disease  ppstmortem brain putmen  33 (19+14)  gse21354  hsa:05214  glioma  brain spine  17 (4+13)  gse3585  hsa:05414  dilated cardiomyopathy  subendocardial left ventricle  12 (5+7)  gse4107  hsa:05210  colorectal cancer  mucosa  22 (10+12)  gse5281_ec  hsa:05010  alzheimer’s disease  entorhinal cortex  21 (12+9)  gse5281_hip  hsa:05010  alzheimer’s disease  hippocampus  23 (13+10)  gse5281_vcx  hsa:05010  alzheimer’s disease  primary visual cortex  31 (12+19)  gse781  hsa:05211  renal cancer  kidney  17 (5+12)  gse8762  hsa:05016  huntington’s disease  lymphocytes  22 (10+12)  gse9348  hsa:05210  colorectal cancer  colon  82 (12+70)  gse9476  hsa:05221  acute myeloid leukemia  peripheral blood  63 (37+26)  gse6344  hsa:05211  renal cancer  kidney  20 (9+11)  gse15641  hsa:05211  renal cancer  kidney  55 (23+32)  gse14994  hsa:05211  renal cancer  kidney  30 (8+22)  gse11024  hsa:05211  renal cancer  kidney  22 (12+10)  absolute value (|wad|) were included.     xls 59 kb) additional file 2,finally the gene set enrichment analysis method with all tested ranking metrics was parallelised and implemented in matlab and is available at https://github.com/zaedpolsl/mrgsea.
10.1186/s13063-017-2256-1,2017,TRUE,TRUE,supplement,supplement,FALSE,NA,NA,additional file 1: included studies list and outcome catergorisation data. (xlsx,NA
10.1515/jpm-2016-0231,2017,TRUE,FALSE,supplement,NA,FALSE,NA,NA,all data are shown in table 1,NA
10.1523/JNEUROSCI.1432-16.2016,2017,FALSE,NA,NA,NA,TRUE,TRUE,github,NA,the matlab code used for this simulation can be downloaded from https://github.com/lucaiemi/iemi2017_jneurosci.;     notes supplemental material for this article is available at https://github.com/ lucaiemi/iemi2017_jneurosci. notes supplemental material for this article is available at https://github.com/ lucaiemi/iemi2017_jneurosci.
10.3389/fendo.2017.00086,2017,TRUE,FALSE,field-specific repository,NA,FALSE,NA,NA,initial attempts at building tshr models used those gpcr crystal structure templates  available at the time: (1) inactive conformations—rhodopsin [pdb entry 1f88 (112)] beta-2-adrenergic receptor [adrb2 pdb entry 2rh1 (113) pdb entry 2r4s (114)]; (2) active  figure 3 | continued  frontiers in endocrinology | www.frontiersin.org  5  april 2017 | volume 8 | article 86   kleinau et al.;     tsh and thyrostimulin but no direct structural information is yet available only structural homology models can be designed based on similarity to existing crystal structures of fsh [pdb entries 1fl7 (145)—unbound state 1xwd (64) and 4ay9 (65)—bound state] or cg [all structures are in unbound state pdb entries 1hcn (146) 1hrp (147) 1qfw (148)] (see figure 2). ii.;     blocking [pdb entry 2xwt (57)] or activating antibodies [pdb entry 3g04 (56)] direct structural information is available in bound conformations and also the unbound structure of an (inverse agonistic) antibody is available [pdb entry 4qt5 (149)].;     arrestin where bound complexes with opsin or rhodopsin are available [rhodopsin/arrestin pdb entries 4zwj (162)  8  april 2017 | volume 8 | article 86   kleinau et al.;     based on the beta-2 adrenergic receptor/gs complex a bound gs conformation is also available [pdb entry 3sn6 (118)].  themselves or with bound allosteric ligands or intracellularly complexed partners.,NA
10.1016/j.ijmm.2016.06.006,2016,TRUE,TRUE,field-specific repository,field-specific repository,FALSE,NA,NA,夽 microarray data from this publication has been deposited in ncbi’s gene expression omnibus (geo http://www.ncbi.nlm.nih.gov/geo/) and are accessible through geo series accession number gse72585.;     the data presented in this publication have been deposited in ncbi’s gene expression omnibus (geo http://www.ncbi.nlm.nih.gov/geo/) and are accessible through geo series accession number gse72585.,NA
10.1016/S0140-6736(16)31012-1,2016,TRUE,FALSE,supplement,NA,TRUE,FALSE,NA,all data inputs 8  data analysis  (table 1,for each step in the workﬂow diagrams computer code is either on github such as codem 2015 and dismod-mr 2.1160161 or available on the ihme website for download.
10.1021/acs.jmedchem.6b01009,2016,TRUE,FALSE,supplement,NA,FALSE,NA,NA,crystallographic data centre (www.ccdc.cam.ac.uk/data_request/cif,NA
10.1038/ncomms11320,2016,TRUE,TRUE,"field-specific repository, supplement",field-specific repository,FALSE,NA,NA,additional information accession codes: the microarray data have been deposited in ncbi’s gene expression omnibus under accession code gse69980.   on the basis of the calculated cssmd (collective strictly standardized mean difference) values which reﬂect effect strength and signiﬁcance17 (supplementary fig. 1gh) we validated 156 proviral and 41 antiviral host factors (fig. 1b; supplementary data 1 and 2).;     strikingly 66 of these proviral genes have been identiﬁed in previous screens with inﬂuenza a virus (iav)914 hcv1819 sindbis virus (sinv)1011 dengue virus (denv)20 west nile virus 2  (wnv)21 hiv-1 (refs 1322) or vaccinia virus (vacv)23 (fig. 1c; see supplementary data 3 for details and references).;     we observed a signiﬁcant reduction of chikv replication with guide rnas (grna)-transduced cas9expressing cells for 14 out of 16 genes establishing that they are proviral factors (fig. 1de; supplementary fig. 1ij; supplementary data 4) and highlighting the strong reliability of the rnai-validated hits of our study.;     full details in supplementary data 3. (d) heatmap illustrating the replication capability of chikv in cas9-positive hek-293t cells expressing the indicated grnas.;     in addition we generated three compounds against the cdc-like kinase 1 (clk1) a proviral factor for chikv iav and wnv (fig. 1c; supplementary data 3; supplementary methods).;     4; supplementary data 5).;     these antiviral compounds inhibit the following targets and pathways: (i) the vacuolar-type h þ atpase (vatpase); (ii) clk1; (iii) the fms-related tyrosine kinase 4 (flt4 or vegfr3); (iv) calmodulin signalling; (v) fatty acid synthesis; (vi) the k (lysine) acetyltransferase 5 (kat5 or tip60; see supplementary data 6 for more details).;     since ﬁve of these six druggable hits were also identiﬁed as proviral factors in other rnai screens (fig. 1c; supplementary data 3) we sought to characterize the efﬁcacy of inhibitors of  these hits on the replication of a wide spectrum of viral species.;     cells were then transduced with lentiviruses derived from the plasmid lentiguide-puro44 (addgene number 52963) which leads to the expression of speciﬁc grnas) listed in supplementary data 4.;     experiments in supplementary fig. 5de were performed using the hiperfect transfection kit to transfect sirna (silencer select negative control no. 2 sirna catalogue number 4390846 and s33489 s20629 and s31791—target sequences in supplementary data 1—at a ﬁnal concentration of 5 nm) for 48 h before infection.,NA
10.1038/ncomms13187,2016,TRUE,TRUE,supplement,supplement,FALSE,NA,NA,phosphopeptide abundance—directly relating to the amount of substrate phosphorylation—was determined by a label-free quantitative analysis1920 (supplementary dataset 1).,NA
10.1038/nm.4062,2016,TRUE,TRUE,field-specific repository,field-specific repository,FALSE,NA,NA,gene expression omnibus: the array data has been deposited with accession code gse34829.,NA
10.1111/cmi.12492,2016,TRUE,TRUE,field-specific repository,field-specific repository,FALSE,NA,NA,† microarray data presented in this paper have been deposited in the national center for biotechnology information gene expression omnibus (geo; http://www.ncbi.nlm.nih.gov/geo/) and are accessible through geo series accession number gse56791.;     microarray data presented in this paper have been deposited in the national center for biotechnology information gene expression omnibus (geo; http://www. ncbi.nlm.nih.gov/geo/) and are accessible through geo series accession number gse56791.,NA
10.1111/exd.13006,2016,TRUE,FALSE,supplement,NA,FALSE,NA,NA,pfannes sabrina hadam nadine do clinical research center for hair and skin science department of dermatology and allergy charite-universitaetsmedizin berlin berlin germany correspondence: annika vogt clinical research center for hair and skin science department of dermatology and allergy charite-universitaetsmedizin berlin chariteplatz 1 10117 berlin germany tel.: +49 (0)30 450 518 fax: +49 (0)30 450 518 952 e-mail: annika.vogt@charite.de  key words: alopecia – hair follicle – scalp skin – stripping method – trichology  accepted for publication 22 february 2016  background  number of 20 scalp sites) following a sop illustrated in fig. 1 (for details on the steps of extraction and data analysis please refer to data s1).;     supporting information additional supporting information may be found online in the supporting information tab for this article: data s1.;     data s2.,NA
10.1136/gutjnl-2014-307949,2016,TRUE,TRUE,field-specific repository,field-specific repository,FALSE,NA,NA,gut 2016;65:202–213. doi:10.1136/gutjnl-2014-307949  national center for biotechnology information and can be accessed with the geo accession number gse58473.;     data sharing statement microarray data have been deposited in the gene expression omnibus (geo; http://www.ncbi.nlm.nih.gov/geo/) of the national center for biotechnology information and can be assessed with the geo accession number gse58473.,NA
10.1177/1359105314542818,2016,TRUE,FALSE,general-purpose repository,NA,FALSE,NA,NA,the iat script is available at http://osf.io/5buh7/.,NA
10.1177/2396987316651759,2016,TRUE,FALSE,data availability statement,NA,FALSE,NA,NA,availability of data particularly in existing national registries. for example dysphagia assessment was not described among several studies212225 and pre-stroke disability was described in diﬀerent ways.212227,NA
10.1523/ENEURO.0080-16.2016,2016,TRUE,FALSE,general-purpose repository,NA,TRUE,TRUE,github,electrical signals were amplified using an iso-dam amplifier (world precision instruments) bandpass filtered (300 hz to 2 khz) digitized at 10 khz (ni-usb6221 digital acquisition board national instruments) and acquired using data acquisition software that is freely available at https:// github.com/sg-s/kontroller.,electrical signals were amplified using an iso-dam amplifier (world precision instruments) bandpass filtered (300 hz to 2 khz) digitized at 10 khz (ni-usb6221 digital acquisition board national instruments) and acquired using data acquisition software that is freely available at https:// github.com/sg-s/kontroller.;     spikes were identified and july/august 2016 3(4) e0080-16.2016  3 of 19  sorted using a spike-sorting toolbox available at https:// github.com/sg-s/spikesort.
10.15252/embj.201591488,2016,TRUE,FALSE,field-specific repository,NA,FALSE,NA,NA,the raw and normalized data are available online at the ncbi geo database (edgar et al 2002) accession number gse57098 (http://www.ncbi.nlm.nih. gov/geo/query/ acc.cgi?,NA
