doi,year,is_open_data_oddpub,open_data_manual_check,open_data_category,open_data_category_manual,is_open_code_oddpub,open_code_manual_check,open_code_category_manual,open_data_statements,open_code_statements
10.1016/j.immuni.2019.01.001,2019,TRUE,TRUE,"field-specific repository, general-purpose repository, data availability statement","field-specific repository, general-purpose repository",FALSE,NA,NA,504 immunity 50 493–504 february 19 2019   star+methods key resources table  reagent or resource  source  identifier  anti-cd8a  biolegend  cat# 100714; rrid: ab_312753  anti-cd19  biolegend  cat# 115530; rrid: ab_830707  anti-cd11b  biolegend  cat# 101226; rrid: ab_830642  anti-tcrb  biolegend  cat# 109218; rrid: ab_493346  anti-cd4  biolegend  cat# 100553; rrid: ab_2561388  anti-cd44  bd biosciences  cat# 563970; rrid: ab_2738517  antibodies  anti-cd62l  biolegend  cat# 104426; rrid: ab_493719  anti-st2  md biosciences  cat# 101001b; rrid: ab_947551  anti-cd45  bd biosciences  cat# 557833; rrid: ab_396891  anti-cd3  bd biosciences  cat# 557694; rrid: ab_396803  anti-cd4  bd biosciences  cat# 557922; rrid: ab_396943  anti-cd8  biolegend  cat# 300924; rrid: ab_1575074  anti-cd25  biolegend  cat# 302606; rrid: ab_314276  anti-cd127  biolegend  cat# 351309; rrid: ab_10898326  anti-ccr7  biolegend  cat# 353226; rrid: ab_11126145  anti-cd45ra  bd biosciences  cat# 563031; rrid: ab_2722499  human blood and normal breast tissue  breast reduction plastic surgeries (rec approval number: 08/h0906/95+5)  n/a  human colonic normal tissue adjacent to tumor  colon resection surgeries (nhs research ethic system reference number: 11/yh/0020)  n/a  biological samples  chemicals peptides and recombinant proteins rpmi 1640 medium  gibco  bovine serum albumin (bsa)  sigma-aldrich  cat#21870076 cat#a9418  hepes  gibco  cat#15630080  collagenase d  roche  cat#11088866001  liberase tl  roche  cat#5401020001  percoll  ge healthcare  cat#17-0891-01  edta  invitrogen  cat#am9260g  collagenase viii  sigma-aldrich  cat#c2139  fetal calf serum (fcs)  sigma-aldrich  cat#f4135  collagenase a  roche  cat#10103583001  dnase i  roche  cat#11284932001  collagenase iv  worthington-biochemical  cat#ls004188  dtt (for digestion)  sigma-aldrich  cat#d0632  dmso  sigma-aldrich  cat#d2650  penicillin-streptomycin-glutamine  gibco  cat#10378-016  lymphoprep  stemcell technologies  cat#07801  dapi  sigma-aldrich  cat#d9542  96-well plates  4titude  cat#f4135  rnase inhibitor  clontech  cat#2313a  triton x-100  sigma-aldrich  cat#t9284  dntps  thermofisher  cat#10319879  ercc rna spike-in mix  ambion  cat#4456740 (continued on next page)  immunity 50 493–504.e1–e7 february 19 2019 e1   continued reagent or resource  source  identifier  smartscribe_x0002_ reverse transcriptase  clontech  cat#639538  ampure xp beads  beckman coulter  cat#a63881  critical commercial assays chromium single cell chip kit v2  10x genomics  cat#120236  chromium single cell 30 library and gel bead kit v2  10x genomics  cat#120237  agilent high sensitivity dna kit  agilent  cat#5067-4626  nextera xt dna sample preparation kit  illumina  cat#fc-131-1096  smart-seq2 raw data  this paper  arrayexpress: e-mtab-6072  10x chromium raw data  this paper  arrayexpress: e-mtab-7311  processed count matrices and metadata  this paper  https://figshare.com/projects/treg_scrnaseq/38864  interactive data browser  this paper  www.teichlab.org/data  atcc  crl-6475  the jackson laboratory  jax: 006772  oligo-dt  (picelli et al. 2014); idt  n/a  template switch oligo (tso)  (picelli et al. 2014); exiqon  n/a  ispcr  (picelli et al. 2014); idt  n/a  deposited data  experimental models: cell lines melanoma: b16.;     data accessibility scrna-seq data for this project has been deposited in arrayexpress under the accession numbers e-mtab-6072 and e-mtab7311. 504 immunity 50 493–504 february 19 2019   star+methods key resources table  reagent or resource  source  identifier  anti-cd8a  biolegend  cat# 100714; rrid: ab_312753  anti-cd19  biolegend  cat# 115530; rrid: ab_830707  anti-cd11b  biolegend  cat# 101226; rrid: ab_830642  anti-tcrb  biolegend  cat# 109218; rrid: ab_493346  anti-cd4  biolegend  cat# 100553; rrid: ab_2561388  anti-cd44  bd biosciences  cat# 563970; rrid: ab_2738517  antibodies  anti-cd62l  biolegend  cat# 104426; rrid: ab_493719  anti-st2  md biosciences  cat# 101001b; rrid: ab_947551  anti-cd45  bd biosciences  cat# 557833; rrid: ab_396891  anti-cd3  bd biosciences  cat# 557694; rrid: ab_396803  anti-cd4  bd biosciences  cat# 557922; rrid: ab_396943  anti-cd8  biolegend  cat# 300924; rrid: ab_1575074  anti-cd25  biolegend  cat# 302606; rrid: ab_314276  anti-cd127  biolegend  cat# 351309; rrid: ab_10898326  anti-ccr7  biolegend  cat# 353226; rrid: ab_11126145  anti-cd45ra  bd biosciences  cat# 563031; rrid: ab_2722499  human blood and normal breast tissue  breast reduction plastic surgeries (rec approval number: 08/h0906/95+5)  n/a  human colonic normal tissue adjacent to tumor  colon resection surgeries (nhs research ethic system reference number: 11/yh/0020)  n/a  biological samples  chemicals peptides and recombinant proteins rpmi 1640 medium  gibco  bovine serum albumin (bsa)  sigma-aldrich  cat#21870076 cat#a9418  hepes  gibco  cat#15630080  collagenase d  roche  cat#11088866001  liberase tl  roche  cat#5401020001  percoll  ge healthcare  cat#17-0891-01  edta  invitrogen  cat#am9260g  collagenase viii  sigma-aldrich  cat#c2139  fetal calf serum (fcs)  sigma-aldrich  cat#f4135  collagenase a  roche  cat#10103583001  dnase i  roche  cat#11284932001  collagenase iv  worthington-biochemical  cat#ls004188  dtt (for digestion)  sigma-aldrich  cat#d0632  dmso  sigma-aldrich  cat#d2650  penicillin-streptomycin-glutamine  gibco  cat#10378-016  lymphoprep  stemcell technologies  cat#07801  dapi  sigma-aldrich  cat#d9542  96-well plates  4titude  cat#f4135  rnase inhibitor  clontech  cat#2313a  triton x-100  sigma-aldrich  cat#t9284  dntps  thermofisher  cat#10319879  ercc rna spike-in mix  ambion  cat#4456740 (continued on next page)  immunity 50 493–504.e1–e7 february 19 2019 e1   continued reagent or resource  source  identifier  smartscribe_x0002_ reverse transcriptase  clontech  cat#639538  ampure xp beads  beckman coulter  cat#a63881  critical commercial assays chromium single cell chip kit v2  10x genomics  cat#120236  chromium single cell 30 library and gel bead kit v2  10x genomics  cat#120237  agilent high sensitivity dna kit  agilent  cat#5067-4626  nextera xt dna sample preparation kit  illumina  cat#fc-131-1096  smart-seq2 raw data  this paper  arrayexpress: e-mtab-6072  10x chromium raw data  this paper  arrayexpress: e-mtab-7311  processed count matrices and metadata  this paper  https://figshare.com/projects/treg_scrnaseq/38864  interactive data browser  this paper  www.teichlab.org/data  atcc  crl-6475  the jackson laboratory  jax: 006772  oligo-dt  (picelli et al. 2014); idt  n/a  template switch oligo (tso)  (picelli et al. 2014); exiqon  n/a  ispcr  (picelli et al. 2014); idt  n/a  deposited data  experimental models: cell lines melanoma: b16.     data accessibility  supplemental information supplemental information includes five figures and five tables and can be found with this article online at https://doi,NA
10.1027/2151-2604/a000387,2019,TRUE,FALSE,"general-purpose repository, data availability statement",NA,FALSE,NA,NA,the full lecture slides and script are openly available to provide a tool for instructors to keep themselves and their students up to date with open science (https://osf.io/mh9pe).     data sharing practices are especially important when submitting data to “reputable doi,NA
10.1038/s41467-019-09144-7,2019,TRUE,TRUE,"field-specific repository, supplement, data availability statement",field-specific repository,FALSE,NA,NA,the data discussed in this publication have been deposited in ncbi’s gene expression omnibus and are accessible through geo series accession number gse107712.;     the methylation beadchip data generated in this study have been deposited in the national centre for biotechnology information omnibus (geo) under the accession code gse108202.;     data availability the microarray and methylation beadchip data from this manuscript have been deposited in the national centre for biotechnology information omnibus (geo) under accession codes gse107712 and gse108202.   we identiﬁed 91 signiﬁcantly regulated genes between cured and never infected samples (log2 fold change <−0.7 or >0.7 p < 0.01 with an fdr < 61%; supplementary data 1.;     box plots show median quartiles maximum and minimum of the log2 fold-changes of three donors. f selected genes from the table of jointly regulated candidates (supplementary data 1) that remained differentially regulated after curing of chronic infection (red: upregulated blue: downregulated).;     applying a threshold of at least 20% differential methylation and a p-value of 0.05 we identiﬁed 603 cpgs at a minimal false discovery rate of 76% of which 179 were located in promoter regions (supplementary data 2).;     raw data associated with figs. 3f and 4 can be found in supplementary data 1 and 2 respectively.   data availability the microarray and methylation beadchip data from this manuscript have been deposited in the national centre for biotechnology information omnibus (geo) under accession codes gse107712,NA
10.1038/s41467-019-13627-y,2019,TRUE,TRUE,"field-specific repository, supplement",field-specific repository,FALSE,NA,NA,data availability the polar and lipid lc-ms data in positive and negative polarity as well as gc-ms data that support the ﬁndings of this study have been deposited in the metabolights repository with the accession code mtbls1282.   to identify putative mir276 mrna targets we applied three in silico target prediction tools namely miranda29 rnahybrid30 and microtar31(supplementary data 1).;     we compared metabolite proﬁles of mir276kd and control females (whole mosquitoes) at three time points after p. falciparum-infected blood feeding (10 38 and 48 hpb) using gas chromatography-mass spectrometry (gc-ms) and liquid chromatography-mass spectrometry (lc-ms) (supplementary data 1).;     the data were further log2-transformed and pareto scaled for heatmap visualization. 294 features signiﬁcantly changed across the reproductive cycle (two-way anova; supplementary data 2) and were included in the heatmap.;     the raw gc-ms and lc-ms dataset is attached as supplementary material (supplementary data 3).,NA
10.1038/s41593-019-0418-Z,2019,TRUE,TRUE,"field-specific repository, supplement, data availability statement",field-specific repository,FALSE,NA,NA,online content  any methods additional references nature research reporting summaries source data statements of code and data availability and associated accession codes are available at https://doi.org/10.1038/ s41593-019-0418-z.;     the rna sequencing data discussed in this nature neuroscience | www.nature.com/natureneuroscience   brief communication  nature neuroscience publication have been deposited in ncbi’s gene expression omnibus and are accessible through the series gse118450; accession numbers are gsm3330371 (3-dpl microglia sample 1) gsm3330372 (3-dpl microglia sample 2) gsm3330373 (3-dpl microglia sample 3) gsm3330374 (10-dpl microglia sample 4) gsm3330375 (10-dpl microglia sample 5) and gsm3330376 (10-dpl microglia sample 6).;     this statement should provide the following information where applicable:  rna sequencing data is available on geo as the series gse118450 accession numbers are gsm3330371 gsm3330372 gsm3330373 gsm3330374 gsm3330375 gsm3330376.     supplementary table 1. raw data data availability and associated accession codes are available at https://doi,NA
10.1038/s41598-019-43292-6,2019,TRUE,FALSE,field-specific repository,NA,FALSE,NA,NA,the capture used in this study was based on data generated previously in detroit  562 cells56 available in the ncbi’s gene expression omnibus repository under the following accession number: (i) gse91018 for rela chip-seq data under microbial stimuli (ii) gse91019 for the rna-seq data following microbial stimuli and (iii) gse104635 for the h3k27ac chip-seq data under lps stimulation.,NA
10.1038/s41598-019-47350-x,2019,TRUE,TRUE,field-specific repository,field-specific repository,FALSE,NA,NA,microarray data were deposited in the ncbi’s gene expression omnibus (geo accession number gse99901).,NA
10.1038/s42256-019-0049-9,2019,TRUE,TRUE,"general-purpose repository, data availability statement",general-purpose repository,TRUE,TRUE,github,data availability  sensitivity analysis data for all presented proteins including the ~800 proteins used to calculate spatial homogeneity of sphere variances as well as weights for deeprotein classifier are available on zenodo (https://doi.org/10.5281/zenodo.2577920 and 234  https://doi.org/10.5281/zenodo.2574979).;     code availability  the code for deeprotein including scripts employed for sensitivity analysis and code for mapping sensitivities to protein 3d structures in pymol is available on github under mit license (https://github.com/juzb/deeprotein https://doi. org/10.5281/zenodo.2619339).;     all analysis were fully automated thereby avoiding any subjective bias.  nature research | reporting summary  deeprotein classifier are available on zenodo under the creative commons attribution 4.0 license (doi: 10.5281/zenodo.2577920 and doi: 10.5281/ zenodo.2574979).     data availability  sensitivity analysis data for all presented proteins including the ~800 proteins used to calculate spatial homogeneity of sphere variances as well as weights for deeprotein classifier are available on zenodo,code availability  the code for deeprotein including scripts employed for sensitivity analysis and code for mapping sensitivities to protein 3d structures in pymol is available on github under mit license (https://github.com/juzb/deeprotein https://doi. org/10.5281/zenodo.2619339).;     the software is available on github under the mit license (https://github.com/juzb/deeprotein).
10.1080/08927022.2019.1610949,2019,TRUE,FALSE,field-specific repository,NA,FALSE,NA,NA,its atomistic resolution structure revealed by x-ray crystallography is available at the rcsb protein data bank under pdb entry 3ny8 and presented in figure 6 [24]. β-adrenergic ligands belong to the catecholamine system which is the critical part of maintaining cardiovascular regulation.,NA
10.1093/database/baz085,2019,TRUE,TRUE,general-purpose repository,general-purpose repository,FALSE,NA,NA,data records a complete dump of collected annotation data as at 27 july 2018 was deposited to a figshare repository.;     bibliothek user on 02 august 2021  dataset is released without copyright available at https:// figshare.com/projects/relish-db/60095 under the cc0 license.,NA
10.1093/nar/gkz506,2019,TRUE,TRUE,"field-specific repository, supplement, data availability statement",field-specific repository,FALSE,NA,NA,14 7377  data availability atomic coordinates and structure factors for the reported crystal structures have been deposited with the protein data bank under accession numbers 6gz0 (wild-type leuoebd) 6gz1 (s120d-ebd monoclinic) and 6gz2 (s120debd orthorhombic).     all data collection and refinement statistics 64–67) are given in table 2 data availability atomic coordinates and structure factors for the reported crystal structures have been deposited with the protein data bank under accession numbers 6gz0,NA
10.1093/ve/vez029,2019,TRUE,TRUE,general-purpose repository,general-purpose repository,TRUE,TRUE,github,data availability all data and analysis presented in this work are available in the github repository: https://github.com/johnbarton/pa per-nef-modeling.,data availability all data and analysis presented in this work are available in the github repository: https://github.com/johnbarton/pa per-nef-modeling.
10.1098/rspa.2018.0718,2019,TRUE,FALSE,general-purpose repository,NA,FALSE,NA,NA,electronic supplementary material is available online at https://doi.org/10.6084/m9.figshare. c.4540145.,NA
10.1101/gad.330134.119,2019,TRUE,TRUE,"field-specific repository, data availability statement",field-specific repository,FALSE,NA,NA,data availability  the par-clip sequencing abl-b cell and e18.5 lung nanostring data have been deposited in ncbi’s gene expression omnibus (gse123673).      data availability  the par-clip sequencing abl-b cell and e18.5 lung nanostring data have been deposited in ncbi’s gene expression omnibus (gse123673,NA
10.1111/oik.04879,2019,TRUE,TRUE,"field-specific repository, general-purpose repository",field-specific repository,FALSE,NA,NA,the raw sequence datasets are available at the european nucleotide archive under the study number prjeb8978 (<www.ebi.ac.uk/ena/data/view/prjeb8978>). fungal biome otu table otu representative sequences and the bioinformatics scripts are available at dryad (<http:// datadryad.org/resource/doi:10.5061/dryad.54qr4>).,NA
10.1177/0271678X17726635,2019,TRUE,TRUE,general-purpose repository,general-purpose repository,TRUE,TRUE,github,histological data and all relevant images before and after registration are publicly available at http://doi.org/10.5281/zenodo.742264.35 evaluating the accuracy of atlas registration.;     available at: http://doi.org/10.5281/zenodo.742264.,the toolbox can be downloaded at https://github.com/ philippboehmsturm/antx.
10.1186/s13148-019-0698-x,2019,TRUE,TRUE,"field-specific repository, supplement, data availability statement",field-specific repository,FALSE,NA,NA,all chip-seq data have been deposited at arrayexpress (http://www. ebi.ac.uk/arrayexpress accession number: e-mtab7786).;     availability of data and materials all mrna-seq data which have been previously published [15] and chip-seq data are available at arrayexpress (http://www.ebi.ac.uk/arrayexpress accession numbers: e-mtab-7197 and e-mtab-7786).     zip 7432 kb)  ethics approval and consent to participate not applicable. additional file 2 availability of data and materials all mrna-seq data which have been previously published [15] and chip-seq data are available at arrayexpress (http://www.ebi.ac.uk/arrayexpress accession numbers: e-mtab-7197,NA
10.1200/PO.19.00072,2019,TRUE,TRUE,field-specific repository,field-specific repository,FALSE,NA,NA,microarray-based gene expression data are available through arrayexpress (accession number e-mtab-8248).14 massively parallel sequencing data have been published and are available at the european genomephenome archive (www.ebi.ac.uk/ega/) under accession number egas00001003244.,NA
10.3389/fmars.2019.00662,2019,TRUE,TRUE,"field-specific repository, data availability statement",field-specific repository,FALSE,NA,NA,data availability and accession numbers illumina short read sequences generated in this study have been submitted to the ncbi sequence read archive (sra)1 under accession number prjna549836.      data availability and accession numbers illumina short read sequences generated in this study have been submitted to the ncbi sequence read archive (sra)1 under accession number prjna549836,NA
10.3389/fneur.2019.00969,2019,TRUE,FALSE,supplement,NA,FALSE,NA,NA,methods and analysis design stream is a prospective single-arm multicenter trial with a pre-test-post-test design (figure 1) and central data monitoring employing individual patients’ case report forms (supplemental data 1) to record the baseline variables processing time time-consuming items in the acute stroke workflow and the team’s composition.;     all data specified in the trial protocol will be documented in standardized case report forms (crfs supplemental data 1) by the participating stroke centers.;     2019.00969/full#supplementary-material supplemental data 1 | case report form of the stream trial.,NA
10.4049/jimmunol.1801400,2019,TRUE,TRUE,field-specific repository,field-specific repository,FALSE,NA,NA,the original transcriptome data presented in this article have been submitted to the gene expression omnibus (www.ncbi.nlm.nih.gov/projects/geo/) under accession numbers gse118821 and gse118822.,NA
10.1016/j.celrep.2020.03.006,2020,TRUE,TRUE,"field-specific repository, general-purpose repository, data availability statement",field-specific repository,TRUE,TRUE,github,star+methods key resources table reagent or resource  source  identifier  antibodies anti-listeriolysin (llo) antibody  abcam  cat# ab200538  anti-p60 antibody  biosite  cat# p6017  rabbit polyclonal anti-prsa2 antibody  (alonzo et al. 2009)  n/a  polyclonal anti-acta antibody  (netterling et al. 2015)  n/a  anti-rabbit-horseradish peroxidase secondary antibody  agrisera  cat# as09 602  listeria monocytogenes egd-e  (mackaness 1964)  n/a  l. monocytogenes egd-e dhfq  (christiansen et al. 2004)  n/a  l. monocytogenes egd-e lhra_mut  (nielsen et al. 2010)  n/a  l. monocytogenes egd-e prfa*  (good et al. 2016)  n/a  l. monocytogenes egd-e 5utr2219-m1  this study  n/a  l. monocytogenes egd-e 3utr0202-m2  this study  n/a  l. monocytogenes egd-e 5utr2219-m1 3utr0202-m2  this study  n/a  l. monocytogenes egd-e prfa* 5utr2219-m1  this study  n/a  l. monocytogenes egd-e prfa* 3utr0202-m2  this study  n/a  (mathy et al. 2007)  n/a  bacterial and virus strains  chemicals peptides and recombinant proteins purified c-terminal his tagged rnase j1 deposited data raw and analyzed ngs data  this study  geo: gse118387  scripts for data analysis  this study  https://github.com/dimaignatov/ 5-utr-structure-elucidation  (sun et al. 1990)  n/a  charles river laboratories  cat# 024 https://www.criver.com/ products-services/find-model/ swiss-webster-cfw-mouse?;     the accession number for the sequencing data reported in this paper is geo: gse118387 (https://www.ncbi.nlm.nih.gov/geo/query/acc.cgi?  star+methods key resources table reagent or resource  source  identifier  antibodies anti-listeriolysin (llo) antibody  abcam  cat# ab200538  anti-p60 antibody  biosite  cat# p6017  rabbit polyclonal anti-prsa2 antibody  (alonzo et al. 2009)  n/a  polyclonal anti-acta antibody  (netterling et al. 2015)  n/a  anti-rabbit-horseradish peroxidase secondary antibody  agrisera  cat# as09 602  listeria monocytogenes egd-e  (mackaness 1964)  n/a  l. monocytogenes egd-e dhfq  (christiansen et al. 2004)  n/a  l. monocytogenes egd-e lhra_mut  (nielsen et al. 2010)  n/a  l. monocytogenes egd-e prfa*  (good et al. 2016)  n/a  l. monocytogenes egd-e 5utr2219-m1  this study  n/a  l. monocytogenes egd-e 3utr0202-m2  this study  n/a  l. monocytogenes egd-e 5utr2219-m1 3utr0202-m2  this study  n/a  l. monocytogenes egd-e prfa* 5utr2219-m1  this study  n/a  l. monocytogenes egd-e prfa* 3utr0202-m2  this study  n/a  (mathy et al. 2007)  n/a  bacterial and virus strains  chemicals peptides and recombinant proteins purified c-terminal his tagged rnase j1 deposited data raw and analyzed ngs data  this study  geo: gse118387  scripts for data analysis  this study  https://github.com/dimaignatov/ 5-utr-structure-elucidation  (sun et al. 1990)  n/a  charles river laboratories  cat# 024 https://www.criver.com/ products-services/find-model/ swiss-webster-cfw-mouse?    deposited data raw and analyzed ngs data  this study  geo: gse118387,star+methods key resources table reagent or resource  source  identifier  antibodies anti-listeriolysin (llo) antibody  abcam  cat# ab200538  anti-p60 antibody  biosite  cat# p6017  rabbit polyclonal anti-prsa2 antibody  (alonzo et al. 2009)  n/a  polyclonal anti-acta antibody  (netterling et al. 2015)  n/a  anti-rabbit-horseradish peroxidase secondary antibody  agrisera  cat# as09 602  listeria monocytogenes egd-e  (mackaness 1964)  n/a  l. monocytogenes egd-e dhfq  (christiansen et al. 2004)  n/a  l. monocytogenes egd-e lhra_mut  (nielsen et al. 2010)  n/a  l. monocytogenes egd-e prfa*  (good et al. 2016)  n/a  l. monocytogenes egd-e 5utr2219-m1  this study  n/a  l. monocytogenes egd-e 3utr0202-m2  this study  n/a  l. monocytogenes egd-e 5utr2219-m1 3utr0202-m2  this study  n/a  l. monocytogenes egd-e prfa* 5utr2219-m1  this study  n/a  l. monocytogenes egd-e prfa* 3utr0202-m2  this study  n/a  (mathy et al. 2007)  n/a  bacterial and virus strains  chemicals peptides and recombinant proteins purified c-terminal his tagged rnase j1 deposited data raw and analyzed ngs data  this study  geo: gse118387  scripts for data analysis  this study  https://github.com/dimaignatov/ 5-utr-structure-elucidation  (sun et al. 1990)  n/a  charles river laboratories  cat# 024 https://www.criver.com/ products-services/find-model/ swiss-webster-cfw-mouse?;     the scripts are deposited at github under the project name 5ʹ-utr-structure-elucidation’ (https://github.com/dimaignatov/ 5-utr-structure-elucidation).
