doi,year,is_open_data_oddpub,open_data_manual_check,open_data_category,open_data_category_manual,is_open_code_oddpub,open_code_manual_check,open_code_category_manual,open_data_statements,open_code_statements
10.1002/1873-3468.13188,2018,TRUE,FALSE,data availability statement,NA,FALSE,NA,NA,data accessibility research data pertaining to this article is located at figshare,NA
10.1002/cyto.a.23279,2018,TRUE,FALSE,"general-purpose repository, supplement",NA,TRUE,TRUE,github,the matlab script to read and normalize the feature matrix provided in a .csv file and then train and save an som based upon this data as training set is available for download in github (https://github.com/zcseresn/shapeanalysis.git).  all data sets are saved in a single .csv,the python code is provided both as a standalone file as well as an embedded script of a blender file on github (https:// github.com/zcseresn/shapeanalysis.git) together with two example videos depicting the blender-embedded python script in action in the supplementary information (supporting information videos 2 and 3).;     the java plugin and the source code are available for download in github (https://github.com/zcseresn/shapeanalysis.git).;     in addition a python som calculation package is also available (https://github.com/sevamoo/ sompy).;     the matlab script to read and normalize the feature matrix provided in a .csv file and then train and save an som based upon this data as training set is available for download in github (https://github.com/zcseresn/shapeanalysis.git). the python code is provided both as a standalone file as well as an embedded script of a blender file on github (https:// github.com/zcseresn/shapeanalysis.git) together with two example videos depicting the blender-embedded python script in action in the supplementary information (supporting information videos 2 and 3).
10.1002/sim.7531,2018,FALSE,NA,NA,NA,TRUE,TRUE,supplement,NA,the r code implementing the calculations required for the illustrating examples is provided as supporting information to ease application in practice.;     the r source code for the corresponding permutation test is provided as supporting information so application in practice is straightforward.;     the corresponding r code is provided as supporting information to ease application in practice.;     the corresponding r code is provided as supporting information to ease application in practice. the r code implementing the calculations required for the illustrating examples is provided as supporting information to ease application in practice.;     the r source code for the corresponding permutation test is provided as supporting information so application in practice is straightforward.;     the corresponding r code is provided as supporting information to ease application in practice.;     the corresponding r code is provided as supporting information to ease application in practice.;     we have implemented the permutation test for the weighted all-cause hazard ratio in the software r and provide the source code as supporting information.
10.1007/s00018-017-2695-6,2018,TRUE,TRUE,field-specific repository,field-specific repository,FALSE,NA,NA,the data set was submitted to ncbi gene expression omnibus (accession #: gse98523).,NA
10.1007/s00401-017-1795-6,2018,TRUE,TRUE,field-specific repository,field-specific repository,FALSE,NA,NA,detailed information on the microarray experiments reported here including all data sets was submitted to ncbi’s gene expression omnibus (geo) [11] and are accessible through geo series accession number gse64811.,NA
10.1016/j.cell.2018.02.048,2018,TRUE,TRUE,"field-specific repository, supplement, data availability statement",field-specific repository,FALSE,NA,NA,raw data are available via geo accession number gse83742.;     data and software availability the accession number for the gene expression arrays reported in this paper is geo: gse83742.  e8 cell 173 470–484.e1–e8 april 5 2018   supplemental figures  figure s1.     table s1 with gsea software. raw data deposited data affymetrix gene chip expression data ppp2r1a-deletion  this paper  gse83742,NA
10.1016/j.cels.2017.11.010,2018,TRUE,TRUE,field-specific repository,field-specific repository,FALSE,NA,NA,the expression data were deposited in the gene expression omnibus (geo) database under the accession number geo: gse90954.;     the microarray expression data were deposited in the gene expression omnibus (geo) database under the accession number geo: gse90954: https://www.ncbi.nlm.nih.gov/geo/query/acc.cgi?,NA
10.1016/j.neuron.2017.11.024,2018,TRUE,FALSE,general-purpose repository,NA,TRUE,TRUE,github,data and software availability realistic concentration jumps (rcj) scripts are available at https://github.com/aplested/aligator.,data and software availability realistic concentration jumps (rcj) scripts are available at https://github.com/aplested/aligator.
10.1038/leu.2017.270,2018,TRUE,TRUE,field-specific repository,field-specific repository,FALSE,NA,NA,the highest scoring ig-sequence was analyzed using igblast and gains or losses of n-glycosylation sites were identiﬁed by visual inspection as previously described.12 clustering analysis was performed with the cluster software from michael eisen.21 wes and snp6.0 array data in this paper are deposited in the ega with accession number egas00001002164 (see also supplementary methods).,NA
10.1038/mi.2017.66,2018,TRUE,TRUE,"field-specific repository, supplement, data availability statement",field-specific repository,FALSE,NA,NA,differentially expressed genes in c. jejuni-infected mucosa and upstream regulator analysis  further direct information from the acute infected human tissue was received by rna-seq that revealed 2988 transcripts  were downregulated and 2410 upregulated (from four c. jejuni-infected patients and six controls data are deposited in ncbi’s gene expression omnibus; geo id gse88710).;     rna-seq data are deposited in ncbi’s gene expression omnibus and can be accessed as gse88710.     supplementary table s3 ‘‘canonical pathways in campylobacter jejuni-infected human colon mucosa.xls data availability. rna-seq data are deposited in ncbi’s gene expression omnibus and can be accessed as gse88710,NA
10.1038/mp.2017.44,2018,FALSE,NA,NA,NA,TRUE,TRUE,github,NA,all code and documents relevant for running the analyses and meta-analysis are available in the public repository at https://github.com/ achorton/sd_5httlpr. the coordinating center at washington university in st louis developed data coding instructions (supplementary table s3) based on the protocol and wrote an analysis script in r.62 each participating group reformatted their data for the analysis and executed the analysis script locally on their own data.
10.1038/mp.2017.77,2018,FALSE,NA,NA,NA,TRUE,FALSE,NA,NA,general instructions for ldsc are provided here: https://github.com/bulik/ldsc  results single variant (gwas and meta-analyses) gene and pathway analyses no variants achieved genome-wide signiﬁcance in either the transethnic or ea meta-analyses.
10.1038/nature25167,2018,TRUE,TRUE,field-specific repository,field-specific repository,FALSE,NA,NA,gene set enrichment analysis (gsea) was performed with the gsea v2.0 software (broad institute of mit (massachusetts institute of technology) and harvard http://www.broad.mit.edu/gsea)50 on transcriptome data produced in our laboratory (gse31099 and gse44355) or on publicly available transcriptome datasets downloaded from the gene expression omnibus (geo; https://www. ncbi.nlm.nih.gov/geo/): normal colon epithelium and colon adenomas from apcmin/+ mice (gse422 samples gsm6191–gsm6201) braf-v600e-infected human melanocytes (gse46801) human mammary epithelial cells in p16ink4adependent stasis or telomere shortening-induced agonescence (gse16058) normal human foreskin bj fibroblasts in replicative senescence (gse13330 samples gsm336385–gsm336628) and normal human mesenchymal stem cells in replicative senescence (gse9593 samples gsm242185 gsm242668 gsm242669 and gsm242672–gsm242674).;     microarray datasets produced in our laboratory and analysed in this study are available at the gene expression omnibus (geo) repository of the national center for biotechnology information under the accession numbers gse31099 and gse44355 for control;bcl2 and suv39h1−;bcl2 lymphomas respectively.,NA
10.1038/onc.2017.325,2018,TRUE,TRUE,field-specific repository,field-specific repository,FALSE,NA,NA,sequencing data are available in the geo database with the accession number gse95585.;     gene expression proﬁling of chl-1 melanoma cells cells were treated with gi50 or gi90 concentrations of bay 1238079 before rna extraction and proﬁling with affymetrix hugene-2.1st arrays.23 data are available in the geo database under gse92736.,NA
10.1038/s41588-017-0014-7,2018,TRUE,FALSE,"field-specific repository, data availability statement",NA,FALSE,NA,NA,methods  methods including statements of data availability and any associated accession codes and references are available at https://doi. org/10.1038/s41588-017-0014-7.      data availability and any associated accession codes and references are available at https://doi,NA
10.1038/s41593-017-0037-5,2018,TRUE,FALSE,"field-specific repository, data availability statement",NA,FALSE,NA,NA,methods  methods including statements of data availability and any associated accession codes and references are available at https://doi. org/10.1038/s41593-017-0037-5.      data availability and any associated accession codes and references are available at https://doi,NA
10.1038/s41598-018-19476-x,2018,TRUE,TRUE,field-specific repository,field-specific repository,FALSE,NA,NA,the microarray data are deposited in https://www.ncbi.nlm.nih. gov/geo/ with database entry: gse103092.,NA
10.1053/j.gastro.2017.12.008,2018,TRUE,TRUE,"field-specific repository, data availability statement",field-specific repository,FALSE,NA,NA,microarray data have been deposited in the gene expression omnibus (geo; www.ncbi.nlm.nih.gov/ geo/) of the national center for biotechnology information under geo accession number gse76589.;     transcript proﬁling microarray data have been deposited in the gene expression omnibus (geo; www.ncbi.nlm.nih.gov/geo/) of the national center for biotechnology information and can be accessed with the geo accession number gse76589.      data deposition. microarray data have been deposited in the gene expression omnibus (geo; www.ncbi.nlm.nih.gov/ geo/) of the national center for biotechnology information under geo accession number gse76589,NA
10.1080/10942912.2018.1439958,2018,TRUE,FALSE,field-specific repository,NA,FALSE,NA,NA,36] in this study we have used two proteins which included; [1] vanin1: a key enzyme which links metabolic disease and inflammation (pdb id: 4cy) along with its original ligand (2r)-24-dihydroxy-n-[(3s)-3-hydroxy-4-phenylbutyl]-3 3-dimethylbutanamide. [2] estrogen receptor in complex with its original ligand 2-phenyl-1-[4-(2-piperidin-1-yl-ethoxy)-phenyl]-1234-tetrahydro-isoquinolin-6-ol (pdb id: 1uom).,NA
10.1093/gbe/evx268,2018,TRUE,TRUE,"field-specific repository, data availability statement",field-specific repository,FALSE,NA,NA,accepted: december 18 2017 data deposition: all sequences generated in this study were submitted to ncbi genbank under accession numbers kx551960–kx551962 ky780086–ky780110 mf683844–mf683846 and mf706165.      data deposition: all sequences generated in this study were submitted to ncbi genbank under accession numbers kx551960,NA
10.1093/nar/gkx1088,2018,TRUE,FALSE,data availability statement,NA,FALSE,NA,NA,data availability   nucleic acids research 2018 vol. 46 database issue d1141,NA
10.1093/neuonc/nox188,2018,TRUE,TRUE,field-specific repository,field-specific repository,FALSE,NA,NA,the mgmt promoter methylation status (methylated vs unmethylated) was determined from the illumina infinium humanmethylation450 array data as described previously (using the “mgmtstp27” library in r v3.4.0).1920 furthermore a random forest algorithm compared each case with a brain tumor dna methylation profile reference bank consisting of more than 2800 brain tumor cases to assign each patient to a glioblastoma subgroup based on the individual global dna methylation pattern (see supplementary table s2 and www.molecularneuropathology.org/mnp/classifier/1).102122 the humanmethylation450 array data of the present study have been deposited in the national center for biotechnology information’s gene  expression omnibus (http://www.ncbi.nlm.nih.gov/geo) and are accessible through geo series accession number gse103659.,NA
10.1111/all.13266,2018,TRUE,FALSE,supplement,NA,FALSE,NA,NA,these responsibilities include the detection  document (see data s1) to demonstrate the spectrum of approaches  assessment minimization and communication of safety issues such  on how allergens are currently regulated in the eu.;     however in many countries hta is not per-  germany  27  or the enforcement of directive 89/342/eec in the  formed by the same authorities that are responsible for marketing  2  (see data s1) or reimbursement issues.,NA
10.1111/all.13307,2018,TRUE,FALSE,supplement,NA,FALSE,NA,NA,(data s2).,NA
10.1111/aos.13381,2018,TRUE,FALSE,supplement,NA,FALSE,NA,NA,data s1.,NA
10.1111/exd.13402,2018,TRUE,FALSE,supplement,NA,FALSE,NA,NA,table s1 effects of uvr on mast cells ex vivo table s2 effects of uvr on mast cells and mast cell responses in vivo table s3 effects of uv therapy in urticaria table s4 effects of uv therapy in mastocytosis data s1 references  how to cite this article: siiskonen h smorodchenko a krause k maurer m.,NA
10.1111/his.13375,2018,TRUE,FALSE,supplement,NA,FALSE,NA,NA,additional results on immune cell scoring and challenges in pd-l1 scoring are presented in data s1 tables s3 s4 and figure s3.;     supporting information additional supporting information may be found in the online version of this article: data s1.,NA
10.1111/ner.12690,2018,TRUE,FALSE,supplement,NA,FALSE,NA,NA,all data are given in the table 2,NA
10.1126/science.aaq1723,2018,TRUE,TRUE,field-specific repository,field-specific repository,FALSE,NA,NA,data and materials availability: the sequencing data generated is available in geo under the accession gse103633.,NA
10.1126/sciimmunol.aar6676,2018,TRUE,TRUE,supplement,supplement,FALSE,NA,NA,table s1. raw data,NA
10.1126/sciimmunol.aar6689,2018,TRUE,TRUE,supplement,supplement,FALSE,NA,NA,table s1. raw data,NA
10.1136/annrheumdis-2017-211782,2018,TRUE,FALSE,supplement,NA,FALSE,NA,NA,table 1). for the three peptides where raw data,NA
10.1136/bjophthalmol-2017-310156,2018,TRUE,FALSE,supplement,NA,FALSE,NA,NA,supplementary table 1). in 13 patients a full data set,NA
10.1158/0008-5472.CAN-17-2129,2018,TRUE,TRUE,field-specific repository,field-specific repository,FALSE,NA,NA,gene expression data has been deposited into the gene expression omnibus (geo) with accession number gse95478.,NA
10.1158/1078-0432.CCR-17-2410,2018,TRUE,TRUE,field-specific repository,field-specific repository,FALSE,NA,NA,sequencing data have been deposited in the arrayexpress database at embl-ebi (www.ebi.ac.uk/arrayexpress) under accession number e-mtab-6021.;     the mrna expression data were deposited in arrayexpress under accession number e-mtab-6022.,NA
10.1158/2326-6066.CIR-17-0256,2018,TRUE,TRUE,field-specific repository,field-specific repository,FALSE,NA,NA,the annotated nfat-cbr sequence is accessible online via genbank (accession number mf462285).,NA
10.1177/2048872617708973,2018,TRUE,FALSE,field-specific repository,NA,FALSE,NA,NA,they occur as various complexes or fragments and post-translational modifications (e.g. phosphorylation).1133839 intact ctns rapidly disappear from the circulation during the early hours after ami but immunoreactive fragments persist for longer.3839 the clinical relevance of complex formation post-translational ctn modifications and ctn degradation after myocardial injury is that they may lead to changes in the availability of specific epitopes and thus varying recoveries of ctn variants in different ctn assays.1–3 most assays detect intact ctn (free or complex bound) and a varying mixture of ctn degradation products.  hs-ctns in chronic renal failure renal dysfunction is a condition in which elevated hs-ctn concentrations are commonly detected and a previous  european heart journal: acute cardiovascular care 7(6) generation of the ctnt assay which is no longer available in most parts of the world has been approved by the us food and drug administration for risk stratification in endstage renal disease patients.,NA
10.1182/blood-2017-09-805259,2018,TRUE,TRUE,field-specific repository,field-specific repository,FALSE,NA,NA,the data reported in this article have been deposited in the gene expression omnibus database (accession number gse109805).,NA
10.12688/f1000research.17022.1,2018,TRUE,TRUE,general-purpose repository,general-purpose repository,TRUE,TRUE,other repository/website,software availability the r script used to as part of this study is available from open science framework https://doi.org/10.17605/osf.io/fh42615 licence: mit license  data availability all data underlying the results are available as part of the article and no additional source data are required.;     osf: dataset 1: intovalue. https://doi.org/10.17605/osf.io/ fh42615 the data is available under a cc0 1.0 licence  extended data the methods for our explorative follow-up study have been published as a preregistered study protocol available from open science framework.;     osf: extended data: intovalue. https://doi.org/10.17605/osf.io/ fh42615 available under a cc0 1.0 licence  grant information this study was supported by intramural funding of charité – universitätsmedizin berlin hannover medical school and university of freiburg.,software availability the r script used to as part of this study is available from open science framework https://doi.org/10.17605/osf.io/fh42615 licence: mit license  data availability all data underlying the results are available as part of the article and no additional source data are required.
10.12854/erde-149-54,2018,TRUE,FALSE,field-specific repository,NA,FALSE,NA,NA,box 65 02 61 13302 berlin germany 3geography department humboldt-universität zu berlin unter den linden 6 10099 berlin germany tobia.lakes@geo.hu-berlin.de  manuscript submitted: 14 june 2017 / accepted for publication: 17 november 2017 / published online: 30 march 2018  abstract the physical environment strongly influences physical activity in urban settings.,NA
10.1371/journal.pone.0207041,2018,TRUE,TRUE,supplement,supplement,FALSE,NA,NA,xlsx) s2 table,NA
10.1523/JNEUROSCI.1412-17.2017,2018,TRUE,TRUE,field-specific repository,field-specific repository,FALSE,NA,NA,sequencing data have been deposited in ncbi’s gene expression omnibus (edgar et al. 2002) and are accessible through geo series accession number gse99164 (https://www.ncbi.nlm. nih.gov/geo/query/acc.cgi?,NA
10.1534/g3.117.300170,2018,TRUE,TRUE,"field-specific repository, supplement",field-specific repository,TRUE,TRUE,github,the raw data ﬁles are available at the gene expression omnibus (gse103034).     raw data ﬁles are available at the gene expression omnibus (gse103034). table s4,the code for microarray analysis was written in r and is available on github in the repository lenalampe/microarray-analysis (https://github.com/ lenalampe/microarray-analysis).
10.3414/ME17-01-0058,2018,FALSE,NA,NA,NA,TRUE,FALSE,NA,NA,the r code implementing given as where g(t) is a given event time distribu∑ ψ≔ the calculations required for the simulation h : θ≥1 versus h : θ<1. (1) tion corresponding to a weighting func0 1 <<formel 06>> ∈  δ | ψtion.≔ study and for the illustrating example the form of this weighting function ≔ lim is  [formel_im_fließtext_01: → δ provided as supplementary <<formel 06>> material to ease the standard test to assess the above hypo- will be presented later within this section.
10.3758/s13423-017-1292-x,2018,TRUE,FALSE,"general-purpose repository, supplement",NA,TRUE,FALSE,NA,reanalysis #5: a significant difference does not imply accurate classification for this analysis we used the r code that was used in franz and von luxburg (franz & von luxburg 2015) which is publicly available (https://osf.io/7825t/).;     supporting information all supplementary materials can be accessed as a html or r markdown file at: https://doi.org/10.6084/m9.figshare.4888391. v2  acknowledgements p.m. was supported by the research fund flanders (fwo vlaanderen) through a doctoral fellowship.    table 2  477  bayes factor analysis for the full data set,reanalysis #5: a significant difference does not imply accurate classification for this analysis we used the r code that was used in franz and von luxburg (franz & von luxburg 2015) which is publicly available (https://osf.io/7825t/).
10.7554/eLife.32373,2018,TRUE,TRUE,"general-purpose repository, data availability statement",general-purpose repository,FALSE,NA,NA,transparent reporting form doi: https://doi.org/10.7554/elife.32373.017  data availability the data is available at dryad digital repository.;     the following dataset was generated:  author(s)  year dataset title  galliano e franzoni 2018 data from: embryonic and postnatal neurogenesis produce e breton m functionally distinct subclasses of chand a byrne d dopaminergic neuron murthy v grubb m  dataset url http://dx.doi.org/10. 5061/dryad.b5hg8d6  database license and accessibility information available at dryad digital repository under a cc0 public domain dedication  references aarts e verhage m veenvliet jv dolan cv van der sluis s.     data availability the data is available at dryad,NA
10.1001/jamanetworkopen.2019.4980,2019,TRUE,FALSE,data availability statement,NA,FALSE,NA,NA,data sharing statement  jama network open. 2019;2(5):e194980. doi,NA
10.1002/cyto.a.23781,2019,TRUE,TRUE,"field-specific repository, data availability statement",field-specific repository,FALSE,NA,NA,data are available via https://flowrepository.org/ (frfcm-z2zd and fr-fcm-z2zf).      data availability  20. 21. data are available via https://flowrepository.org/ (frfcm-z2zd and fr-fcm-z2zf,NA
10.1002/term.2755,2019,TRUE,FALSE,supplement,NA,FALSE,NA,NA,raw data were saved as csv,NA
10.1007/s12253-017-0360-x,2019,TRUE,FALSE,supplement,NA,FALSE,NA,NA,all data have been displayed in table 1,NA
