doi,year,in_PURE,is_open_data_oddpub,open_data_manual_check,open_data_category,open_data_category_manual,is_open_code_oddpub,open_code_manual_check,open_code_category_manual,open_data_statements,open_code_statements
10.1016/j.molcel.2019.01.016,2019,TRUE,TRUE,TRUE,"field-specific repository, data availability statement",field-specific repository,FALSE,,,molecular cell 74 143–157 april 4 2019 157   star+methods key resources table  reagent or resource  source  identifier  novagen  cat no. 70954-3  pvs10 (e. coli rnap co-expression plasmid for a- b- c-terminally his6-tagged b’- and u-subunits)  svetlov and artsimovitch 2015  n/a  pia1159 (e. coli rnap co-expression plasmid for c-terminally his6-tagged a [d235-end] - b- b’- and u-subunits)  svetlov and artsimovitch 2015  n/a  petm11-nusa (e. coli nusa full-length deletion and mutation proteins with cleavable n-terminal (his)6-tag)  said et al. 2017 and this study  n/a  petm11-nusb (e. coli nusb protein with cleavable n-terminal (his)6-tag)  luo et al. 2008  n/a  pgex-6p1-nusg (e. coli nusg protein with cleavable n-terminal gst-tag)  said et al. 2017 and this study  n/a  pgex-6p1-nuse (e. coli nuse protein with cleavable n-terminal gst-tag)  luo et al. 2008  n/a  pgex-6p1-ln (bacteriophage l n full-length deletion and mutation proteins with cleavable n-terminal gst-tag)  said et al. 2017 and this study  n/a  bacterial and virus strains escherichia coli rosetta2 de3 chemicals peptides and recombinant proteins  petm-11-rho  this study  n/a  ln88-107 peptide  €ßmuth tu roderich su berlin germany  n/a  pdb: 6gov  deposited data e. coli rnap-nusa-nusg-nusb-nuse-ln  this paper  rnap-nusa-nusg-nusb-nuse-ln cryo-em maps  this paper  emdb: emd-0043  original gel images  this paper  https://doi.org/10.17632/tp4n84ny5g.1  n/a  n/a  template dna dnaiib (tdna): cttgttatccgctca caatgccacacgcctaacgagccggaagcataaa gtgtaaagcctttttt  said et al. 2017  n/a  non-template dna dnai (ntdna): aaaaaaggcttt acactttatgcttccggctcgtataatcgcacctta tgtgagcggataacaag  said et al. 2017  n/a  nut rna: ggcgcucuuuaacauuaagcccugaag aagggcaaaaaucaaauuaaaccacaccuggcg uguggc  said et al. 2017  n/a  experimental models: organisms/strains escherichia coli oligonucleotides  (continued on next page)  e1 molecular cell 74 143–157.e1–e5 april 4 2019   continued reagent or resource  source  identifier  pns-31- dna template for transcription assay (includes nut site): aagctttcagatctctcacctac caaacaatgcccccctgcaaaaaataaattcatat aaaaaacatacagataaccatctgcggtgataaat tatctctggcggtgttgacataaataccactggc ggtgatactgagcacatcagcaggacgcactga ccaccatgaaggtgacgctcttaaaaattaagcc ctgaagaagggcagcattcaaagcagaaggctt tggggtgtgtgatacgaaacgaagcattggccg taagtgcgattccggattagctgccaattctagc atgcctgcaggtcgactctagatcagatctctca cctaccaaacaagggaaaatcgattcctcttatc tagcgcggggggttttcaatcccgaaacagttc gcaggtaatagttagagcctgcataacggtttc gggattttttcgcggcataacatgcagtggacgc cagaaaattaagggaaaatcgattcctcttatctag ggtaccgagctcgaattcgtaatcatggtcatagctgtttcctgtgtga aattgttatccgctcacaatt ccacacaacatacgagccggaagca taaagtgtaaagcctggggtgcctaatgagtgagctaactcacatta attgcgttgcg  said et al. 2017  n/a  pns-33 - dna template for transcription assay (includes shortened distance between nut side and tr’): aagctttcagatctctcacctaccaaacaatgcccc cctgcaaaaaataaattcatataaaaaacatacaga taaccatctgcggtgataaattatctctggcggtgt tgacataaataccactggcggtgatactgagcacatc agcaggacgcactgaccaccatgaaggtgacgctc ttaaaaattaagccctgaagaagggcagctctagatc agatctctcacctaccaaacaagggaaaatcgattcc tcttatctagcgcggggggttttcaatcccgaaacag ttcgcaggtaatagttagagcctgcataacggtttcg ggattttttcgcggcataacatgcagtggacgccaga aaattaagggaaaatcgattcctcttatctagggtaccga gctcgaattcgtaatcatggt catagctgtttcctgtgtgaaattgttatccgc tcacaattccacacaacatacgagccggaagcataaagtgtaaagcctgg ggtgcctaatgagtgagctaactcacattaattgcgttgcg  this study  n/a  pns-34 - dna template for transcription assay with rhodependent terminator (includes nut and rut side): aagcta attataattataattataattataattatctctggcggtgtt gacttaaagtctaacctatagtataattacagccatcgagag ggacacggggaaacaccaccaataaccccgctcttacaca ttccagccctgaaaaagggcatcaaattaaaccacacctat ggtgtatgcatttatttgcatacattcaatcaattgttatcta aggaaatacttacatatggttcgtgctctagatcagatctct cacctaccaaacaagggaaaatcgattcctcttatctagcg cggggggttttcaatcccgaaacagttcgcaggtaatagtt agagcctgcataacggtttcgggattttttcgcggcataac atgcagtggacgccagaaaattaagggaaaatcgattcctc ttatctagggtaccgagctcgaattcgtaatcatggtcatag ctgtttcctgtgtgaaattgttatccgctcacaattccacac aacatacgagccggaagcataaagtgtaaagcctggggtgc ctaatgagtgagctaactcacattaattgcgttgcg  this study  n/a  ctffind4  rohou and grigorieff 2015  https://grigoriefflab.janelia.org/ctffind4  motioncor2  zheng et al. 2017  http://msg.ucsf.edu/em/software/ motioncor2.html  eman v2.2  tang et al. 2007  https://blake.bcm.edu/emanwiki/eman2  software and algorithms  (continued on next page)  molecular cell 74 143–157.e1–e5 april 4 2019 e2   continued reagent or resource  source  identifier  relion 1.3  scheres 2015  https://www2.mrc-lmb.cam.ac.uk/relion/ index.php?;     data and software availability structure coordinates for the ln-tac were deposited with the protein data bank under accession code 6gov.;     cryo-em maps for the ln-tac were deposited with the electron microscopy data bank under accession code emd-0043.      deposited data e. coli rnap-nusa-nusg-nusb-nuse-ln  this paper  rnap-nusa-nusg-nusb-nuse-ln cryo-em maps  this paper  emdb: emd-0043,
10.1016/j.neuroimage.2019.116449,2019,TRUE,TRUE,TRUE,general-purpose repository,general-purpose repository,TRUE,TRUE,github,this data set is available in bids format from openneuro (https://openneuro.org/datasets/ds002013).;     the data set used for empirical validation in section 4 has been bidsformatted and uploaded to openneuro (https://openneuro.org/datasets /ds002013). time courses of presented  the complete empirical data analysis can be reproduced using matlab code available from github (https://github.com/joramsoch /item-paper).,all simulation code is available from github (https://github.com/joramsoch/item-paper).;     time courses of presented  the complete empirical data analysis can be reproduced using matlab code available from github (https://github.com/joramsoch /item-paper).;     svr code is available on the github repository (https://github.com/joramsoch/item-pap er/blob/master/readme.md#application).;     item has been made available as an spm plug-in on github (see section 6).;     implementation an spm12-compatible matlab implementation of the item approach (https://github.com/joramsoch/item) as well as all code underlying the analyses in this paper (https://github.com/joramsoch /item-paper) are available from github.
10.1016/j.nicl.2019.101947,2019,TRUE,TRUE,FALSE,general-purpose repository,,TRUE,TRUE,github,data preprocessing all image processing and statistical analysis scripts used in this study are available at https://github.com/sheyma/stroke_preprop.,data preprocessing all image processing and statistical analysis scripts used in this study are available at https://github.com/sheyma/stroke_preprop.
10.1016/j.onehlt.2019.100087,2019,TRUE,TRUE,TRUE,field-specific repository,field-specific repository,FALSE,,,nucleotide sequences the nucleotide sequences have been deposited at genbank under accession nos. rjdb00000000-rjbu00000000.,
10.1016/j.tibs.2019.06.004,2019,TRUE,TRUE,FALSE,data availability statement,,FALSE,,,data sharing resources such as dataverse,
10.1016/j.ttbdis.2019.03.001,2019,TRUE,TRUE,TRUE,field-specific repository,field-specific repository,FALSE,,,accession numbers sequences were deposited in ncbi genbank under the following accession numbers mk216291 (strandja-bg2012-gi-strainct) mk216292 (strandja-bg2012-gi-strainer) mk216293 (strandjabg2012-gi-straincy) mk216294 (strandja-bg2012-gi-strainet) mk216295 (strandja-bg2012-gi-straineu) mk216296 (strandja699   ticks and tick-borne diseases 10 (2019) 697–703  v.,
10.1016/j.virusres.2019.04.009,2019,TRUE,TRUE,TRUE,field-specific repository,field-specific repository,FALSE,,,m. glareolus a. agrarius m. musculus c. sabaeus h. sapiens  m. glareolus a. agrarius nucleotide identity (%)  m. musculus  c. sabaeus  h. sapiens  – 95.30 95.04 90.48 90.86  91.07 94.63 – 90.48 90.61  87.45 86.78 86.61 – 99.24  87.49 86.95 86.52 97.89 –  91.92 – 97.20 90.86 91.12  amino acid identity (%)  accession numbers for cds identity: c. sabaeus xm_008012292.1; h. sapiens nm_000212.2; m. glareolus kf155167.1; a. agrarius kx237565.1; m. musculus nm_016780.2.  were sequenced (gatc biotech) and the complete coding sequence (cds) of integrin β3 (itgb3) from m. glareolus cell line bvk168 and the deduced amino acid sequence were deposited in genbank accession numbers kf155167 and ahn82190.,
10.1016/S2542-5196(19)30243-8,2019,TRUE,TRUE,TRUE,field-specific repository,field-specific repository,FALSE,,,all sequences were deposited under genbank accession numbers mn541181–1304 (appendix pp 1–2 5–6).,
10.1017/jns.2019.33,2019,TRUE,TRUE,TRUE,field-specific repository,field-specific repository,FALSE,,,the 16s sequencing data included a total of 31 556 258 reads (average of 498 493 reads per samples range 70 875–2 884 392) available as demultiplexed fastq ﬁles on the sra archive in the project prjna531091.,
10.1021/acs.analchem.9b01870,2019,TRUE,TRUE,FALSE,supplement,,FALSE,,,table s5 frequencies of dead cells by ﬂow cytometry (xlsx,
10.1021/acs.jcim.9b00662,2019,TRUE,TRUE,FALSE,general-purpose repository,,FALSE,,,the knime pipeline is publicly © 2019 american chemical society  available on the knime hub: https://hub.knime.com/ volkamerlab/space/teachopencadd (current release: https://doi.org/10.5281/zenodo.3475086).,
10.1038/s41375-019-0430-z,2019,TRUE,TRUE,FALSE,field-specific repository,,FALSE,,,primary data genome data has been deposited at the european genome-phenome archive (ega) under accession number egas00001003209.,
10.1038/s41375-019-0496-7,2019,TRUE,TRUE,TRUE,field-specific repository,field-specific repository,FALSE,,,data are deposited at embl/ebi european nucleotide archive (ena) accession code prjeb32668.,
10.1038/s41379-019-0207-y,2019,TRUE,TRUE,TRUE,"field-specific repository, general-purpose repository","field-specific repository, general-purpose repository",TRUE,TRUE,github,the gene expression omnibus dataset included 27 pulmonary (gse83842 and gse94785) and 32 colorectal adenocarcinoma samples (gse77954 gse77965 gse98990 and gse75546) [23–27].;     raw and unprocessed methylation data for pulmonary enteric adenocarcinoma and metastatic colorectal cancer samples is available at the gene expression omnibus repository under the accession number gse116699.  jurmeister et al.  subtype of inputted 450 k or epic methylation array data is publicly available at https://github.com/aennecken/pead.,the generated random forest classiﬁer was then included in a simple r script that can predict the tissue type (pulmonary colorectal or upper gastrointestinal) solely based on raw idat ﬁles as well as a sample annotation sheet.;     the resulting algorithm was integrated in an r script that is publicly available at https://github.com/aennecken/ pead.;     jurmeister et al.  subtype of inputted 450 k or epic methylation array data is publicly available at https://github.com/aennecken/pead.
10.1038/s41398-018-0326-0,2019,TRUE,TRUE,FALSE,supplement,,FALSE,,,table 1 raw data,
10.1038/s41416-019-0396-7,2019,TRUE,TRUE,TRUE,supplement,supplement,FALSE,,,antibody validation results of western blot experiments are outlined in fig. 3 (associated metrics in supplementary data 1) and suppl.,
10.1038/s41416-019-0659-3,2019,TRUE,TRUE,TRUE,"field-specific repository, general-purpose repository","field-specific repository, general-purpose repository",TRUE,TRUE,github,data availability: the mass spectrometry results (project accession: pxd011162) have been deposited in the embl-ebi pride archive (https://www.ebi.ac.uk/pride/ archive/login).  the scripts and data can be accessed here: https://github.com/adugourd/ berndt_egners_mastrobuoni.,the scripts and data can be accessed here: https://github.com/adugourd/ berndt_egners_mastrobuoni.
10.1038/s41436-019-0566-2,2019,TRUE,TRUE,TRUE,general-purpose repository,general-purpose repository,TRUE,TRUE,github,code availability all training data as well as the classifier are available at https://github.com/pedia-charite/pedia-workflow.,code availability all training data as well as the classifier are available at https://github.com/pedia-charite/pedia-workflow.
10.1038/s41467-018-08053-5,2019,TRUE,TRUE,FALSE,supplement,,FALSE,,,using approximate joint association analysis implemented in gcta9 (see methods) we ﬁrst identiﬁed 212 variants that were independently associated (i.e. with gcta-cojo joint analysis p < 5 × 10−8) with breast cancer in a gwas dataset of 122977 cases and 105974 controls2 (supplementary data 1).;     we extracted association summary statistics from 117 published eqtl datasets identiﬁed in ﬁve broad tissue types: adipose breast individual immune cell types spleen and whole-blood (supplementary data 2).;     the mean number of sentinel eqtl per gene ranged from 1.0 to 2.9 across the 117 eqtl datasets considered which varied considerably in sample size and number of genes tested (supplementary data 2).;     2  when we intersected the list of variants from the joint association analysis and the list of sentinel eqtl from published datasets we identiﬁed 46 sentinel risk variants that were in high ld (r2 > 0.8) with one or more sentinel eqtl implicating 88 individual genes at 46 loci as likely targets of breast cancer risk variants (supplementary data 3 and 4).;     twenty-ﬁve risk variants had a single predicted target gene 10 had two and 11 had three or more (supplementary data 5).;     of the 88 genes 75 (85%) were identiﬁed based on eqtl from whole-blood 10 (11%) from immune cells (pex14 rnf115 tnnt3 efemp2 sdha ap4b1 bcl2l15 btn3a2 hist1h2bl syne1) and three (4%) exclusively from adipose tissue (znf703 hapln4 tm6sf2) (supplementary data 4).;     however it is noteworthy that an additional 29 sentinel eqtl listed in supplementary data 3 had a modest yet signiﬁcant association with the expression of the respective target gene in breast tissue (gtex v7 n = 251) suggesting that larger eqtl datasets of this tissue will be informative to identify the target genes of sentinel risk variants.;     a total of 62 genes were included in the list of 925 targets predicted in the original gwas using inquisit2 while 26 genes represent previously unreported predictions (supplementary data 5).;     of the 77 genes for which this information could be obtained (detailed in supplementary data 4) the protective allele was associated with lower expression for 43 genes (e.g.;     rccd1 atg10 ell and tlr1) (summarized in table 1 and supplementary data 6).;     results from this analysis are presented in supplementary data 7.;     the inconsistent results observed for the remaining six genes were likely caused by technical biases (possible explanations in supplementary data 7).;     similar ﬁndings were  obtained when considering whole-blood transcriptome prediction models based on data from the gtex consortium (supplementary data 7).;     gene structures from gencode v19 gene annotations are shown and the predicted target genes shown in red. a the sentinel risk variant at this locus (rs875311) was in ld with sentinel eqtl for cfl1 (in whole blood) and for efemp2 (in cd8+ t cells only). b the sentinel risk variant (rs11049425 target gene: ccdc91) represents a secondary association signal in this region. c the sentinel risk variant at this locus (rs8105994) is in ld with sentinel eqtl for two previously unreported target gene predictions (ac010335.1 and lrrc25) and four previously predicted targets (ctd-3137h5.1 ell pgpep1 and ssbp4; (supplementary data 5).;     regional association plots for the remaining target gene predictions for overall breast cancer (supplementary data 3) are provided in supplementary figure 1  table 1 directional effect of genetically determined gene expression on disease risk for predicted target genes of breast cancer sentinel risk variants directional effect decreased expression associated with decreased risk  increased expression associated with decreased risk ambiguous  predicted target genes of breast cancer sentinel risk variants ac007283.5 ahrr ap006621.5 ap006621.6 apobec3b-as1 arrdc3 ascc2 bcl2l15 btn2a1 ccdc170 ccdc91 cdca7l cend1 ces1 cox11 ctb-161k23.1 ctd-2116f7.1 cyp51a1 dda1 dffa efemp2 enpp7 fam175a gatad2a hapln4 hcg11 hist1h4l kcnn4 lrrc25 lrrd1 ogfod1 pidd1 ppil3 ptpn22 rps23 sirt5 smg9 tgfbr2 tm6sf2 tmem184b tns1 zbtb38 znf703 ac010335.1 akap9 apobec3a atf7ip atg10 atp6ap1l btn2a3p cbx6 cenpo cfl1 coq5 ctd3137h5.1 dclre1b dnajc27 ell esr1 hlf l3mbtl3 nudt17 pgpep1 rccd1 rhbdd3 rnf115 rp11486m23.2 siva1 syne1 tefm tlr1 adcy3 amfr apobec3b ccdc127 hspa4 mrps18c  target gene predictions supported by functional data.;     we only considered enhancers that overlapped a sentinel risk variant (or a proxy with r2 > 0.80) and restricted our analysis to blood cells (supplementary data 8) given that most target genes were identiﬁed based on eqtl data from wholeblood.;     we found that 25 (28%) of the 88 target gene predictions were supported by functional data (supplementary data 9).;     we then applied the eugene gene-based approach67 to the adjusted gwas results considering in a single association analysis cis eqtl identiﬁed in ﬁve broad tissue types: adipose breast immune cells spleen and whole-blood (supplementary data 10).;     the speciﬁc eqtl included in the gene-based test for each of these 11 genes which were located in six loci >1 mb apart are listed in supplementary data 10.;     for example the eugene gene-based p-value for gstm2 was 6.6 × 10−8 while the best individual eqtl showed more moderate association with breast cancer risk (gcta-cojo conditional association p = 4.1 × 10−5; ﬁve of the 14 sentinel eqtl tested for this gene were nominally associated with disease risk (supplementary data 11).;     when we considered information from all eqtl associated with disease risk for each of the 11 genes (supplementary data 11) we found that decreased disease risk was consistently associated with decreased gene expression for three genes and increased expression for ﬁve genes (table 3 and supplementary data 12).;     we found that 11 of the 88 target genes had a nominally signiﬁcant gene-based association in the adjusted gwas results (eugene p < 0.05; supplementary data 13) with one remaining signiﬁcant after correcting for multiple testing: cbx6 (eugene p = 0.0002).;     of the 54 sentinel risk variants identiﬁed through approximate joint association analysis (supplementary data 14) 19 were in ld (r2 > 0.8) with a sentinel eqtl (supplementary data 15) implicating 24 genes as likely targets of risk-associated variants for er-negative breast cancer (supplementary data 16).;     gwas3 (supplementary data 16 and supplementary data 17) mostly (15 genes) because they are  predicted targets of risk variants identiﬁed in previous gwas which were not considered by milne et al.3.;     the disease protective allele was associated with lower gene expression for seven genes and higher gene expression for 11 genes (summary in table 4 and supplementary data 18; detailed information in supplementary data 15); for the remaining six genes directional effect was either not available (atm casp8 ocel1 pex14 and wdr43) or inconsistent across tissues (adcy3).;     of the 24 target gene predictions 18 were supported by the presence of enhancer– promoter chromatin interactions or an association between enhancer epigenetic marks and gene expression (supplementary data 19).;     gwas adjusted for (i) the association with the sentinel risk variants identiﬁed in this  when we applied eugene to the er-negative gwas results obtained after conditioning on the 54 sentinel risk variants we identiﬁed four genes in four loci with a signiﬁcant genebased association (eugene p < 2.5 × 10−6; table 5 supplementary data 20 and supplementary fig.;     other genes that could be prioritized for functional follow-up include four (of the 24) target genes of sentinel risk variants that had a nominally signiﬁcant gene-based association in the adjusted gwas results (eugene p < 0.05; supplementary data 23): ralb ccdc170 npat and casp8.;     the sentinel risk variants are in ld with sentinel eqtl for mdm4 and pik3c2b (a) znf703 (b) and atm (c; supplementary data 17).;     we identiﬁed a total of 35 transcriptome studies reporting results from eqtl analyses in any one of those ﬁve tissue types (supplementary data 2).,
10.1038/s41467-018-08069-x,2019,TRUE,TRUE,TRUE,"field-specific repository, general-purpose repository, supplement",supplement,FALSE,,,data availability  all sequencing data supporting the ﬁndings of this study have been uploaded to the european genome-phenome archive (http://www.ebi.ac.uk/ega/) and are available via the accession number egas00001002795 all processed data that support the ﬁndings of this study are available in zenodo with the identiﬁer [10.5281/ zenodo.1483691]62. data availability  all sequencing data supporting the ﬁndings of this study have been uploaded to the european genome-phenome archive (http://www.ebi.ac.uk/ega/) and are available via the accession number egas00001002795 all processed data that support the ﬁndings of this study are available in zenodo with the identiﬁer [10.5281/ zenodo.1483691]62.  whole genome sequencing (wgs) of four paired tumor/normal acicc cases and tumor wgs in two additional aciccs revealed that copy number changes were few and broadly distributed among the tumor genomes without recurrent gains or losses present in all 2  cases (fig. 1a supplementary data 1).;     whole transcriptome rna-sequencing analysis of ten aciccs (supplementary data 2) revealed no coding chimeric fusion transcripts as described previously9.;     2 supplementary data 3) which function independent of the genomic sequence orientation.;     we employed chromatin immunoprecipitation followed by sequencing (chip-seq) using antibodies against core histone modiﬁcations h3k27ac (active promoter/enhancer) h3k4me3 (active promoter) h3k27me3 (repressed chromatin) and against the transcription factors nr4a3 and ccctc-binding factor (ctcf) as well as whole genome bisulﬁte sequencing (supplementary data 4) to decipher epigenetic regulatory marks around the breakpoint regions.;     gene expression analysis of ten aciccs and three normal parotid tissues identiﬁed 827 and 404 genes that were signiﬁcantly up- and downregulated in aciccs vs. normal parotid tissues respectively (fig. 6a supplementary data 2).;     first we performed rna-seq and whole mass spectrometry proteome analysis for unbiased determination of mrna expression (supplementary figure 6 supplementary data 5) and protein abundance (supplementary figure 7) respectively.,
10.1038/s41467-018-08196-5,2019,TRUE,TRUE,TRUE,"field-specific repository, supplement, data availability statement",field-specific repository,TRUE,TRUE,github,ngs data and annotated peak ﬁles can be accessed via the ncbi’s gene expression omnibus using the accession number gse111526.;     sequencing data normalized count data and deseq2 output can be accessed via ncbi’s gene expression omnibus using the accession number gse111877.;     chip and rna ngs data sets have been deposited at geo (ncbi) [https://www.ncbi.nlm. nih.gov/geo/]: gse111526 (chip-seq); gse111877 (rna-seq).;     the proteomics data have been deposited to the proteomexchange consortium via pride [https:// www.ebi.ac.uk/pride/archive/] with the identiﬁer: pxd010157.   1 & supplementary data 1).;     the reduced expression of these metabolic genes (such as apolipoproteins cyp enzymes cholesterol synthetases acetyl-coa utilizing enzymes etc.) was conﬁrmed by qrt-pcr (fig. 2f g h and i and supplementary data 2).;     concordantly these phenotypes were again coincident with the differential expression of metabolic gene programs governing glucose lipid fatty acid and cholesterol utilization (like pck1 acacb dhcr7 etc.) as measured by rna-seq (fig. 3d and supplementary data 2) and qrt-pcr in livers of dex or cort treated mice (fig. 3e and f).;     luciferase activity was measured and normalized and individual reporter sequences were classiﬁed into those mediating either activation or repression (or not responding) by gcs (fig. 6a; supplementary data 3).   data availability all the data supporting this article are available upon reasonable request. chip and rna ngs data sets have been deposited at geo (ncbi) [https://www.ncbi.nlm. nih.gov/geo/]: gse111526,all scripts are deposited at github (https://github.com/franzig/ e47ko-liver).;     all scripts are deposited at github (https://github.com/franzig/e47ko-liver).
