doi,year,in_PURE,is_open_data_oddpub,open_data_manual_check,open_data_category,open_data_category_manual,is_open_code_oddpub,open_code_manual_check,open_code_category_manual,open_data_statements,open_code_statements
10.1002/ana.25567,2019,TRUE,TRUE,FALSE,general-purpose repository,,FALSE,,,4   dembek et al: dbs sweet spots in pd  clinical implications our study provides new functional sweet spots for different motor symptoms which we make freely available within the lead-dbs toolbox (https://www.lead-dbs. org/) and the open science framework (https://dx.doi. org/10.17605/osf.io/ybdjf).,
10.1002/ehf2.12416,2019,TRUE,TRUE,FALSE,field-specific repository,,FALSE,,,the patients and controls were included in studies assessing the effect of intracoronary bone marrow-derived mononuclear cell infusion for treatment of chronic heart failure (clinicaltrials.gov; accession numbers: nct 00289822 nct 00284713 nct 00326989 and nct 00962364).,
10.1002/eji.201847955,2019,TRUE,TRUE,TRUE,field-specific repository,field-specific repository,FALSE,,,chip-seq data accession the raw and processed datasets were deposited in the gene expression omnibus (http://www.ncbi.nlm.nih.gov/geo/) under accession number gse120580. www.eji-journal.eu  797   798  epp kaleviste et al.,
10.1002/eji.201848053,2019,TRUE,TRUE,TRUE,field-specific repository,field-specific repository,FALSE,,,the single cell rna sequencing data reported in this paper have been deposited in the gene expression omnibus (geo) database https://www.ncbi.nlm.nih.gov/geo (accession no. gse131365).,
10.1002/eji.201970107,2019,TRUE,TRUE,FALSE,supplement,,FALSE,,,raw data file (.rif) to generate both a compensated image file (.cif,
10.1002/hbm.24599,2019,TRUE,TRUE,FALSE,general-purpose repository,general-purpose repository,TRUE,TRUE,other repository/website,the msc data set is openly available from https:// openneuro.org.;     for the interested reader wishing  ð4þ  for each of these comparisons we calculate the difference of the  data analysis were carried out based on custom-written matlab code to retrace our analyses all files are available from the open science framework (http://osf.io/3mtqx).  corresponding fd values of volume xi and xj that is _x005F_x0003_ _x005F_x0004_ δfdi;j = j fdðxi þ− fd xj j  ð5þ  where we take the absolute difference to match the symmetry of the  3 | results 3.1 | deviation analysis  ssim.,for the interested reader wishing  ð4þ  for each of these comparisons we calculate the difference of the  data analysis were carried out based on custom-written matlab code to retrace our analyses all files are available from the open science framework (http://osf.io/3mtqx).  corresponding fd values of volume xi and xj that is _x005F_x0003_ _x005F_x0004_ δfdi;j = j fdðxi þ− fd xj j  ð5þ  where we take the absolute difference to match the symmetry of the  3 | results 3.1 | deviation analysis  ssim.
10.1002/jcsm.12491,2019,TRUE,TRUE,FALSE,supplement,,FALSE,,,data s1.,
10.1002/mrm.27769,2019,TRUE,TRUE,FALSE,supplement,,FALSE,,,s1 data was therefore only used to quantify flow values in the internal carotids.,
10.1002/rth2.12202,2019,TRUE,TRUE,FALSE,supplement,,FALSE,,,the variance of random effect on  mild  62 (100)  0 (0.0)  moderate  74 (68.5)  34 (31.5)  108 (26.9)  severe  34 (14.7)  197 (85.3)  231 (57.6)  tive treatment effect in the netherlands (data s1).,
10.1002/sim.8421,2019,TRUE,TRUE,FALSE,supplement,,FALSE,,,cif cumulative incidence function; iplw inverse probability of left-truncation weighting. table 2,
10.1007/s00062-019-00785-1,2019,TRUE,TRUE,FALSE,supplement,,FALSE,,,full data set is shown in table 1,
10.1007/s00103-019-02958-2,2019,TRUE,TRUE,FALSE,data availability statement,,FALSE,,,data sharing funktioniert nur wenn besitzeraspekte der daten berücksichtigung ﬁnden. bundesgesundheitsbl 2019 · 62:765–772 https://doi,
10.1007/s00204-019-02510-w,2019,TRUE,TRUE,TRUE,field-specific repository,field-specific repository,FALSE,,,the raw sequencing fastq files have been deposited in the rast metagenomics server (https​://www.mg-rast.org/) under project id mgp87488.,
10.1007/s00223-019-00648-4,2019,TRUE,TRUE,FALSE,supplement,,TRUE,TRUE,supplement,the results of the validation are shown in the supplementary data s1.;     we generated bland–altman plots in which the 3d-ms/bs for each mouse is compared with the 2d-ms/bs for the same animal and limb (supplementary data s2).;     the full results of the statistical analysis as well as the matlab code are included as supplementary data s4.;     2 supplementary data s4).;     3 supplementary data s4).;     the pairwise t-tests for the independent variable sex can be found in the supplementary data s4  in males) which was not observed in lc mice.;     female young sost ko mice had increased tb.bv/tv tb.th and tb.vtmd (table 2 supplementary data s4) as well as increased formation indices: tb.dls/bs tb.ms/bs tb.mar and tb.bfr/bs in the loaded limb compared to the nonloaded limb (fig.;     this is particularly interesting since our fe models predicted the mean strains to be 30% lower for compression and 23% lower for tension in the 26-week-old sost ko females than in the age-matched male sost ko (supplementary data s3) and nevertheless a net gain in bone volume was achieved with loading in females but not in males.;     it is also remarkable that the strains predicted by the fe models in the trabecular compartment were substantially lower in the sost ko mice than in their lcs (supplementary data s3).,the full results of the statistical analysis as well as the matlab code are included as supplementary data s4. the full results of the statistical analysis as well as the matlab code are included as supplementary data s4.
10.1007/s00330-019-06105-y,2019,TRUE,TRUE,FALSE,data availability statement,,FALSE,,,data sharing improves scientific publication: example of the bhydrops initiative^. eur radiol. https://doi,
10.1007/s00345-019-03017-w,2019,TRUE,TRUE,FALSE,supplement,,FALSE,,,all data are summarized in table 2,
10.1007/s00401-019-01982-5,2019,TRUE,TRUE,FALSE,field-specific repository,,FALSE,,,for validation of the cutoffs an independent cohort of 396 cases with available survival and molecular subgroup information was obtained from affymetrix u133p2 expression profiles of previously reported series through geo accession numbers gse10327 [44] gse12992 [22] gse37418 [68] gse49243 [43] and published in northcott et al.,
10.1007/s00401-019-02008-w,2019,TRUE,TRUE,FALSE,field-specific repository,,FALSE,,,data deposition data has been deposited at the european genome-phenome archive under the accession numbers egas00001003480 (chip-seq data) and egas00001003481 (wgs data).,
10.1007/s00401-019-02078-w,2019,TRUE,TRUE,TRUE,field-specific repository,field-specific repository,FALSE,,,unprocessed idat files can be downloaded from the ncbi gene expression omnibus (geo) accession number gse136361.,
10.1007/s00401-019-02090-0,2019,TRUE,TRUE,FALSE,field-specific repository,,FALSE,,,for t-sne plots publicly available data from 82 defined brain tumor entities (n = 2801 [3] geo accession number gse90496) and from posterior fossa group b ependymomas (n = 212 [5] geo accession number gse117130) were included.,
10.1007/s00439-019-02000-0,2019,TRUE,TRUE,TRUE,field-specific repository,field-specific repository,FALSE,,,the variants were deposited in the clinvar databased under accession numbers scv000864221 and scv000864222 (https:​ //www. ncbi.nlm.nih.gov/clinv​ar/).,
10.1007/s11357-019-00147-2,2019,TRUE,TRUE,FALSE,supplement,,FALSE,,,table 1). the reduction was significant for vm  statistical analysis all data,
10.1007/s11695-019-03815-6,2019,TRUE,TRUE,FALSE,supplement,,FALSE,,,table 1  statistical analysis all data,
10.1007/s12035-019-01822-3,2019,TRUE,TRUE,TRUE,field-specific repository,field-specific repository,FALSE,,,rna-seq data have been deposited at the gene expression omnibus (geo) [21] under geo accession number gse122345.,
10.1007/s12975-019-00730-x,2019,TRUE,TRUE,TRUE,field-specific repository,field-specific repository,FALSE,,,microarray data from garcía-berrocoso have been deposited in the gene expression omnibus (geo) database: gse124026.,
10.1016/j.actatropica.2019.04.006,2019,TRUE,TRUE,TRUE,field-specific repository,field-specific repository,FALSE,,,the newly generated sequences were deposited in genbank under accession numbers mh577060-mh577180.,
10.1016/j.ajhg.2019.06.009,2019,TRUE,TRUE,FALSE,field-specific repository,,FALSE,,,accession numbers the mutations in this report have been deposited at www.gene-talk. de and can be accessed at the following urls: http://www. gene-talk.de/annotations/1371027 and http://www.gene-talk.de/ annotations/1371028.,
10.1016/j.biopsych.2019.03.974,2019,TRUE,TRUE,FALSE,field-specific repository,,FALSE,,,raw data (fastq ﬁles) from the sequencing experiment (triplicates from wild-type and tshz3-mutant cortices) and raw abundance measurements for genes (read counts) for each sample are available from gene expression omnibus under accession gse119791 which should be quoted in any manuscript discussing the data.  major morphological defects after postnatal tshz3 loss.,
10.1016/j.cell.2018.11.024,2019,TRUE,TRUE,TRUE,"field-specific repository, general-purpose repository","field-specific repository, general-purpose repository",FALSE,,,cell 176 505–519 january 24 2019 519   star+methods key resources table  reagent or resource  source  identifier  antibodies mouse anti-ubqln4 clone a333  santa cruz biotechnology  cat#: sc-136145; rrid: ab_2009286  rabbit anti-ubqln4  lifespan biosciences  cat#: ls-c108556; rrid:ab_10635383  rabbit anti-ubqln4  bethyl  cat#: a300-bl20642; rrid: n/a  rabbit anti-phospho-ubqln4(s318)  bethyl  cat#: a300-bl20645; rrid: n/a  mouse anti-phospho-histone h2a.x (ser139) clone jbw301  millipore  cat#: 05-636; rrid: ab_309864  rabbit anti-rad51  millipore  cat#: pc130; rrid: ab_2238184  mouse a-tubulin clone tub-1a2  abcam  cat#: ab11325; rrid: ab_2210526  mouse anti-53bp1  millipore  cat#: mab3802; rrid: ab_11212586  mouse anti-ubiquitinylated proteins clone fk2  millipore  cat#: 04-263; rrid: ab_612093  mouse anti-flag  santa cruz biotechnology  cat#: sc-166355; rrid: ab_2017593  mouse anti-hsp90 clone 68  bd biosciences  cat#: 610418; rrid: ab_397798  mouse b-actin clone ac-74  sigma-aldrich  cat#: a5316; rrid: ab_476743  rabbit anti-phospho-kap1(s824)  bethyl  cat#: a300-767a; rrid: ab_669740  rabbit anti-mre11  novus  cat#: nb 100-142; rrid: ab_350079  rabbit anti-histone h3  abcam  cat#: ab1791; rrid: ab_302613  mouse anti-his  genscript  cat#: a00186 rrid: ab_914704  mouse igg  santa cruz biotechnology  cat#: sc-2025; rrid: ab_737182  rabbit anti-caspase 3 active form  bd biosciences  cat#: 559565; rrid: ab_397274  anti-brdu  ge healthcare  cat#: rpn202; rrid: ab_2314032  goat alexa fluor 488 anti-mouse  invitrogen  cat#: a-11001; rrid: ab_2534069  goat alexa fluor 647 anti-mouse  invitrogen  cat#: a-21235; rrid: ab_2535804  goat alexa fluor 488 anti-rabbit  invitrogen  cat#: a-11008; rrid: ab_143165  goat alexa fluor 647 anti-rabbit  invitrogen  cat#: a27040; rrid: ab_2536101  goat anti-rabbit igg peroxidase  emd millipore  cat#: ap132p; rrid: ab_90264  goat anti-mouse igg peroxidase  emd millipore  cat#: 12-349; rrid: ab_390192  new england biolabs  cat#: c3040i  neocarzinostatin  sigma-aldrich  cat#: n9162  dna-pk inhibitor ku60648  selleck chemicals  cat#: s8045  atm inhibitor ku60019  selleck chemicals  cat#: s1570  etoposide  hexal  n/a  cisplatin  accord  n/a  hydroxyurea  sigma-aldrich  cat#: h8627  camptothecin  millipore  cat#: 208925  usp2  bostonbiochem  cat#: e-504  atr inhibitor az20  selleck chemicals  cat#: s7050  mirin  sigma-aldrich  cat#: m9948  pfm01  sigma-aldrich  cat#: sml1735  parp1 inhibitor olaparib  medchem express  cat#: hy-10162/cs-0075  mg132  selleck chemicals  cat#: s2619  prolong_x005F_x0002_ gold antifade reagent  molecular probes  cat#: p-36931  bacterial and virus strains e. coli stable competent (high efficiency) chemicals peptides and recombinant proteins  (continued on next page)  e1 cell 176 505–519.e1–e10 january 24 2019   continued reagent or resource  source  identifier cat#: g7573  celltiter-glo_x005F_x0002_ reagent  promega  n-ethylmaleimide (nem)  sigma-aldrich  cat#: e3876  puromycin  sigma-aldrich  cat#: p8833  g418  sigma-aldrich  cat#: g418-ro  polybrene  sigma aldrich  h9268-10g  lysc  wako  cat#: 125-05061  gluc  promega  cat#: v1651  trypsin  promega  v5113  dharmafect-1  dharmacon  t-2001-01  critical commercial assays subcellular protein fractionation kit  thermo fisher  78840  truseq sample preparation kit v2  illumina  fc-121-2001  tio2 phosphopeptide enrichment kit  thermo fisher  a32993  seqcap ez exome v3.0 kit  roche  06465692001  agilent dna 1000 kit  agilent  5067-1504  quickchange ii site-directed mutagenesis kit  agilent  200523  quantative high-content (hcs) microscopy raw and analyzed data  this paper mendeley data  https://doi.org/10.17632/gz4xvwbvhs.1  phospho-proteomic mass-spectrometry raw and analyzed data  this paper proteomexchange consortium dataset identifier: pxd011488  https://www.ebi.ac.uk/pride/archive/login  deposited data  username: reviewer13154@ebi.ac.uk password: 8mob4suw  experimental models: cell lines human dermal fibroblasts patient a-iv-4  isolated from patient  n/a  human dermal fibroblasts patient a-iv-5  isolated from patient  n/a  human dermal fibroblasts patient b-iv-3  isolated from patient  n/a  human dermal fibroblasts parent b-iii-2  isolated from patient  n/a  human dermal fibroblasts wt_1  isolated from patient  n/a  human dermal fibroblasts wt_2  isolated from patient  n/a  u2-os  atcc  htb-96  hek293ft  thermofisher scientific  r70007  u2-os-ssr-gfp  huertas lab sevilla spain  n/a  u2-os-dr-gfp  huertas lab sevilla spain  n/a  mda-231-mb ubqln4 crispr ko  this paper  n/a  chp212  fischer lab cologne germany (confirmation dsmz 2007)  crl-2273 (atcc)  kelly  fischer lab cologne germany (confirmation dsmz 2007)  acc 355  be(2)c  witt/deubzer lab essen germany  crl-2268 (atcc)  lan5  dsmz 2013  acc 673  imr32  dsmz 2006  acc 165  lan-1  dsmz 2013  acc 635  chp134  dsmz 2013  acc 653  shep  fischer lab cologne germany  n/a  sk-n-sh  atcc 2014  htb-11 (continued on next page)  cell 176 505–519.e1–e10 january 24 2019 e2   continued reagent or resource  source  identifier  sknas  fischer lab cologne germany (confirmation dsmz 2007)  crl-2137 (atcc)  clb-ga  schulte lab essen germany (confirmation dsmz 2014)  n/a  nbl-s  dsmz 2014  acc 656  sy5y  fischer lab cologne germany (confirmation dsmz 2007)  acc 209 (dsmz)  gimen  dsmz 2014  acc 654  skndz  atcc 2014  crl-2149  nmb  dsmz 2013  acc 657  experimental models: organisms/strains c. elegans: strain n2 bristol  caenorhabditis genetics center  wb strain: n2; c. elegans wild isolate  c. elegans: strain fx1574: ubql-1(tm1574) i.;     data and software availability the mass spectrometry proteomics data have been deposited to the proteomexchange consortium via the pride partner repository with the dataset identifier pxd011488. cell 176 505–519 january 24 2019 519   star+methods key resources table  reagent or resource  source  identifier  antibodies mouse anti-ubqln4 clone a333  santa cruz biotechnology  cat#: sc-136145; rrid: ab_2009286  rabbit anti-ubqln4  lifespan biosciences  cat#: ls-c108556; rrid:ab_10635383  rabbit anti-ubqln4  bethyl  cat#: a300-bl20642; rrid: n/a  rabbit anti-phospho-ubqln4(s318)  bethyl  cat#: a300-bl20645; rrid: n/a  mouse anti-phospho-histone h2a.x (ser139) clone jbw301  millipore  cat#: 05-636; rrid: ab_309864  rabbit anti-rad51  millipore  cat#: pc130; rrid: ab_2238184  mouse a-tubulin clone tub-1a2  abcam  cat#: ab11325; rrid: ab_2210526  mouse anti-53bp1  millipore  cat#: mab3802; rrid: ab_11212586  mouse anti-ubiquitinylated proteins clone fk2  millipore  cat#: 04-263; rrid: ab_612093  mouse anti-flag  santa cruz biotechnology  cat#: sc-166355; rrid: ab_2017593  mouse anti-hsp90 clone 68  bd biosciences  cat#: 610418; rrid: ab_397798  mouse b-actin clone ac-74  sigma-aldrich  cat#: a5316; rrid: ab_476743  rabbit anti-phospho-kap1(s824)  bethyl  cat#: a300-767a; rrid: ab_669740  rabbit anti-mre11  novus  cat#: nb 100-142; rrid: ab_350079  rabbit anti-histone h3  abcam  cat#: ab1791; rrid: ab_302613  mouse anti-his  genscript  cat#: a00186 rrid: ab_914704  mouse igg  santa cruz biotechnology  cat#: sc-2025; rrid: ab_737182  rabbit anti-caspase 3 active form  bd biosciences  cat#: 559565; rrid: ab_397274  anti-brdu  ge healthcare  cat#: rpn202; rrid: ab_2314032  goat alexa fluor 488 anti-mouse  invitrogen  cat#: a-11001; rrid: ab_2534069  goat alexa fluor 647 anti-mouse  invitrogen  cat#: a-21235; rrid: ab_2535804  goat alexa fluor 488 anti-rabbit  invitrogen  cat#: a-11008; rrid: ab_143165  goat alexa fluor 647 anti-rabbit  invitrogen  cat#: a27040; rrid: ab_2536101  goat anti-rabbit igg peroxidase  emd millipore  cat#: ap132p; rrid: ab_90264  goat anti-mouse igg peroxidase  emd millipore  cat#: 12-349; rrid: ab_390192  new england biolabs  cat#: c3040i  neocarzinostatin  sigma-aldrich  cat#: n9162  dna-pk inhibitor ku60648  selleck chemicals  cat#: s8045  atm inhibitor ku60019  selleck chemicals  cat#: s1570  etoposide  hexal  n/a  cisplatin  accord  n/a  hydroxyurea  sigma-aldrich  cat#: h8627  camptothecin  millipore  cat#: 208925  usp2  bostonbiochem  cat#: e-504  atr inhibitor az20  selleck chemicals  cat#: s7050  mirin  sigma-aldrich  cat#: m9948  pfm01  sigma-aldrich  cat#: sml1735  parp1 inhibitor olaparib  medchem express  cat#: hy-10162/cs-0075  mg132  selleck chemicals  cat#: s2619  prolong_x005F_x0002_ gold antifade reagent  molecular probes  cat#: p-36931  bacterial and virus strains e. coli stable competent (high efficiency) chemicals peptides and recombinant proteins  (continued on next page)  e1 cell 176 505–519.e1–e10 january 24 2019   continued reagent or resource  source  identifier cat#: g7573  celltiter-glo_x005F_x0002_ reagent  promega  n-ethylmaleimide (nem)  sigma-aldrich  cat#: e3876  puromycin  sigma-aldrich  cat#: p8833  g418  sigma-aldrich  cat#: g418-ro  polybrene  sigma aldrich  h9268-10g  lysc  wako  cat#: 125-05061  gluc  promega  cat#: v1651  trypsin  promega  v5113  dharmafect-1  dharmacon  t-2001-01  critical commercial assays subcellular protein fractionation kit  thermo fisher  78840  truseq sample preparation kit v2  illumina  fc-121-2001  tio2 phosphopeptide enrichment kit  thermo fisher  a32993  seqcap ez exome v3.0 kit  roche  06465692001  agilent dna 1000 kit  agilent  5067-1504  quickchange ii site-directed mutagenesis kit  agilent  200523  quantative high-content (hcs) microscopy raw and analyzed data  this paper mendeley data  https://doi.org/10.17632/gz4xvwbvhs.1  phospho-proteomic mass-spectrometry raw and analyzed data  this paper proteomexchange consortium dataset identifier: pxd011488  https://www.ebi.ac.uk/pride/archive/login  deposited data  username: reviewer13154@ebi.ac.uk password: 8mob4suw  experimental models: cell lines human dermal fibroblasts patient a-iv-4  isolated from patient  n/a  human dermal fibroblasts patient a-iv-5  isolated from patient  n/a  human dermal fibroblasts patient b-iv-3  isolated from patient  n/a  human dermal fibroblasts parent b-iii-2  isolated from patient  n/a  human dermal fibroblasts wt_1  isolated from patient  n/a  human dermal fibroblasts wt_2  isolated from patient  n/a  u2-os  atcc  htb-96  hek293ft  thermofisher scientific  r70007  u2-os-ssr-gfp  huertas lab sevilla spain  n/a  u2-os-dr-gfp  huertas lab sevilla spain  n/a  mda-231-mb ubqln4 crispr ko  this paper  n/a  chp212  fischer lab cologne germany (confirmation dsmz 2007)  crl-2273 (atcc)  kelly  fischer lab cologne germany (confirmation dsmz 2007)  acc 355  be(2)c  witt/deubzer lab essen germany  crl-2268 (atcc)  lan5  dsmz 2013  acc 673  imr32  dsmz 2006  acc 165  lan-1  dsmz 2013  acc 635  chp134  dsmz 2013  acc 653  shep  fischer lab cologne germany  n/a  sk-n-sh  atcc 2014  htb-11 (continued on next page)  cell 176 505–519.e1–e10 january 24 2019 e2   continued reagent or resource  source  identifier  sknas  fischer lab cologne germany (confirmation dsmz 2007)  crl-2137 (atcc)  clb-ga  schulte lab essen germany (confirmation dsmz 2014)  n/a  nbl-s  dsmz 2014  acc 656  sy5y  fischer lab cologne germany (confirmation dsmz 2007)  acc 209 (dsmz)  gimen  dsmz 2014  acc 654  skndz  atcc 2014  crl-2149  nmb  dsmz 2013  acc 657  experimental models: organisms/strains c. elegans: strain n2 bristol  caenorhabditis genetics center  wb strain: n2; c. elegans wild isolate  c. elegans: strain fx1574: ubql-1(tm1574) i.,
10.1016/j.cell.2018.11.036,2019,TRUE,TRUE,TRUE,field-specific repository,field-specific repository,FALSE,,,830 cell 176 816–830 february 7 2019   star+methods key resource table  reagent or resource  source  identifier  anti-brdu  becton dickinson  347580  647-anti-mouse secondary antibody  lifetechnology  a21239  anti-yy1  santa cruz biotech  sc-7341 lot a2318  antibodies  hrp-anti mouse secondary antibody  abcam  ab6789  anti-bru  becton dickinson  555627  brdu  sigma-aldrich  b5002  bru  sigma-aldrich  850187  indole-3-acetic acid sodium salt (auxin analog)  sigma-aldrich  i5148-2g  dtag-47 compound  nabet et al. 2018  n/a  rhb-a media  stem cell science  y40001  nebnext ultra dna library prep kit for illumina  illumina  e7370  agilent sureselect customized rna oligo system  agilent  931108 customized  lonza p3 primary cell 4d-nucleofector x kit  lonza  v4xp-3024  this study  ncbi gene expression omnibus (geo): gse114139  chemicals peptides and recombinant proteins  critical commercial assays  deposited data raw and processed sequencing data replication domain boundary calls  pope et al. 2014  n/a  mesc and npc hi-c  bonev et al. 2017  n/a  hi-c before and after ctcf depletion  nora et al. 2017  n/a  esc and npc laminb1 damid  peric-hupkes et al. 2010  n/a  nuclear rna  rivera-mulia et al. 2018  n/a  dnasei hs h3k27ac h3k4m1h3k4m3h3k36m3 p300ctcf chip  yue et al. 2014  n/a  ctcf chip  nora et al. 2017  n/a  smc1-chiapet  dowen et al. 2014  n/a  smc1- hichip  mumbach et al. 2016  n/a  med1 chip  whyte et al. 2013  n/a  oct4 sox2 nanog chip  king and klose 2017  n/a  cage  arner et al. 2015  n/a  sns mapped origins  cayrou et al. 2015  n/a  mouse ctcf binding motif  http://hocomoco11.autosome.ru/motif/ ctcf_mouse.h11mo.0.;     data and software availability the accession number for the repli-seq capture hi-c hi-c 4c-seq bru-seq data and sanger sequencing confirmation for allele specific mutants reported in this paper is geo: gse114139.,
10.1016/j.cell.2019.01.035,2019,TRUE,TRUE,FALSE,field-specific repository,,FALSE,,,finally we examined whether these results are consistent with the available knowledge of the crystal structure of sec24a in complex with sec23a sec22b and the vsv-g d-x-e tail peptide (aa 502–508 on the vsv-g cytosolic tail [vsv-gct] (pdb: 3egd; mancias and goldberg 2008) and the crystal structure of gdp-bound ga12 (pdb: 1zca; kreutz et al. 2006).,
