doi,year,is_open_data_oddpub,open_data_manual_check,open_data_category,open_data_category_manual,is_open_code_oddpub,open_code_manual_check,open_code_category_manual,open_data_statements,open_code_statements
10.1016/j.celrep.2020.108235,2020,TRUE,TRUE,"field-specific repository, general-purpose repository, supplement, data availability statement",field-specific repository,FALSE,NA,NA,deposited on pride archive (https://www.ebi.ac.uk/ pride/archive)  http://www.ebi.ac.uk/pride/ archive/projects/pxd021351  critical commercial assays  deposited data mass spectrometry data  experimental models: cell lines vero  atcc  crl-1586  hacat  boukamp et al. 1988  n/a  hff htert  mcsharry et al. 2001  n/a  hek293t  atcc  crl-3216  u2-os  atcc  htb-96  col581: forward primer for deletion of pul56 by red recombination: cgacgcgggtctatggagcgcgggg aacgcgtttgctgattagtaatgaattc acgatagcttgtctggtaggaggatgacgacgataagtaggg  this paper  n/a  col582: reverse primer for deletion of pul56 by red recombination: acgacaaacggcccct cgttcctaccagacaagctatcgtgaattcatt actaatcagcaaacgcgttccccgcaaccaat taaccaattctgattag  this paper  n/a  col579: forward primer for deletion of icp0 by red recombination: gacccccatggagccccgccccgg agcgagtacccgccggtagtaatgaattccccagc gcgaggtgaggggcaggatgacgacgataagtaggg  this paper  n/a  col580: reverse primer for deletion of icp0 by red recombination: cgccccagacatggcgcccggcc cctcacctcgcgctggggaattcattactaccggc gggtactcgctccggcaaccaattaaccaattctgattag  this paper  n/a  oligonucleotides  crispr gopc grna 1: ggaacatggataccccgcca  this paper  n/a  crispr gopc grna 2: gagagatcgatccagaccaag  this paper  n/a  plasmid: gfp-pul56(1-234)  this paper  n/a  plasmid: gfp-pul56(1-207)  this paper  n/a  recombinant dna  (continued on next page)  e3 cell reports 33 108235 october 6 2020   ll open access  resource continued reagent or resource  source  identifier  plasmid: gfp-pul56(1-157)  this paper  n/a  plasmid: gfp-pul56(1-104)  this paper  n/a  plasmid: gfp-pul56(1-74)  this paper  n/a  plasmid: pul56(1-207)-gfp  this paper  n/a  plasmid: gfp-pul56-aaxa  this paper  n/a  plasmid: yfp-nedd4-ww  juan martin-serrano king’s college london; (martin-serrano et al. 2005)  n/a  plasmid: pf5k myc-gopc  this paper  n/a  plasmid: ha-ub (pmt123)  paul lehner university of cambridge  n/a  plasmid: gst-ul56(1-207)-his6  this paper  n/a  plasmid: his-gopc(1-454)  this paper  n/a  plasmid: his-gopc(1-362)  this paper  n/a  plasmid: his-gopc(27-362)  this paper  n/a  plasmid: his-gopc(276-362)  this paper  n/a  plasmid: his-gopc(27-236)  this paper  n/a  plasmid: flag-tagged tlr2  nick gay university of cambridge  n/a  plasmid: pegfp-n1  clontech  cat#6085-1  plasmid: pspcas9(bb)-2a-puro (px459) v2  feng zhang broad institute (ran et al. 2013)  addgene plasmid #62988  professor steven gygi’s lab harvard medical school boston usa  n/a  maxquant v.;     cell reports 33 108235 october 6 2020 e4   ll open access  resource  data and code availability the mass spectrometry proteomics data have been deposited to the proteomexchange consortium via the pride (perez-riverol et al. 2019) partner repository with the dataset identifier pxd021351 (http://www.ebi.ac.uk/pride/archive/projects/pxd021351). deposited on mendeley data (https://data.mendeley.com)  https://doi.org/10.17632/g5sf93zwtf.3  software and algorithms ‘‘masspike’’ a sequest-based software pipeline for quantitative proteomics  other unprocessed peptide data files for figures 1 3 5 6 and 7  resource availability lead contact further information and requests for resources and reagents should be directed to and will be fulfilled by the lead contact colin m.  comparison of our two ms datasets on protein abundance in hsv-1-infected cells by linear regression analysis showed close correlation (r2 = 0.75) between the  open access  changes caused by wt hsv-1 at 9 hpi (table s1 dataset) and 8 hpi (table s5 dataset) demonstrating the reproducibility of our data (figure s4). pul56 activity alters the plasma membrane proteome modulation of proteins at the cell surface is an immune evasion strategy utilized by multiple viruses.  all data are shown in table s1 deposited data mass spectrometry data  experimental models: cell lines vero  atcc  crl-1586,NA
10.1016/S0140-6736(20)30750-9,2020,TRUE,TRUE,data availability statement,general-purpose repository,FALSE,NA,NA,data sharing to download the data used in these analyses please visit the global health data exchange at http://ghdx.healthdata.org/gbd-2019,NA
10.1016/S2214-109X(20)30230-8,2020,TRUE,TRUE,general-purpose repository,general-purpose repository,TRUE,TRUE,github,for the source code see https:// github.com/ihmeuw/lbd/tree/ ort-lmic-2020 for the study data see http:// ghdx.healthdata.org/record/ ihme-data/lmic-oralrehydration-therapy-coveragegeospatial-estimates-2000-2017  e1059  data sharing the source code used to generate estimates is available online.,for the source code see https:// github.com/ihmeuw/lbd/tree/ ort-lmic-2020 for the study data see http:// ghdx.healthdata.org/record/ ihme-data/lmic-oralrehydration-therapy-coveragegeospatial-estimates-2000-2017  e1059  data sharing the source code used to generate estimates is available online.
10.1016/S2214-109X(20)30278-3,2020,TRUE,TRUE,general-purpose repository,general-purpose repository,TRUE,TRUE,github,for the source code see https://github.com/ihmeuw/lbd/ tree/wash-lmic-2020 for the study data see http://ghdx.healthdata.org/ record/ihme-data/lmic-washaccess-geospatialestimates-2000-2017  e1183  data sharing the source code used to generate estimates is available online.,for the source code see https://github.com/ihmeuw/lbd/ tree/wash-lmic-2020 for the study data see http://ghdx.healthdata.org/ record/ihme-data/lmic-washaccess-geospatialestimates-2000-2017  e1183  data sharing the source code used to generate estimates is available online.
10.1038/s41467-020-15505-4,2020,TRUE,TRUE,"field-specific repository, data availability statement",field-specific repository,FALSE,NA,NA,data availability gene array data are available from array express: accession numbers: e-mtab-8110 and 8111.      data availability gene array data are available from array express: accession numbers: e-mtab-8110,NA
10.1038/s41523-020-0156-0,2020,TRUE,TRUE,data availability statement,general-purpose repository,FALSE,NA,NA,data availability  we identiﬁed 3 ring studies evaluating concordance of stil assessment in breast cancer performed by til-wg pathologists for which we could obtain individual pathologist data and images2223,NA
10.1038/s41564-020-0695-z,2020,TRUE,FALSE,field-specific repository,NA,FALSE,NA,NA,we thank all researchers who released sars-cov-2 genome sequences through the gisaid initiative and particularly the authors of the genbank mn908947 genome sequence: f.,NA
10.1038/s41591-020-0868-6,2020,TRUE,TRUE,"supplement, data availability statement",supplement,TRUE,TRUE,github,the correlation coefficients for all genes are included as supplementary data 1.   data availability  the published datasets can be found as follows: pulmonary airways (european genome-phenome archive: egas00001001755,full details can be found in analysis notebooks available at github. com/teichlab/covid19_ms1.;     code availability  analysis notebooks are available at github.com/teichlab/covid19_ms1.;     analysis notebooks are available at github.com/teichlab/covid19_ms1.
10.1038/s41598-020-79929-0,2020,TRUE,FALSE,data availability statement,NA,FALSE,NA,NA,data availability  the datasets analysed during the current study are available from the corresponding author on reasonable request. scientific reports |  (2020) 10:22433 |  https://doi,NA
10.1038/s42003-019-0741-7,2020,TRUE,FALSE,supplement,NA,FALSE,NA,NA,the full clc dataset is found in supplementary data 1.;     asterisks next to gene names indicate that they are predicted as drivers by pcawg based either on gene or promoter evidence (see supplementary data 1).;     of these clc genes 20% are divergent to a cgc gene compared with 5% for non-clc genes (p-value = 0.018 fisher’s exact test) (fig. 5d) and several are divergent to protein-coding  article  genes that have also been linked or deﬁned to be involved in cancer despite not being classiﬁed as cgcs (supplementary data 2).;     examining their gene ontology (go) terms molecular pathways and other gene function related terms we found this group of genes to be enriched in go terms for “sequence-speciﬁc dna binding” “dna binding” “tube development” and “transcriptional misregulation in cancer” (fig. 5e and supplementary data 3) contrary to the go terms of the divergent protein-coding genes of the non-clc set (supplementary data 4).;     to test this we collected a comprehensive set of ciss in mouse56 consisting of 2906 loci from seven distinct cancer types (supplementary data 5).,NA
10.1073/pnas.1910668117,2020,TRUE,TRUE,"general-purpose repository, data availability statement",general-purpose repository,FALSE,NA,NA,data deposition: the raw data for figs. 1–5 are available at https://figshare.com/collections/ polymeric_sheet_actuators_with_programmable_bioinstructivity/4682696 (doi: 10.6084/m9. figshare.c.4682696.v1).;     the raw data for figs. 1–5 are available at doi: 10.6084/ m9.figshare.c.4682696.v1.     data deposition: the raw data for figs. 1–5 are available at https://figshare,NA
10.1074/jbc.RA120.014467,2020,TRUE,TRUE,field-specific repository,field-specific repository,FALSE,NA,NA,the ms proteomics data set has been deposited to the proteomexchange consortium via the pride (64) partner repository with the   oxidative regulation of contractile function data set identifier pxd019808.,NA
10.1080/02664763.2020.1788518,2020,FALSE,NA,NA,NA,TRUE,TRUE,supplement,NA,we show in supplementary material section 2 the r implementation of the data generation if the reader might be more familiar with r code and find code in general easier to read.
10.1093/bioinformatics/btz850,2020,FALSE,NA,NA,NA,TRUE,TRUE,github,NA,availability and implementation: the software is available under the mit license at https://github.com/bihealth/ digestiflow-server.
10.1093/braincomms/fcaa158,2020,TRUE,TRUE,"general-purpose repository, data availability statement",general-purpose repository,FALSE,NA,NA,data availability statement the spreadsheets that support the findings of this study are available on the open science framework (https://osf. io/xyekp/).     data availability statement the spreadsheets that support the findings of this study are available on the open science framework,NA
10.1111/2041-210X.13497,2020,TRUE,TRUE,field-specific repository,field-specific repository,FALSE,NA,NA,to  been deposited in the national centre for biotechnology information  circumvent this issue we tested the effect of adding an adapter  (ncbi) sequence read archive (sra; https://www.ncbi.nlm.nih.gov/  by dividing the experiment into two groups (an adapter group and  sra/; accession no. srs2321692).,NA
10.1111/bph.15193,2020,TRUE,TRUE,"supplement, data availability statement",supplement,FALSE,NA,NA,demographics of the delphi panel and full methods and results  used the research is both well designed and analysed as well as  are presented in supporting information s1 delphi and s1 data.  transparently reported.;     this study is presented  compatible with and complementary to other guidelines that have  in supporting information s1 road testing and s2 data.  been published in recent years.   data sharing policies meeting the mark? peerj 5 e3208,NA
10.1113/EP088870,2020,TRUE,TRUE,"supplement, data availability statement",supplement,FALSE,NA,NA,abbreviations: arrive guidelines (animal research: reporting of in vivo experiments)  presented in supporting information s1 delphi and s1 data.;     this study is presented in supporting  on the ethical review of the research (osborne payne & newman  information s1 road testing and s2 data.   data sharing policies meeting the mark? peerj 5 https://doi,NA
10.1126/science.aar5663,2020,TRUE,TRUE,"general-purpose repository, supplement",general-purpose repository,TRUE,TRUE,github,all digitized embryos (fused intensity movies segmentations and meshes) have been deposited to figshare (https://figshare.com/projects/ phallusia_mammillata_embryonic_development/64301) and can be interactively explored through morphonet (www.morphonet.org/).  s1 to s67 tables s1 to s13 references (41–106) mdar reproducibility checklist data s1 to s18 movies s1 to s4 view/request a protocol for this paper from bio-protocol.,the software standard parameter files and tutorials have been deposited to github (https://github.com/astec-segmentation).
10.1126/science.aaz4547,2020,TRUE,TRUE,general-purpose repository,general-purpose repository,FALSE,NA,NA,data and materials availability: experimental director field data the code to detect and analyze the topological loops and the stokes solver are available on dryad (25).,NA
10.1146/annurev-statistics-031219-041104,2020,TRUE,FALSE,"general-purpose repository, data availability statement",NA,TRUE,FALSE,NA,adapted with permission from tom hardwicke and available at https://osf.io/cqrp8 under a cc-by4.0 license.     data availability reusability and analytic reproducibility: evaluating the impact of a mandatory open data policy at the journal cognition. r. soc. open sci. 5(8):180448,it has also been proposed that peer reviewers might decline to review a particular manuscript if critical research resources such as raw data materials and analysis scripts are not made publicly available or the manuscript does not contain a statement explaining why they cannot be made available (morey et al.
10.1177/0271678X20943823,2020,TRUE,TRUE,"supplement, data availability statement",supplement,FALSE,NA,NA,abbreviations: arrive guidelines (animal research: reporting of in vivo experiments).  presented in supporting information s1 delphi and s1 data.;     this study is presented in supporting information s1 road testing and s2 data.   data sharing policies meeting the mark? peerj 2017; 5. doi,NA
10.1186/s12917-020-02451-y,2020,TRUE,TRUE,"general-purpose repository, data availability statement",supplement,FALSE,NA,NA,availability of data and materials all data and supporting information are available at https://osf.io/unc4j/.     availability of data and materials all data and supporting information are available at https://osf,NA
10.1186/s13321-020-00422-x,2020,FALSE,NA,NA,NA,TRUE,TRUE,github,NA,supplementary information on github  a github repository with supplementary information is provided under https​://githu​b.com/volka​merla​b/knowt​ ox_manus​cript​_si. supplementary information on github  a github repository with supplementary information is provided under https​://githu​b.com/volka​merla​b/knowt​ ox_manus​cript​_si.
10.1200/JCO.19.02727,2020,TRUE,FALSE,data availability statement,NA,FALSE,NA,NA,data availability statement disclosures provided by the authors and data availability statement (if applicable) are available with this article at doi,NA
10.12688/f1000research.23224.1,2020,FALSE,NA,NA,NA,TRUE,FALSE,NA,NA,in order to support research a sustainable software must be correct14–16 validatable understandable documented publicly released adequately published (i.e. in persistently identifiable form as software source code17 and potentially in an additional paper which describes the software concept design decisions and development rationale) actively maintained and (re-)usable18–20.
10.12688/f1000research.26707.1,2020,TRUE,TRUE,"general-purpose repository, supplement, data availability statement",supplement,FALSE,NA,NA,identification and selection of trials our protocol and details on the search strategies and specific definitions used for covid-evidence are available on the open science framework (osf)10.    tables 1–5.) data availability underlying data  all data data availability underlying data  all data underlying the results are available as part of the article and no additional source data are required. extended data open science framework,NA
10.1371/journal.pbio.3000410,2020,TRUE,TRUE,"supplement, data availability statement",supplement,FALSE,NA,NA,demographics of the delphi panel and full methods and results are presented in supporting information s1 delphi and s1 data.;     this study is presented in supporting information s1 road testing and s2 data.;     (pdf) s1 data.;     (xlsx) s2 data.   data sharing policies meeting the mark? peerj. 2017; 5. https://doi,NA
10.1371/journal.pgen.1009201,2020,TRUE,TRUE,supplement,supplement,FALSE,NA,NA,xlsx) s2 table,NA
10.1371/journal.pntd.0008898,2020,TRUE,TRUE,supplement,supplement,FALSE,NA,NA,xlsx) s2 table,NA
10.1371/journal.pone.0244497,2020,TRUE,FALSE,supplement,NA,FALSE,NA,NA,xlsx) s2 table,NA
10.21037/atm-20-7514,2020,TRUE,FALSE,data availability statement,NA,FALSE,NA,NA,data sharing statement: available at http://dx.doi,NA
10.3389/fcimb.2020.602836,2020,TRUE,FALSE,data availability statement,NA,FALSE,NA,NA,data availability statement the raw data supporting the conclusions of this article will be made available by the authors without undue reservation. 6  january 2021 | volume 10 | article 602836,NA
10.3389/fgene.2020.562434,2020,TRUE,TRUE,"field-specific repository, data availability statement",field-specific repository,FALSE,NA,NA,raw data and count matrix are available under gene expression omnibus (geo) accession number gse146284.  qpcr of thp-1 culture the total rna from thp-1 cells was extracted with the mirvanatm mirna isolation kit (ambion catalog am1561) and subsequently converted to cdna using the revertaid h minus first strand cdna synthesis kit (thermo scientific catalog k1631). qpcr was done using the syber green mix (bio-rad catalog 172-5124) and run in a quantstudio 7 flex real-time system (applied biosystems catalog 448598).;     data are available under accession number gse146441 (bakker et al. submitted). (iv) caco-2 cells stimulation of the caco-2 cell line with 60 ng/ml ifnγ (peprotech) and deg analysis were previously described (zorro manrique 2020).;     data availability statement  acknowledgments  summary statistics of the ced gwas are available from the european genome-phenome archive (https://www.ebi. ac.uk/ega/studies/egas00001003805) under accession number egas00001003805.      data availability statement  acknowledgments  summary statistics of the ced gwas are available from the european genome-phenome archive (https://www.ebi. ac.uk/ega/studies/egas00001003805,NA
10.3389/fimmu.2020.569006,2020,TRUE,TRUE,field-specific repository,field-specific repository,FALSE,NA,NA,the sequencing data has been deposited to biopoject database (http://www.ncbi.nlm.nih.gov/bioproject/664629) submission id: sub8177406 biopoject id: prjna664629  protein microarray  isolated igm were incubated with the huprot™ array comprised of gst tagged proteins covering 75% of the human protein coding genome (cambridge protein arrays uk).,NA
10.3389/fimmu.2020.606338,2020,TRUE,TRUE,"field-specific repository, general-purpose repository, data availability statement",field-specific repository,TRUE,FALSE,NA,the speciﬁc surface marker proﬁle the timely occurrence of dn b cells in an active immunologic state and antigen speciﬁcity after vaccination and in speciﬁc diseases (3 6) suggest that dn b cell represent a similar b cell subset in both pathogenic and protective  frontiers in immunology | www.frontiersin.org  data availability statement the sequencing data for our article is publicly available in sra under the accession number: prjna675463. results for recombinant  targeted ig transcriptome data analysis the sequencing data was processed using the nf-core bcellmagic pipeline (release 1.2.0 doi: 10.5281/zenodo.3607408) which is open source and available at http://github.com/nf-core/ bcellmagic as part of the nf-core project (37). results for recombinant  targeted ig transcriptome data analysis the sequencing data was processed using the nf-core bcellmagic pipeline (release 1.2.0 doi: 10.5281/zenodo.3607408) which is open source and available at http://github.com/nf-core/ bcellmagic as part of the nf-core project (37).    data availability statement the sequencing data for our article is publicly available in sra under the accession number: prjna675463,results for recombinant  targeted ig transcriptome data analysis the sequencing data was processed using the nf-core bcellmagic pipeline (release 1.2.0 doi: 10.5281/zenodo.3607408) which is open source and available at http://github.com/nf-core/ bcellmagic as part of the nf-core project (37).
10.3389/fimmu.2020.609891,2020,TRUE,TRUE,"field-specific repository, data availability statement",field-specific repository,FALSE,NA,NA,data availability statement rna-sequencing data are deposited with the european genome-phenome archive (ega) under accession number egas00001004867 considering the data protection rights of the human donors.      data availability statement rna-sequencing data are deposited with the european genome-phenome archive (ega) under accession number egas00001004867,NA
10.3389/fimmu.2020.613496,2020,TRUE,TRUE,field-specific repository,field-specific repository,TRUE,TRUE,github,all primary readouts and the background corrected and normalized data are available from the gene expression omnibus database (geo accession number gse124719) and under the bioproject identiﬁer prjna513261.,in addition an osirix software plugin (available at https://github. com/djmlewis/mirrorroi.git) was created which used anatomical  4  february 2021 | volume 11 | article 613496   win et al.
10.3389/fimmu.2020.628287,2020,TRUE,FALSE,data availability statement,NA,FALSE,NA,NA,data availability statement the original contributions presented in the study are included in the article/supplementary material further inquiries can be directed to the corresponding author/s. 10  february 2021 | volume 11 | article 628287,NA
10.3389/fimmu.2020.628923,2020,TRUE,FALSE,data availability statement,NA,TRUE,FALSE,NA,data availability statement  the supplementary material for this article can be found online at: https://www.frontiersin.org/articles/10.3389/ﬁmmu.2020. 628923,available at: https://github.com/guigolab/grapenfhttps://github.com/guigolab/grape-nf.
10.3389/fneur.2020.579438,2020,TRUE,FALSE,data availability statement,NA,FALSE,NA,NA,data availability statement the raw data supporting the conclusions of this article will be made available by the authors without undue reservation. 9  december 2020 | volume 11 | article 579438,NA
10.3389/fonc.2020.578380,2020,TRUE,TRUE,"general-purpose repository, data availability statement",general-purpose repository,FALSE,NA,NA,the quantitative data for this study have been permanently published in a public repository accessible via this link: https://doi.org/10.5281/zenodo.3922212.     data availability statement  acknowledgments  the datasets presented in this study can be found in online repositories. the names of the repository/repositories and accession number(s) can be found below: zenodo,NA
10.3389/fonc.2020.622358,2020,TRUE,FALSE,"general-purpose repository, data availability statement",NA,FALSE,NA,NA,the code used for the tractography pipeline is archived as a shell script on zenodo (https://zenodo.org/record/3732348) and openly accessible (39).;     the code used for the tractbased ﬁxel image construction pipeline is archived as a shell script on zenodo (https://zenodo.org/record/3732348) and openly accessible (39).  within voxels (24 40).;     the script used to perform the statistical analysis and produce this manuscript is available on and archived in zenodo (39).  streamlines comparing the median values for each of the 100 cst segments per 5000 streamlines per hemisphere.;     however code we have used is openly available under the following address (https://doi.org/10.5281/zenodo.3732348) and is cited at the corresponding passage in the article (39).     data availability statement  acknowledgments  the datasets presented in this study can be found in online repositories. the names of the repository/repositories and accession number(s) can be found below: https://doi,NA
10.3389/fphys.2020.616984,2020,TRUE,FALSE,supplement,NA,FALSE,NA,NA,all data are summarized in table 2,NA
10.3389/fpsyg.2020.576580,2020,TRUE,FALSE,"general-purpose repository, supplement",NA,FALSE,NA,NA,in total 2332 novel stimuli are available open access as “art.pics” database at https://osf.io/btwnq/ with standard image characteristics that are comparable to other common visual stimuli material in terms of size variable color distribution complexity intensity and valence measured by image software analysis and by ratings derived from a human experimental validation study [n = 1296 (684f) age 30.2 ± 8.8 y.o.].;     data is stored on osf (https://osf.io/btwnq/) and freely available.    table 4). raw data,NA
10.3390/cells9040859,2020,TRUE,TRUE,field-specific repository,field-specific repository,FALSE,NA,NA,the data of the microarray experiment are deposited in geo and are available through the accession number gse141300 (please note that this superserie is composed of three subseries).;     the data of the gene array experiment are deposited in geo and are available through the accession number gse141300.;     we used scrambled biotinylated mir as a control and identified 338 potential targets   cells 2020 9 859  10 of 21  (deposited in geo accession number gse141300).,NA
10.7554/eLife.52563,2020,TRUE,TRUE,"field-specific repository, data availability statement",field-specific repository,FALSE,NA,NA,transparent reporting form  data availability rna sequencing data have been deposited in arrayexpress - accession no. e-mtab-8459.      data availability rna sequencing data have been deposited in arrayexpress - accession no. e-mtab-8459,NA
