,id,title,doi,linkout,year,journal.id,journal.title
591,pub.1130338323,Virtual Reality in Pain Therapy: A Requirements Analysis for Older Adults with Chronic Back Pain,10.21203/rs.3.rs-24221/v2,https://jneuroengrehab.biomedcentral.com/track/pdf/10.1186/s12984-020-00753-8,2020,jour.1380788,Research Square
592,pub.1130302557,Identification of Biomarkers of Hepatocellular Carcinoma Gene Prognosis Based on Immune-Related lncRNA Signature of Transcriptome Data,10.21203/rs.3.rs-57303/v1,https://www.researchsquare.com/article/rs-57303/latest.pdf,2020,jour.1380788,Research Square
593,pub.1130316447,Single-cell analysis of patient-derived PDAC organoids reveals cell state heterogeneity and a conserved developmental hierarchy,10.1101/2020.08.23.263160,https://europepmc.org/articles/pmc8492851?pdf=render,2020,jour.1293558,bioRxiv
594,pub.1130316348,Evidence for treatment with estradiol for women with SARS-CoV-2 infection,10.1101/2020.08.21.20179671,https://bmcmedicine.biomedcentral.com/track/pdf/10.1186/s12916-020-01851-z,2020,jour.1369542,medRxiv
595,pub.1130296366,Identification of MYOM2 as a candidate gene in hypertrophic cardiomyopathy and Tetralogy of Fallot and its functional evaluation in the Drosophila heart,10.1101/2020.08.18.255760,https://journals.biologists.com/dmm/article-pdf/13/12/dmm045377/1972943/dmm045377.pdf,2020,jour.1293558,bioRxiv
596,pub.1130287437,Clinical and molecular heterogeneity of pineal parenchymal tumors: a consensus study,10.1101/2020.08.18.20172072,https://www.medrxiv.org/content/medrxiv/early/2020/08/22/2020.08.18.20172072.full.pdf,2020,jour.1369542,medRxiv
597,pub.1130259694,"Molecular-based cross-species evaluation of bovine coronavirus infection in cattle, sheep and goats in Ghana.",10.21203/rs.3.rs-24727/v4,https://bmcvetres.biomedcentral.com/track/pdf/10.1186/s12917-020-02606-x,2020,jour.1380788,Research Square
598,pub.1130287538,SOX11 is a lineage-dependency factor and master epigenetic regulator in neuroblastoma,10.1101/2020.08.21.261131,https://www.biorxiv.org/content/biorxiv/early/2020/08/21/2020.08.21.261131.full.pdf,2020,jour.1293558,bioRxiv
599,pub.1130287521,Increased and synchronous recruitment of release sites underlies hippocampal mossy fiber presynaptic potentiation,10.1101/2020.08.21.260638,https://www.biorxiv.org/content/biorxiv/early/2020/08/21/2020.08.21.260638.full.pdf,2020,jour.1293558,bioRxiv
600,pub.1130269674,Circadian Rhythms in Septic Shock Patients,10.21203/rs.3.rs-61571/v1,https://doi.org/10.21203/rs.3.rs-61571/v1,2020,jour.1380788,Research Square
601,pub.1130268857,"The Patient, Investigator, Nurse, Carer Questionnaire (PINC-Q): A Cross-Sectional, Retrospective, Non-Interventional Study Exploring the Impact of Less Frequent Medication Administration with Paliperidone Palmitate 3-Monthly as Maintenance Treatment for Schizophrenia",10.21203/rs.3.rs-59381/v1,https://bmcpsychiatry.biomedcentral.com/track/pdf/10.1186/s12888-021-03305-z,2020,jour.1380788,Research Square
602,pub.1130267818,Focal brain ischemia in mice does not cause electrophysiological signs of critical illness neuropathy,10.21203/rs.3.rs-38882/v4,https://bmcresnotes.biomedcentral.com/track/pdf/10.1186/s13104-020-05248-2,2020,jour.1380788,Research Square
603,pub.1130245661,Accurate identification and quantification of commensal microbiota bound by host immunoglobulins,10.1101/2020.08.19.257501,https://microbiomejournal.biomedcentral.com/track/pdf/10.1186/s40168-020-00992-w,2020,jour.1293558,bioRxiv
604,pub.1130239179,Characteristics and Patient-reported Outcomes Associated to Dropout in Severely Affected Oncological Patients,10.21203/rs.3.rs-60110/v1,https://www.researchsquare.com/article/rs-60110/v1.pdf?c=1631867815000,2020,jour.1380788,Research Square
605,pub.1130232775,"Molecular-based cross-species evaluation of bovine coronavirus infection in cattle, sheep and goats in Ghana.",10.21203/rs.3.rs-24727/v3,https://bmcvetres.biomedcentral.com/track/pdf/10.1186/s12917-020-02606-x,2020,jour.1380788,Research Square
606,pub.1130219304,Amino acids whose intracellular levels change most during aging alter chronological lifespan of fission yeast,10.1101/2020.08.18.256164,https://academic.oup.com/biomedgerontology/article-pdf/76/2/205/35914273/glaa246.pdf,2020,jour.1293558,bioRxiv
607,pub.1130208057,"Seven-day Fasting as a multimodal complex intervention for Adults with Type 1 Diabetes – Feasibility, Benefit and Safety in a Controlled Pilot Study",10.21203/rs.3.rs-57497/v1,https://doi.org/10.1016/j.nut.2021.111169,2020,jour.1380788,Research Square
608,pub.1130219297,IFITM proteins promote SARS-CoV-2 infection and are targets for virus inhibition,10.1101/2020.08.18.255935,https://www.biorxiv.org/content/biorxiv/early/2020/12/28/2020.08.18.255935.full.pdf,2020,jour.1293558,bioRxiv
609,pub.1130189604,The German Corona Consensus Dataset (GECCO): A standardized dataset for COVID-19 research,10.21203/rs.3.rs-51348/v1,https://bmcmedinformdecismak.biomedcentral.com/track/pdf/10.1186/s12911-020-01374-w,2020,jour.1380788,Research Square
610,pub.1130180075,Alectinib Treatment Improves Photodynamic Therapy in Cancer Cell Lines of Different Origin,10.21203/rs.3.rs-52131/v1,https://bmccancer.biomedcentral.com/track/pdf/10.1186/s12885-021-08667-x,2020,jour.1380788,Research Square
611,pub.1130157504,Focal brain ischemia in mice does not cause electrophysiological signs of critical illness neuropathy,10.21203/rs.3.rs-38882/v3,https://bmcresnotes.biomedcentral.com/track/pdf/10.1186/s13104-020-05248-2,2020,jour.1380788,Research Square
612,pub.1130151805,A SARS-CoV-2 neutralizing antibody protects from lung pathology in a COVID-19 hamster model,10.1101/2020.08.15.252320,http://www.cell.com/article/S0092867420312460/pdf,2020,jour.1293558,bioRxiv
613,pub.1130141502,At least seven distinct rotavirus genotype constellations in bats with evidence of reassortment and zoonotic transmissions,10.1101/2020.08.13.250464,https://doi.org/10.1128/mbio.02755-20,2020,jour.1293558,bioRxiv
614,pub.1130140674,Multisensory cueing facilitates naming in aphasia,10.21203/rs.3.rs-28744/v2,https://jneuroengrehab.biomedcentral.com/track/pdf/10.1186/s12984-020-00751-w,2020,jour.1380788,Research Square
615,pub.1130141546,Multisensory processes can compensate for attention deficits in schizophrenia,10.1101/2020.08.14.251405,https://www.biorxiv.org/content/biorxiv/early/2020/12/20/2020.08.14.251405.full.pdf,2020,jour.1293558,bioRxiv
616,pub.1130141480,Challenges and proposed solutions in making clinical research on COVID-19 ethical. A status quo analysis across German research ethics committees,10.1101/2020.08.11.20168773,https://www.medrxiv.org/content/medrxiv/early/2020/08/14/2020.08.11.20168773.full.pdf,2020,jour.1369542,medRxiv
617,pub.1130107533,Physicians’ Prescribing Behaviour and Clinical Practice Patterns for Allergic Rhinitis Management in Italy,10.21203/rs.3.rs-56857/v1,https://clinicalmolecularallergy.biomedcentral.com/track/pdf/10.1186/s12948-020-00135-4,2020,jour.1380788,Research Square
618,pub.1130102961,Mesodermal FGF and BMP govern the sequential stages of zebrafish thyroid specification,10.1101/2020.08.13.249540,https://www.biorxiv.org/content/biorxiv/early/2022/06/01/2020.08.13.249540.full.pdf,2020,jour.1293558,bioRxiv
619,pub.1130099609,Formula-fed and Clostridioides difficile infected neonatal piglets carry a highly diverse and abundant set of antimicrobial resistance genes,10.21203/rs.3.rs-57299/v1,https://www.researchsquare.com/article/rs-57299/latest.pdf,2020,jour.1380788,Research Square
620,pub.1130102810,Single amino acid-promoted reactions link a non-enzymatic chemical network to the early evolution of enzymatic pentose phosphate pathway,10.1101/2020.08.11.245860,https://www.biorxiv.org/content/biorxiv/early/2020/08/12/2020.08.11.245860.full.pdf,2020,jour.1293558,bioRxiv
621,pub.1130079291,Assessment of ethanol-induced toxicity on iPSC-derived human dopaminergic neurons using a novel high-throughput mitochondrial neuronal health (MNH) assay,10.1101/2020.08.12.237461,https://www.frontiersin.org/articles/10.3389/fcell.2020.590540/pdf,2020,jour.1293558,bioRxiv
622,pub.1130074339,Developmental Delay and Its Predictors Among Under-Five Uncomplicated Severe Acute Malnourished Children: a Cross-Sectional Study in Rural Areas of Pakistan,10.21203/rs.3.rs-57484/v1,https://www.researchsquare.com/article/rs-57484/latest.pdf,2020,jour.1380788,Research Square
623,pub.1130065519,Focal brain ischemia in mice does not cause electrophysiological signs of critical illness neuropathy,10.21203/rs.3.rs-38882/v2,https://bmcresnotes.biomedcentral.com/track/pdf/10.1186/s13104-020-05248-2,2020,jour.1380788,Research Square
624,pub.1130052295,Combined physical and cognitive training for older adults with and without cognitive impairment: A systematic review and network meta-analysis of randomized controlled trials,10.1101/2020.08.08.20170654,https://www.medrxiv.org/content/medrxiv/early/2020/11/24/2020.08.08.20170654.full.pdf,2020,jour.1369542,medRxiv
625,pub.1130048495,"Molecular-based cross-species evaluation of bovine coronavirus infection in cattle, sheep and goats in Ghana.",10.21203/rs.3.rs-24727/v2,https://bmcvetres.biomedcentral.com/track/pdf/10.1186/s12917-020-02606-x,2020,jour.1380788,Research Square
626,pub.1130029202,Unification of Sparse Bayesian Learning Algorithms for Electromagnetic Brain Imaging with the Majorization Minimization Framework,10.1101/2020.08.10.243774,https://doi.org/10.1016/j.neuroimage.2021.118309,2020,jour.1293558,bioRxiv
627,pub.1130029201,CD40 provides immune privilege to the bone marrow hematopoietic niche,10.1101/2020.08.10.243691,https://www.biorxiv.org/content/biorxiv/early/2020/08/10/2020.08.10.243691.full.pdf,2020,jour.1293558,bioRxiv
628,pub.1130029145,Deep Learning assisted Peak Curation for large scale LC-MS Metabolomics,10.1101/2020.08.09.242727,http://edoc.mdc-berlin.de/21469/1/21469oa.pdf,2020,jour.1293558,bioRxiv
629,pub.1129992806,Robust Estimation of Noise for Electromagnetic Brain Imaging with the Champagne Algorithm,10.1101/2020.08.07.241943,https://doi.org/10.1016/j.neuroimage.2020.117411,2020,jour.1293558,bioRxiv
630,pub.1129992799,Suppress me if you can: neurofeedback of the readiness potential,10.1101/2020.08.07.241307,https://refubium.fu-berlin.de/bitstream/fub188/32287/1/2021_Schultze-Kraft_etal.pdf,2020,jour.1293558,bioRxiv
631,pub.1129975553,Nerve fibers in the Tumor Microenvironment are co-localized with Tertiary Lymphoid Structures,10.1101/2020.08.07.232322,https://www.biorxiv.org/content/biorxiv/early/2020/08/07/2020.08.07.232322.full.pdf,2020,jour.1293558,bioRxiv
632,pub.1129962699,Auricular Acupuncture for Preoperative Anxiety - Protocol of Systematic Review and Meta-Analysis of Randomized Controlled Clinical Trials.,10.21203/rs.3.rs-54205/v1,https://www.researchsquare.com/article/rs-54205/v1.pdf?c=1604010297000,2020,jour.1380788,Research Square
633,pub.1129949454,Peanut induced anaphylaxis in children and adolescents: data from the European Anaphylaxis Registry,10.22541/au.159672620.00081079,https://refubium.fu-berlin.de/bitstream/fub188/34240/1/2021_Maris_etal.pdf,2020,jour.1381050,Authorea
634,pub.1129907293,Long-term safety and effectiveness of etanercept in JIA: an 18-year experience from the BIKER registry,10.21203/rs.3.rs-21876/v2,https://arthritis-research.biomedcentral.com/track/pdf/10.1186/s13075-020-02326-5,2020,jour.1380788,Research Square
635,pub.1129906558,Magnetic resonance imaging and ultrasound for prediction of residual tumor size in early breast cancer within the ADAPT subtrials,10.21203/rs.3.rs-51805/v1,,2020,jour.1380788,Research Square
636,pub.1129788790,Is combining serum interleukin-6 and C-reactive protein a reliable diagnostic tool in periprosthetic joint infections?,10.21203/rs.3.rs-18526/v2,https://josr-online.biomedcentral.com/track/pdf/10.1186/s13018-020-01864-7,2020,jour.1380788,Research Square
637,pub.1129770783,Blinding in electric current stimulation in subacute neglect patients with current densities of 0.8 A/m²: A cross-over pilot study,10.21203/rs.3.rs-21915/v2,https://bmcresnotes.biomedcentral.com/track/pdf/10.1186/s13104-020-05421-7,2020,jour.1380788,Research Square
638,pub.1129803216,Cabbage and fermented vegetables: from death rate heterogeneity in countries to candidates for mitigation strategies of severe COVID-19,10.22541/au.159611484.40009356,http://spiral.imperial.ac.uk/bitstream/10044/1/82926/2/Cabbage%20and%20fermented%20vegetables%20From%20death%20rate%20heterogeneity%20in%20countries%20to%20candidates%20for%20mitigation%20strategies%20of%20sever.pdf,2020,jour.1381050,Authorea
639,pub.1129781699,Hypophosphataemia in Critically Ill Adults and Children – A Systematic Review,10.21203/rs.3.rs-48985/v1,,2020,jour.1380788,Research Square
640,pub.1129778505,T cell phenotypes associated with metabolically healthy obesity: Results from the Berlin Aging Study II,10.21203/rs.3.rs-49509/v1,https://immunityageing.biomedcentral.com/track/pdf/10.1186/s12979-020-00211-y,2020,jour.1380788,Research Square
641,pub.1129752543,The impact of different negative training data on regulatory sequence predictions,10.1101/2020.07.28.224485,https://journals.plos.org/plosone/article/file?id=10.1371/journal.pone.0237412&type=printable,2020,jour.1293558,bioRxiv
642,pub.1129752457,The German Corona Consensus Dataset (GECCO): A standardized dataset for COVID-19 research,10.1101/2020.07.27.20162636,https://www.medrxiv.org/content/medrxiv/early/2020/07/29/2020.07.27.20162636.full.pdf,2020,jour.1369542,medRxiv
643,pub.1129728565,Kimchi and Asian fermented vegetables: candidates for the partial control of the COVID-19 pandemic,10.22541/au.159593999.91554264,https://www.authorea.com/doi/pdf/10.22541/au.159593999.91554264,2020,jour.1381050,Authorea
644,pub.1129717725,"Evaluation of the online-based self-help programme “Selfapy” in patients with unipolar depression: study protocol for a randomized, blinded parallel group dismantling study",10.21203/rs.3.rs-26062/v1,https://trialsjournal.biomedcentral.com/track/pdf/10.1186/s13063-021-05218-4,2020,jour.1380788,Research Square
645,pub.1129723579,Polycomb-mediated Genome Architecture Enables Long-range Spreading of H3K27 methylation,10.1101/2020.07.27.223438,https://www.biorxiv.org/content/biorxiv/early/2020/07/27/2020.07.27.223438.full.pdf,2020,jour.1293558,bioRxiv
646,pub.1129673596,Sensorimotor functional connectivity: a neurophysiological factor related to BCI performance,10.1101/2020.07.24.220145,https://europepmc.org/articles/pmc7775663?pdf=render,2020,jour.1293558,bioRxiv
647,pub.1129673507,Sunlight exposure exerts immunomodulatory effects to reduce multiple sclerosis severity,10.1101/2020.07.20.20157800,https://europepmc.org/articles/pmc7817192?pdf=render,2020,jour.1369542,medRxiv
648,pub.1129670089,Decreasing alertness modulates perceptual decision-making,10.1101/2020.07.23.218727,https://www.biorxiv.org/content/biorxiv/early/2021/01/23/2020.07.23.218727.full.pdf,2020,jour.1293558,bioRxiv
649,pub.1129653710,KinFragLib: Exploring the Kinase Inhibitor Space Using Subpocket-Focused Fragmentation and Recombination,10.26434/chemrxiv.12696392.v1,https://chemrxiv.org/engage/api-gateway/chemrxiv/assets/orp/resource/item/60c74e19ee301c3a99c7a431/original/kin-frag-lib-exploring-the-kinase-inhibitor-space-using-subpocket-focused-fragmentation-and-recombination.pdf,2020,jour.1315496,ChemRxiv
650,pub.1129586613,The COVID Pandemic - Potential Collateral Damage in a Less Focused Dimension,10.22541/au.159542463.33167181,https://21docs.com/doi/pdf/10.22541/au.159542463.33167181,2020,jour.1381050,Authorea
651,pub.1129581379,Effects of early life stress on bone homeostasis in mice and humans,10.1101/2020.07.21.214122,https://www.mdpi.com/1422-0067/21/18/6634/pdf,2020,jour.1293558,bioRxiv
652,pub.1129510661,Loss of food fermentation in Westernized diet: a risk factor for severe COVID-19?,10.22541/au.159526902.25301228,https://www.authorea.com/doi/pdf/10.22541/au.159526902.25301228,2020,jour.1381050,Authorea
653,pub.1129480075,A novel approach for assessing hypoperfusion in stroke using spatial independent component analysis of resting-state fMRI,10.1101/2020.07.17.208058,https://www.biorxiv.org/content/biorxiv/early/2021/04/19/2020.07.17.208058.full.pdf,2020,jour.1293558,bioRxiv
654,pub.1129480037,Association between consumption of vegetables and COVID-19 mortality at a country level in Europe,10.1101/2020.07.17.20155846,https://www.medrxiv.org/content/medrxiv/early/2020/07/17/2020.07.17.20155846.full.pdf,2020,jour.1369542,medRxiv
655,pub.1129453850,A Systematic Review of Green-Light Laser Vaporization for Superficial Bladder Cancer,10.21203/rs.3.rs-38643/v1,https://www.researchsquare.com/article/rs-38643/v1.pdf?c=1595013589000,2020,jour.1380788,Research Square
656,pub.1129429732,Sulforaphane: from death rate heterogeneity in countries to candidate for prevention of severe COVID-19,10.22541/au.159493397.79345039,https://www.authorea.com/doi/pdf/10.22541/au.159493397.79345039,2020,jour.1381050,Authorea
657,pub.1129376730,"Occupational injuries, daily workload, and fitness levels among fitness and swimming instructors.",10.21203/rs.3.rs-16496/v3,https://www.researchsquare.com/article/rs-16496/v3.pdf?c=1631860184000,2020,jour.1380788,Research Square
658,pub.1129389033,Carboxymethyl Chitosan Reduces Inflammation and Promotes Osteogenesis in a Rabbit Knee Replacement Model,10.21203/rs.3.rs-38842/v1,https://bmcmusculoskeletdisord.biomedcentral.com/track/pdf/10.1186/s12891-020-03803-3,2020,jour.1380788,Research Square
659,pub.1129387191,Detection of subclinical skin manifestation in patients with psoriasis and psoriatic arthritis by fluorescence optical imaging,10.21203/rs.3.rs-32440/v2,https://arthritis-research.biomedcentral.com/track/pdf/10.1186/s13075-020-02277-x,2020,jour.1380788,Research Square
660,pub.1129381955,Functional comparison of MERS-coronavirus lineages reveals increased zoonotic potential of the recombinant lineage 5,10.21203/rs.3.rs-38496/v1,https://www.nature.com/articles/s41467-021-25519-1.pdf,2020,jour.1380788,Research Square
661,pub.1129362607,Decontamination of N95 masks against coronavirus: a scoping review,10.1101/2020.07.11.20151399,https://doi.org/10.1016/j.jdent.2020.103534,2020,jour.1369542,medRxiv
662,pub.1129355452,Proposal for an Implementation Framework for Digital Health Technology in the Intensive Care Unit: A Qualitative Study,10.21203/rs.3.rs-40974/v1,https://doi.org/10.2196/22866,2020,jour.1380788,Research Square
663,pub.1129261078,Sensitive and reproducible determination of clinical HDL proteotypes,10.1101/2020.07.09.191312,https://www.biorxiv.org/content/biorxiv/early/2020/07/10/2020.07.09.191312.full.pdf,2020,jour.1293558,bioRxiv
664,pub.1129139442,"Novel Concepts in Cervical Cancer Screening. A Comparison of VIA, HPV DNA Test and p16ink4a/Ki-67 Dual-Stain Cytology in Western Kenya.",10.21203/rs.3.rs-39673/v1,https://infectagentscancer.biomedcentral.com/track/pdf/10.1186/s13027-020-00323-6,2020,jour.1380788,Research Square
665,pub.1129117985,Efficacy and safety of treatment with omalizumab for chronic spontaneous urticaria- a systematic review for the EAACI Biologicals Guidelines,10.22541/au.159423528.84369076,,2020,jour.1381050,Authorea
666,pub.1129117964,Efficacy and safety of dupilumab for moderate-to-severe atopic dermatitis: a systematic review for the EAACI Biologicals Guidelines,10.22541/au.159423110.06430562,http://hdl.handle.net/10468/12221,2020,jour.1381050,Authorea
667,pub.1129111853,"Limited specificity of serologic tests for SARS-CoV-2 antibody detection, Benin, Western Africa",10.1101/2020.06.29.20140749,https://wwwnc.cdc.gov/eid/article/27/1/pdfs/20-3281.pdf,2020,jour.1369542,medRxiv
668,pub.1129111957,Extra-hematopoietic immunomodulatory role of the SCID-susceptibility gene DOCK-2 identified by stepwise maturation of human iPSCs into clonogenic mesodermal stromal progenitors,10.1101/2020.07.07.192385,https://www.biorxiv.org/content/biorxiv/early/2020/07/07/2020.07.07.192385.full.pdf,2020,jour.1293558,bioRxiv
669,pub.1129077499,Association between consumption of fermented vegetables and COVID-19 mortality at a country level in Europe,10.1101/2020.07.06.20147025,https://www.medrxiv.org/content/medrxiv/early/2020/07/07/2020.07.06.20147025.full.pdf,2020,jour.1369542,medRxiv
670,pub.1129045021,High frequency of cerebrospinal fluid autoantibodies in COVID-19 patients with neurological symptoms,10.1101/2020.07.01.20143214,https://doi.org/10.1016/j.bbi.2020.12.022,2020,jour.1369542,medRxiv
671,pub.1129036989,Focal brain ischemia in mice does not cause electrophysiological signs of critical illness neuropathy,10.21203/rs.3.rs-38882/v1,https://bmcresnotes.biomedcentral.com/track/pdf/10.1186/s13104-020-05248-2,2020,jour.1380788,Research Square
672,pub.1129021334,Transfer RNA fragments replace microRNA regulators of the cholinergic post-stroke immune blockade,10.1101/2020.07.02.20144212,https://europepmc.org/articles/pmc7768686?pdf=render,2020,jour.1369542,medRxiv
673,pub.1128996905,Is structure based drug design ready for selectivity optimization?,10.1101/2020.07.02.185132,https://www.biorxiv.org/content/biorxiv/early/2020/09/22/2020.07.02.185132.full.pdf,2020,jour.1293558,bioRxiv
674,pub.1128979937,Targeting the ubiquitin-proteasome system in a pancreatic cancer subtype with hyperactive MYC,10.1101/2020.07.01.182162,https://febs.onlinelibrary.wiley.com/doi/pdfdirect/10.1002/1878-0261.12835,2020,jour.1293558,bioRxiv
675,pub.1128954901,mTOR inhibitors as radiosensitizers in neuroendocrine neoplasms,10.1101/2020.07.01.181727,https://refubium.fu-berlin.de/bitstream/fub188/30861/1/2021_Exner_etal.pdf,2020,jour.1293558,bioRxiv
676,pub.1128954892,USH2A is a skin end-organ protein necessary for vibration sensing in mice and humans,10.1101/2020.07.01.180919,https://www.biorxiv.org/content/biorxiv/early/2020/07/02/2020.07.01.180919.full.pdf,2020,jour.1293558,bioRxiv
677,pub.1128945509,Are radiopharmaceuticals self-sterilizing? Radiation effect of gallium-68 and lutetium-177 on bacillus pumilus and staphylococcus succinus,10.21203/rs.3.rs-38980/v1,https://www.researchsquare.com/article/rs-38980/v1.pdf?c=1631859547000,2020,jour.1380788,Research Square
678,pub.1128944793,The Safety of Viscum Album L. in A Murine Model: A Reproductive Toxicity Study,10.21203/rs.3.rs-39354/v1,https://www.researchsquare.com/article/rs-39354/v1.pdf?c=1631859381000,2020,jour.1380788,Research Square
679,pub.1128911003,Health Assessment Questionnaire-Disability Index (HAQ-DI) use in modelling disease progression in diffuse cutaneous systemic sclerosis: an analysis from the EUSTAR database,10.21203/rs.3.rs-38370/v1,https://arthritis-research.biomedcentral.com/track/pdf/10.1186/s13075-020-02329-2,2020,jour.1380788,Research Square
680,pub.1128954933,Genetic architecture of host proteins interacting with SARS-CoV-2,10.1101/2020.07.01.182709,https://www.ncbi.nlm.nih.gov/pmc/articles/PMC7337378,2020,jour.1293558,bioRxiv
681,pub.1128912055,TADA – a Machine Learning Tool for Functional Annotation based Prioritisation of Putative Pathogenic CNVs,10.1101/2020.06.30.180711,https://pure.mpg.de/pubman/item/item_3278947_2/component/file_3375052/GenomeBiol_Hertzberg%20et%20al_2022.pdf,2020,jour.1293558,bioRxiv
682,pub.1128877115,Whole-Genome Sequences of the Severe Acute Respiratory Syndrome Coronavirus-2 obtained from Romanian patients between March and June of 2020,10.1101/2020.06.28.175802,https://www.biorxiv.org/content/biorxiv/early/2020/07/07/2020.06.28.175802.full.pdf,2020,jour.1293558,bioRxiv
683,pub.1128728205,Influenza Outbreak Among Students in Ghana: a Report From Three Time Points,10.21203/rs.3.rs-34837/v1,https://www.researchsquare.com/article/rs-34837/v1.pdf?c=1631858424000,2020,jour.1380788,Research Square
684,pub.1128705311,Prognostic value of tumor-infiltrating immune cells in primary colorectal cancer and metastases,10.21203/rs.3.rs-36627/v1,https://www.researchsquare.com/article/rs-36627/v1.pdf?c=1631858365000,2020,jour.1380788,Research Square
685,pub.1128705223,"Everything Counts -- A Method To Determine Viral Suppression Among People Living With Hiv Using Longitudinal Data For The Hiv Care Continuum. - Results Of Two Large, German, Multi-Center Real-Life Cohort Studies Over 20 Years (1999-2018)",10.21203/rs.3.rs-36030/v1,https://bmcpublichealth.biomedcentral.com/track/pdf/10.1186/s12889-020-10088-7,2020,jour.1380788,Research Square
686,pub.1128657225,Tamoxifen reduces inflammatory infiltration of neutrophils in the airways,10.1101/2020.06.19.161919,https://www.biorxiv.org/content/biorxiv/early/2020/06/20/2020.06.19.161919.full.pdf,2020,jour.1293558,bioRxiv
687,pub.1128648452,Asphericity of Tumor FDG Uptake in Non-Small Cell Lung Cancer: Reproducibility and Implications for Harmonization in Multicenter Studies,10.21203/rs.3.rs-35589/v1,https://ejnmmires.springeropen.com/track/pdf/10.1186/s13550-020-00725-y,2020,jour.1380788,Research Square
688,pub.1128648335,Use of Resuscitation promoting factors to screen for tuberculosis infection in household-exposed children in The Gambia,10.21203/rs.3.rs-22482/v3,https://bmcinfectdis.biomedcentral.com/track/pdf/10.1186/s12879-020-05194-1,2020,jour.1380788,Research Square
689,pub.1128637727,"Combining genome-wide studies of breast, prostate, ovarian and endometrial cancers maps cross-cancer susceptibility loci and identifies new genetic associations",10.1101/2020.06.16.146803,https://www.biorxiv.org/content/biorxiv/early/2020/06/29/2020.06.16.146803.full.pdf,2020,jour.1293558,bioRxiv
690,pub.1128569734,"Diagnosing, managing and preventing anaphylaxis: systematic review",10.22541/au.159242098.86730186,https://findresearcher.sdu.dk/ws/files/174120758/all.14580.pdf,2020,jour.1381050,Authorea
