,id,title,doi,linkout,year,journal.id,journal.title
0,pub.1144323008,Protective association of HLA-DRB1*04 subtypes in neurodegenerative diseases implicates acetylated Tau PHF6 sequences,10.1101/2021.12.26.21268354,https://www.medrxiv.org/content/medrxiv/early/2021/12/30/2021.12.26.21268354.full.pdf,2021,jour.1369542,medRxiv
1,pub.1144273355,Federated Trusted Third Party as an Approach for Privacy Preserving Record Linkage in a Large Network of University Medicines in Pandemic Research,10.21203/rs.3.rs-1053445/v1,https://www.researchsquare.com/article/rs-1053445/latest.pdf,2021,jour.1380788,Research Square
2,pub.1144267030,"In contrast to TH2-biased approaches, TH1 COVID-19 vaccines protect Syrian hamsters from severe disease in the absence of dexamethasone-treatable vaccine-associated enhanced respiratory pathology",10.1101/2021.12.28.474359,https://www.biorxiv.org/content/biorxiv/early/2021/12/28/2021.12.28.474359.full.pdf,2021,jour.1293558,bioRxiv
3,pub.1144066079,Haplotype-resolved inversion landscape reveals hotspots of mutational recurrence associated with genomic disorders,10.1101/2021.12.20.472354,https://www.biorxiv.org/content/biorxiv/early/2021/12/20/2021.12.20.472354.full.pdf,2021,jour.1293558,bioRxiv
4,pub.1144066037,Insights into standards of care – dexamethasone and antibodies against COVID-19 in hamster models,10.1101/2021.12.17.473180,https://www.biorxiv.org/content/biorxiv/early/2021/12/20/2021.12.17.473180.full.pdf,2021,jour.1293558,bioRxiv
5,pub.1143978770,Dopaminergic modulation of local non-oscillatory activity and global-network properties in Parkinson’s disease: an EEG study,10.1101/2021.12.17.21267975,https://www.medrxiv.org/content/medrxiv/early/2021/12/17/2021.12.17.21267975.full.pdf,2021,jour.1369542,medRxiv
6,pub.1143978750,Reconstitution of T cell immunity against EBV in the immunocompromised host by adoptive transfer of peptide-stimulated T cells after allogeneic stem cell transplantation,10.1101/2021.12.16.473087,https://www.biorxiv.org/content/biorxiv/early/2021/12/17/2021.12.16.473087.full.pdf,2021,jour.1293558,bioRxiv
7,pub.1143952210,KiSSim: Predicting off-targets from structural similarities in the kinome,10.26434/chemrxiv-2021-n3288,https://chemrxiv.org/engage/api-gateway/chemrxiv/assets/orp/resource/item/61b73ba902d90d059c610e9b/original/ki-s-sim-predicting-off-targets-from-structural-similarities-in-the-kinome.pdf,2021,jour.1315496,ChemRxiv
8,pub.1143939727,Transcriptomic responses of the human kidney to acute injury at single cell resolution,10.1101/2021.12.15.472619,https://www.biorxiv.org/content/biorxiv/early/2021/12/16/2021.12.15.472619.full.pdf,2021,jour.1293558,bioRxiv
9,pub.1143902082,Genomic determinants of Furin cleavage in diverse European SARS-related bat coronaviruses,10.1101/2021.12.15.472779,https://www.biorxiv.org/content/biorxiv/early/2021/12/15/2021.12.15.472779.full.pdf,2021,jour.1293558,bioRxiv
10,pub.1143939604,mRNA booster immunization elicits potent neutralizing serum activity against the SARS-CoV-2 Omicron variant,10.1101/2021.12.14.21267769,https://www.nature.com/articles/s41591-021-01676-0.pdf,2021,jour.1369542,medRxiv
11,pub.1143901963,Oscillations of pause-burst neurons in the STN correlate with the severity of motor signs in Parkinson’s disease,10.1101/2021.12.11.21267521,https://www.medrxiv.org/content/medrxiv/early/2021/12/14/2021.12.11.21267521.full.pdf,2021,jour.1369542,medRxiv
12,pub.1143878556,Interpretable surface-based detection of focal cortical dysplasias: a MELD study,10.1101/2021.12.13.21267721,https://www.medrxiv.org/content/medrxiv/early/2021/12/14/2021.12.13.21267721.full.pdf,2021,jour.1369542,medRxiv
13,pub.1143878509,"Echinacea purpurea for the Long-term Prevention of Viral Respiratory Tract Infections during COVID-19 Pandemic: A Randomized, Open, Controlled, Exploratory Clinical Study",10.1101/2021.12.10.21267582,https://www.medrxiv.org/content/medrxiv/early/2021/12/14/2021.12.10.21267582.full.pdf,2021,jour.1369542,medRxiv
14,pub.1143855703,TeachOpenCADD 2021: Open Source and FAIR Python Pipelines to Assist in Structural Bioinformatics and Cheminformatics Research,10.26434/chemrxiv-2021-8x13n,https://chemrxiv.org/engage/api-gateway/chemrxiv/assets/orp/resource/item/61b6356002d90d6fe15fdabd/original/teach-open-cadd-2021-open-source-and-fair-python-pipelines-to-assist-in-structural-bioinformatics-and-cheminformatics-research.pdf,2021,jour.1315496,ChemRxiv
15,pub.1143853058,Clonal hematopoiesis is associated with protection from Alzheimer’s disease,10.1101/2021.12.10.21267552,https://www.medrxiv.org/content/medrxiv/early/2021/12/13/2021.12.10.21267552.full.pdf,2021,jour.1369542,medRxiv
16,pub.1143859735,"A large, curated, open-source stroke neuroimaging dataset to improve lesion segmentation algorithms",10.1101/2021.12.09.21267554,https://boris.unibe.ch/170773/1/s41597-022-01401-7.pdf,2021,jour.1369542,medRxiv
17,pub.1143859437,Functional brain network and trail making test changes after major surgery and delirium,10.1101/2021.12.10.21267535,https://www.medrxiv.org/content/medrxiv/early/2022/01/10/2021.12.10.21267535.full.pdf,2021,jour.1369542,medRxiv
18,pub.1143859299,Vitamin D Supplementation is Associated with Slower Epigenetic Aging,10.1101/2021.12.10.21267597,https://www.medrxiv.org/content/medrxiv/early/2021/12/11/2021.12.10.21267597.full.pdf,2021,jour.1369542,medRxiv
19,pub.1143788829,Boosting serotonin increases information gathering by reducing subjective cognitive costs,10.1101/2021.12.08.471843,https://www.biorxiv.org/content/biorxiv/early/2021/12/10/2021.12.08.471843.full.pdf,2021,jour.1293558,bioRxiv
20,pub.1143788809,Functional modulation of PTH1R activation and signalling by RAMP2,10.1101/2021.12.08.471790,https://www.biorxiv.org/content/biorxiv/early/2021/12/10/2021.12.08.471790.full.pdf,2021,jour.1293558,bioRxiv
21,pub.1143754742,A correlation map of genome-wide DNA methylation patterns between paired human brain and buccal samples,10.1101/2021.12.09.471962,https://www.biorxiv.org/content/biorxiv/early/2021/12/09/2021.12.09.471962.full.pdf,2021,jour.1293558,bioRxiv
22,pub.1143788735,The single-cell transcriptional landscape of lung carcinoid tumors,10.1101/2021.12.07.471416,http://edoc.mdc-berlin.de/21442/1/21442oa.pdf,2021,jour.1293558,bioRxiv
23,pub.1143690530,Image-based representation of massive spatial transcriptomics datasets,10.1101/2021.12.07.471629,https://www.biorxiv.org/content/biorxiv/early/2021/12/07/2021.12.07.471629.full.pdf,2021,jour.1293558,bioRxiv
24,pub.1143690483,De novo variants in the PSMC3 proteasome AAA-ATPase subunit gene cause neurodevelopmental disorders associated with type I interferonopathies,10.1101/2021.12.07.21266342,https://www.medrxiv.org/content/medrxiv/early/2021/12/07/2021.12.07.21266342.full.pdf,2021,jour.1369542,medRxiv
25,pub.1143640842,A multiplex protein panel assay determines disease severity and is prognostic about outcome in COVID-19 patients,10.1101/2021.12.03.21267253,https://www.medrxiv.org/content/medrxiv/early/2021/12/05/2021.12.03.21267253.full.pdf,2021,jour.1369542,medRxiv
26,pub.1143630076,RPL3L-containing ribosomes modulate mitochondrial activity in the mammalian heart,10.1101/2021.12.04.471171,https://www.biorxiv.org/content/biorxiv/early/2021/12/04/2021.12.04.471171.full.pdf,2021,jour.1293558,bioRxiv
27,pub.1143610979,Non-zero Mean Alpha Oscillations are Evident in Computational Model and Empirical Data,10.1101/2021.12.01.470793,https://www.biorxiv.org/content/biorxiv/early/2022/01/21/2021.12.01.470793.full.pdf,2021,jour.1293558,bioRxiv
28,pub.1143548483,Homeostatic active zone remodeling consolidates memories in the Drosophila mushroom body,10.1101/2021.12.01.470602,https://www.biorxiv.org/content/biorxiv/early/2021/12/01/2021.12.01.470602.full.pdf,2021,jour.1293558,bioRxiv
29,pub.1143538966,"Diabetes Type 2 in the Berlin Aging Study II: Prevalence, Incidence and Severity Over up to Ten Years of Follow-up",10.21203/rs.3.rs-1117909/v1,https://www.researchsquare.com/article/rs-1117909/latest.pdf,2021,jour.1380788,Research Square
30,pub.1143536774,Embodied Word Production of Persons with Parkinson’s Disease in Distinct Motor Conditions,10.21203/rs.3.rs-1100744/v1,https://www.researchsquare.com/article/rs-1100744/latest.pdf,2021,jour.1380788,Research Square
31,pub.1143500089,Concordance of Self- and Informant-Rated Depressive Symptoms in Nursing Home Residents with Dementia: Cross-Sectional Findings,10.21203/rs.3.rs-1086870/v1,https://bmcpsychiatry.biomedcentral.com/track/pdf/10.1186/s12888-022-03876-5,2021,jour.1380788,Research Square
32,pub.1143499973,Hepatitis E Virus (HEV) in Imported and Domestic Camels in Saudi Arabia – A Cross-Sectional Descriptive Molecular Study,10.21203/rs.3.rs-1074591/v1,https://doi.org/10.21203/rs.3.rs-1074591/v1,2021,jour.1380788,Research Square
33,pub.1143492155,The GA4GH Phenopacket schema: A computable representation of clinical data for precision medicine,10.1101/2021.11.27.21266944,https://www.medrxiv.org/content/medrxiv/early/2021/11/30/2021.11.27.21266944.full.pdf,2021,jour.1369542,medRxiv
34,pub.1143438369,Joint Learning of Full-structure Noise in Hierarchical Bayesian Regression Models,10.1101/2021.11.28.470264,https://www.biorxiv.org/content/biorxiv/early/2021/11/28/2021.11.28.470264.full.pdf,2021,jour.1293558,bioRxiv
35,pub.1143333842,Patients with recurrent PVL+-Staphylococcus aureus infections show enhanced sensitivity to PVL-mediated formation of atypical NETs,10.1101/2021.11.26.470012,https://www.biorxiv.org/content/biorxiv/early/2021/11/26/2021.11.26.470012.full.pdf,2021,jour.1293558,bioRxiv
36,pub.1143333841,Input to cortical layer 1 of somatosensory cortex,10.1101/2021.11.26.469979,https://www.biorxiv.org/content/biorxiv/early/2021/11/26/2021.11.26.469979.full.pdf,2021,jour.1293558,bioRxiv
37,pub.1143438293,DeepSpot: a deep neural network for RNA spot enhancement in smFISH microscopy images,10.1101/2021.11.25.469984,https://hal.archives-ouvertes.fr/hal-03659677/file/deepspot-a-deep-neural-network-for-rna-spot-enhancement-in-smfish-microscopy-images.pdf,2021,jour.1293558,bioRxiv
38,pub.1143333682,Synergetic measures to contain highly transmissible variants of SARS-CoV-2,10.1101/2021.11.24.21266824,https://www.medrxiv.org/content/medrxiv/early/2021/12/23/2021.11.24.21266824.full.pdf,2021,jour.1369542,medRxiv
39,pub.1143333661,Smoking-dependent expression alterations in nasal epithelium reveal immune impairment linked to germline variation and lung cancer risk,10.1101/2021.11.24.21266740,https://www.medrxiv.org/content/medrxiv/early/2021/11/24/2021.11.24.21266740.full.pdf,2021,jour.1369542,medRxiv
40,pub.1143319738,Pausing methotrexate improves immunogenicity of COVID-19 vaccination in elderly patients with rheumatic diseases,10.1101/2021.11.17.21266441,https://www.medrxiv.org/content/medrxiv/early/2022/02/23/2021.11.17.21266441.full.pdf,2021,jour.1369542,medRxiv
41,pub.1143258060,in NS,10.22541/au.163736696.65238914/v1,https://radiopharmaconnect.srsweb.org/doi/pdf/10.22541/au.163736696.65238914,2021,jour.1381050,Authorea
42,pub.1143052142,A chemerin peptide analog stimulates tumor growth in two xenograft mouse models of human colorectal carcinoma,10.1101/2021.11.19.469262,https://refubium.fu-berlin.de/bitstream/fub188/36147/1/2021_Friebus-Kardash_etal.pdf,2021,jour.1293558,bioRxiv
43,pub.1143051167,GWAS defines pathogenic signaling pathways and prioritizes drug targets for IgA nephropathy,10.1101/2021.11.19.21265383,https://www.medrxiv.org/content/medrxiv/early/2021/11/20/2021.11.19.21265383.full.pdf,2021,jour.1369542,medRxiv
44,pub.1142904432,Simultaneous multicolor DNA-PAINT without sequential fluid exchange using spectral demixing,10.1101/2021.11.19.469218,https://www.biorxiv.org/content/biorxiv/early/2021/11/19/2021.11.19.469218.full.pdf,2021,jour.1293558,bioRxiv
45,pub.1142726556,Validation of cervical lesion proportion measure using a gridded imaging technique to assess cervical pathology in women with genital schistosomiasis,10.1101/2021.11.16.468781,https://www.biorxiv.org/content/biorxiv/early/2021/11/19/2021.11.16.468781.full.pdf,2021,jour.1293558,bioRxiv
46,pub.1142729666,Activating silent glycolysis bypasses in Escherichia coli,10.1101/2021.11.18.468982,https://www.biorxiv.org/content/biorxiv/early/2021/11/18/2021.11.18.468982.full.pdf,2021,jour.1293558,bioRxiv
47,pub.1142620083,A 3D RANGE MODULATOR FOR ULTRA-SHORT PROTON FLASH IRRADIATION,10.14293/s2199-1006.1.sor-.pphza3o.v1,https://www.scienceopen.com/document_file/e4724a0b-e436-4e2a-b75e-5b10c6962300/ScienceOpen/ePoster.pdf,2021,jour.1381049,ScienceOpen Preprints
48,pub.1142616495,Change point detection for clustered expression data,10.21203/rs.3.rs-605289/v3,https://bmcgenomics.biomedcentral.com/track/pdf/10.1186/s12864-022-08680-9,2021,jour.1380788,Research Square
49,pub.1143257985,Efficacy and safety of allergen immunotherapy for IgE-mediated food allergy: systematic review and meta-analysis,10.22541/au.163700696.66686852/v1,https://www.authorea.com/doi/pdf/10.22541/au.163700696.66686852,2021,jour.1381050,Authorea
50,pub.1143257971,Efficacy and safety of biological therapies for children and adults with IgE-mediated food allergy: systematic review,10.22541/au.163698336.62595235/v1,https://www.authorea.com/doi/pdf/10.22541/au.163698336.62595235,2021,jour.1381050,Authorea
51,pub.1142712053,Early and rapid identification of COVID-19 patients with neutralizing type I-interferon auto-antibodies by an easily implementable algorithm,10.1101/2021.11.12.21266249,https://www.medrxiv.org/content/medrxiv/early/2021/11/17/2021.11.12.21266249.full.pdf,2021,jour.1369542,medRxiv
52,pub.1142602272,Accelerated Hyper-Versus Normofractionated Radiochemotherapy with Temozolomide in Patients with Glioblastoma: A Multicenter Retrospective Analysis.,10.21203/rs.3.rs-1066431/v1,https://link.springer.com/content/pdf/10.1007/s11060-021-03926-0.pdf,2021,jour.1380788,Research Square
53,pub.1142594430,Change point detection for clustered expression data,10.21203/rs.3.rs-605289/v2,https://bmcgenomics.biomedcentral.com/track/pdf/10.1186/s12864-022-08680-9,2021,jour.1380788,Research Square
54,pub.1142614927,Haplotype-aware single-cell multiomics uncovers functional effects of somatic structural variation,10.1101/2021.11.11.468039,https://www.biorxiv.org/content/biorxiv/early/2021/11/13/2021.11.11.468039.full.pdf,2021,jour.1293558,bioRxiv
55,pub.1143247671,MicroRNA-profiling of miR-371~373- and miR-302/367-clusters in Serum and Cerebrospinal Fluid Identify Patients with Intracranial Germ Cell Tumors,10.21203/rs.3.rs-1054745/v1,https://doi.org/10.21203/rs.3.rs-1054745/v1,2021,jour.1380788,Research Square
56,pub.1142604794,Nachhaltige Strategien gegen die COVID-19-Pandemie in Deutschland im  Winter 2021/2022,10.48550/arxiv.2111.08000,,2021,jour.1371339,arXiv
57,pub.1142473214,Cardiac Activity Impacts Cortical Motor Excitability,10.21203/rs.3.rs-1023617/v1,https://www.researchsquare.com/article/rs-1023617/latest.pdf,2021,jour.1380788,Research Square
58,pub.1142545712,"Cognitive enhancement: Effects of methylphenidate, modafinil and caffeine on latent memory and resting state functional connectivity in healthy adults",10.1101/2021.11.07.21266019,https://www.medrxiv.org/content/medrxiv/early/2022/04/21/2021.11.07.21266019.full.pdf,2021,jour.1369542,medRxiv
59,pub.1142535516,The molecular evolution of spermatogenesis across mammals,10.1101/2021.11.08.467712,https://www.biorxiv.org/content/biorxiv/early/2021/11/08/2021.11.08.467712.full.pdf,2021,jour.1293558,bioRxiv
60,pub.1142530741,Genetic Contributions to Early and Late Onset Ischemic Stroke,10.1101/2021.11.06.21265795,https://www.medrxiv.org/content/medrxiv/early/2021/11/08/2021.11.06.21265795.full.pdf,2021,jour.1369542,medRxiv
61,pub.1142459645,Metabolic Profile in Endothelial Cells of Chronic Thromboembolic Pulmonary Hypertension and Pulmonary Arterial Hypertension.,10.21203/rs.3.rs-1008061/v1,https://www.nature.com/articles/s41598-022-06238-z.pdf,2021,jour.1380788,Research Square
62,pub.1142525400,Protection of nascent DNA at stalled replication forks is mediated by phosphorylation of RIF1 intrinsically disordered region,10.1101/2021.11.04.467328,https://doi.org/10.7554/elife.75047,2021,jour.1293558,bioRxiv
63,pub.1142477889,Increasing the throughput of sensitive proteomics by plexDIA,10.1101/2021.11.03.467007,https://www.biorxiv.org/content/biorxiv/early/2021/11/04/2021.11.03.467007.full.pdf,2021,jour.1293558,bioRxiv
64,pub.1142329137,Acidic Skin Care Promotes Cutaneous Microbiome Recovery And Skin Physiology in An Acute Stratum Corneum Stress Model,10.21203/rs.3.rs-1016070/v1,https://www.researchsquare.com/article/rs-1016070/latest.pdf,2021,jour.1380788,Research Square
65,pub.1142322558,The Role of Gestational Diabetes Mellitus and Pelvic Floor 3D-Ultrasound Markers at the Second and Third Trimester of Pregnancy Predicting 6-18 Months Postpartum Urinary Incontinence: Preliminary Results From a Prospective Cohort,10.21203/rs.3.rs-985987/v1,https://www.researchsquare.com/article/rs-985987/latest.pdf,2021,jour.1380788,Research Square
66,pub.1142349518,Bi-allelic variants in CHKA cause a neurodevelopmental disorder with epilepsy and microcephaly,10.1101/2021.10.21.21265050,https://www.medrxiv.org/content/medrxiv/early/2021/10/31/2021.10.21.21265050.full.pdf,2021,jour.1369542,medRxiv
67,pub.1142319012,The autophagy activator Spermidine reduces neuroinflammation and soluble amyloid beta in an Alzheimer’s disease mouse model,10.1101/2021.10.28.466219,https://figshare.com/articles/journal_contribution/Spermidine_reduces_neuroinflammation_and_soluble_amyloid_beta_in_an_Alzheimer_s_disease_mouse_model_/20254215/1/files/36189948.pdf,2021,jour.1293558,bioRxiv
68,pub.1142323976,A Locus Coeruleus- dorsal CA1 dopaminergic circuit modulates memory linking,10.1101/2021.10.27.466138,https://www.biorxiv.org/content/biorxiv/early/2021/10/28/2021.10.27.466138.full.pdf,2021,jour.1293558,bioRxiv
69,pub.1142320750,Chronic stroke sensorimotor impairment is related to smaller hippocampal volumes: An ENIGMA analysis,10.1101/2021.10.26.465924,http://dsp.tecnalia.com/bitstream/11556/1377/1/JAHA.121.025109.pdf,2021,jour.1293558,bioRxiv
70,pub.1142318099,Inferring Deep Brain Stimulation Induced Short-term Synaptic Plasticity Using Novel Dual Optimization Algorithm,10.1101/2021.10.26.465953,https://www.biorxiv.org/content/biorxiv/early/2021/10/28/2021.10.26.465953.full.pdf,2021,jour.1293558,bioRxiv
71,pub.1142248297,Distinct effects of single plant-based vs. animal-based meals on satiety and mood revealed by real-world smartphone-embedded studies,10.1101/2021.10.24.21265240,https://www.medrxiv.org/content/medrxiv/early/2021/10/26/2021.10.24.21265240.full.pdf,2021,jour.1369542,medRxiv
72,pub.1142213443,TransferGWAS: GWAS of images using deep transfer learning,10.1101/2021.10.22.465430,https://www.biorxiv.org/content/biorxiv/early/2022/07/29/2021.10.22.465430.full.pdf,2021,jour.1293558,bioRxiv
73,pub.1142194647,Genome-wide association study identifies new locus associated with OCD,10.1101/2021.10.13.21261078,https://www.medrxiv.org/content/medrxiv/early/2021/10/23/2021.10.13.21261078.full.pdf,2021,jour.1369542,medRxiv
74,pub.1145184208,CACHE (Critical Assessment of Computational Hit-finding Experiments): A public-private partnership benchmarking initiative to enable the development of computational methods for hit-finding,10.26434/chemrxiv-2021-rzq4n,https://chemrxiv.org/engage/api-gateway/chemrxiv/assets/orp/resource/item/6168ba62f718dfc39bdee0db/original/cache-critical-assessment-of-computational-hit-finding-experiments-a-public-private-partnership-benchmarking-initiative-to-enable-the-development-of-computational-methods-for-hit-finding.pdf,2021,jour.1315496,ChemRxiv
75,pub.1142800788,CACHE (Critical Assessment of Computational Hit-finding Experiments): A public-private partnership benchmarking initiative to enable the development of computational methods for hit-finding,10.33774/chemrxiv-2021-rzq4n,https://chemrxiv.org/engage/api-gateway/chemrxiv/assets/orp/resource/item/6168ba62f718dfc39bdee0db/original/cache-critical-assessment-of-computational-hit-finding-experiments-a-public-private-partnership-benchmarking-initiative-to-enable-the-development-of-computational-methods-for-hit-finding.pdf,2021,jour.1315496,ChemRxiv
76,pub.1142783646,Climate Change and Global Health: A Call to more Research and more Action,10.22541/au.163492618.81492633/v1,,2021,jour.1381050,Authorea
77,pub.1142167739,NOXA expression drives synthetic lethality to RUNX1 inhibition in pancreatic cancer,10.1101/2021.10.21.465266,http://edoc.mdc-berlin.de/21375/1/21375oa.pdf,2021,jour.1293558,bioRxiv
78,pub.1142164162,Persistent synaptic inhibition of the subthalamic nucleus by high frequency stimulation,10.1101/2021.10.20.465131,https://www.biorxiv.org/content/biorxiv/early/2021/10/21/2021.10.20.465131.full.pdf,2021,jour.1293558,bioRxiv
79,pub.1142783598,Management and outcome of suspected and confirmed COVID-19 (SARS-CoV-2) vaccine hypersensitivity.,10.22541/au.163471495.59691401/v1,https://www.authorea.com/doi/pdf/10.22541/au.163471495.59691401,2021,jour.1381050,Authorea
80,pub.1142109850,"Post-entry, spike-dependent replication advantage of B.1.1.7 and B.1.617.2 over B.1 SARS-CoV-2 in an ACE2-deficient human lung cell line",10.1101/2021.10.20.465121,,2021,jour.1293558,bioRxiv
81,pub.1142099537,Modelling altered signalling of G-protein coupled receptors in inflamed environment to advance drug design,10.1101/2021.10.20.465073,https://www.biorxiv.org/content/biorxiv/early/2021/10/20/2021.10.20.465073.full.pdf,2021,jour.1293558,bioRxiv
82,pub.1142047245,Preserved T cell responses to SARS-CoV-2 in anti-CD20 treated multiple sclerosis,10.1101/2021.10.11.21264694,https://www.medrxiv.org/content/medrxiv/early/2021/10/22/2021.10.11.21264694.full.pdf,2021,jour.1369542,medRxiv
83,pub.1141942308,Separating neural oscillations from aperiodic 1/f activity: challenges and recommendations,10.1101/2021.10.15.464483,https://link.springer.com/content/pdf/10.1007/s12021-022-09581-8.pdf,2021,jour.1293558,bioRxiv
84,pub.1141924868,Brain Mineralocorticoid receptor in health and disease: from molecular signaling to cognitive and emotional function,10.22541/au.163430674.41522858/v1,https://www.authorea.com/doi/pdf/10.22541/au.163430674.41522858,2021,jour.1381050,Authorea
85,pub.1141918765,Visual space curves before eye movements,10.1101/2021.10.13.464140,https://www.biorxiv.org/content/biorxiv/early/2021/12/29/2021.10.13.464140.full.pdf,2021,jour.1293558,bioRxiv
86,pub.1141891841,Studying and Mitigating the Effects of Data Drifts on ML Model Performance at the Example of Chemical Toxicity Data,10.21203/rs.3.rs-945085/v1,https://www.nature.com/articles/s41598-022-09309-3.pdf,2021,jour.1380788,Research Square
87,pub.1141865083,"Low and high IgE is linked to improvement and worsening of chronic urticaria during pregnancy, respectively",10.22541/au.163410623.36485357/v1,https://doi.org/10.22541/au.163410623.36485357/v1,2021,jour.1381050,Authorea
88,pub.1141864095,Exploring Variation of Coverage and Access to Dental Care for Adults in 11 European Countries: A Vignette Approach,10.21203/rs.3.rs-964070/v1,https://bmcoralhealth.biomedcentral.com/track/pdf/10.1186/s12903-022-02095-4,2021,jour.1380788,Research Square
89,pub.1141823283,Reverse engineering of metacognition,10.1101/2021.10.10.463812,https://doi.org/10.7554/elife.75420,2021,jour.1293558,bioRxiv
90,pub.1141793584,Linking Profiles of Pathway Activation with Clinical Motor Improvements – a Retrospective Computational Study,10.1101/2021.10.08.21264743,https://www.medrxiv.org/content/medrxiv/early/2021/10/11/2021.10.08.21264743.full.pdf,2021,jour.1369542,medRxiv
91,pub.1141793576,Neandertal introgression dissects the genetic landscape of neuropsychiatric disorders and associated behavioral phenotypes,10.1101/2021.10.08.21264688,https://www.medrxiv.org/content/medrxiv/early/2021/10/11/2021.10.08.21264688.full.pdf,2021,jour.1369542,medRxiv
92,pub.1141750001,Promoter repression and 3D-restructuring resolves divergent developmental gene expression in TADs,10.1101/2021.10.08.463672,https://www.biorxiv.org/content/biorxiv/early/2021/10/09/2021.10.08.463672.full.pdf,2021,jour.1293558,bioRxiv
93,pub.1141727447,Harmoni: a Method for Eliminating Spurious Interactions due to the Harmonic Components in Neuronal Data,10.1101/2021.10.06.463319,https://doi.org/10.1016/j.neuroimage.2022.119053,2021,jour.1293558,bioRxiv
94,pub.1141727444,An integrative omics approach reveals posttranscriptional mechanisms underlying circadian temperature compensation,10.1101/2021.10.06.463236,https://www.biorxiv.org/content/biorxiv/early/2021/10/08/2021.10.06.463236.full.pdf,2021,jour.1293558,bioRxiv
95,pub.1141733445,Borderline Personality Disorder and the Big Five: Molecular Genetic Analyses Indicate Shared Genetic Architecture with Neuroticism and Openness,10.21203/rs.3.rs-958220/v1,https://www.nature.com/articles/s41398-022-01912-2.pdf,2021,jour.1380788,Research Square
96,pub.1141698248,A longitudinal analysis of pneumococcal vaccine serotypes in pneumonia patients in Germany,10.1101/2021.10.07.21264682,https://www.medrxiv.org/content/medrxiv/early/2021/10/21/2021.10.07.21264682.full.pdf,2021,jour.1369542,medRxiv
97,pub.1141698099,"Relationship between five Epigenetic Clocks, Telomere Length and Functional Capacity assessed in Older Adults: Cross-sectional and Longitudinal Analyses",10.1101/2021.10.05.21264547,https://www.medrxiv.org/content/medrxiv/early/2021/10/07/2021.10.05.21264547.full.pdf,2021,jour.1369542,medRxiv
98,pub.1141698098,Serum but not mucosal antibody responses are associated with pre-existing SARS-CoV-2 spike cross-reactive CD4+ T cells following BNT162b2 vaccination in the elderly,10.1101/2021.10.05.21264545,https://www.medrxiv.org/content/medrxiv/early/2021/12/19/2021.10.05.21264545.full.pdf,2021,jour.1369542,medRxiv
